Sheet: Tabla C9
A1: 1 | B1: ACHO | C1: RIOS | D1: NIMIA | E1: PERÚ | F1: 43374968 | G1: 2013-02-01T00:00:00.000 | H1: Sí | I1: BACHILLER | J1: EDUCACION | K1: UNIVERSIDAD CATOLICA SEDES SAPIENTIAE | L1: PERÚ | M1: Sí | N1: No | O1: No | P1: Contratado | Q1: Tiempo Completo | R1: 8 | S1: 32 | T1: 40 | U1: No | V1: No | W1: 2016 - I
A2: =R[-1]C+1 -> 2 | B2: ACOSTA | C2: QUISPE | D2: PAUL HENRY | E2: PERÚ | F2: 10198993 | G2: 2010-09-06T00:00:00.000 | H2: Sí | I2: BACHILLER | J2: CIENCIAS ECONOMICAS | K2: UNIVERSIDAD INCA GARCILASO DE LA VEGA | L2: PERÚ | M2: Sí | N2: No | O2: No | P2: Contratado | Q2: Tiempo Parcial | R2: 12 | S2: 0 | T2: 12 | U2: No | V2: No | W2: 2016 - I
A3: =R[-1]C+1 -> 3 | B3: ACUÑA | C3: BERROSPI | D3: ALEX | E3: PERÚ | F3: 06740033 | G3: 2011-03-08T00:00:00.000 | H3: Sí | I3: MAESTRO | J3: ADMINISTRACION | K3: ESCUELA DE ADMINISTRACION DE NEGOCIOS PARA GRADUADOS - ESAN | L3: PERÚ | M3: Sí | N3: No | O3: No | P3: Contratado | Q3: Tiempo Parcial | R3: 4 | S3: 0 | T3: 4 | U3: No | V3: No | W3: 2016 - I
A4: =R[-1]C+1 -> 4 | B4: AGUILAR | C4: LAGUNA | D4: ASTRID | E4: PERÚ | F4: 22502265 | G4: 2008-04-12T00:00:00.000 | H4: Sí | I4: BACHILLER | J4: LINGUISTICA | K4: UNIVERSIDAD NACIONAL MAYOR DE SAN MARCOS | L4: PERÚ | M4: Sí | N4: No | O4: No | P4: Contratado | Q4: Tiempo Parcial | R4: 12 | S4: 4 | T4: 16 | U4: No | V4: No | W4: 2016 - I
A5: =R[-1]C+1 -> 5 | B5: AGUILAR | C5: PAREDES | D5: ERNESTO DARWIN | E5: PERÚ | F5: 32987729 | G5: 2014-03-17T00:00:00.000 | H5: Sí | I5: BACHILLER | J5: GEOGRAFIA | K5: UNIVERSIDAD NACIONAL MAYOR DE SAN MARCOS | L5: PERÚ | M5: Sí | N5: No | O5: No | P5: Contratado | Q5: Tiempo Parcial | R5: 10 | S5: 0 | T5: 10 | U5: No | V5: No | W5: 2016 - I
A6: =R[-1]C+1 -> 6 | B6: AGUILAR | C6: RUIZ | D6: EZSEQUIEL | E6: PERÚ | F6: 00838529 | G6: 2013-03-18T00:00:00.000 | H6: Sí | I6: BACHILLER | J6: INGENIERIA CIVIL | K6: UNIVERSIDAD NACIONAL DE SAN MARTIN | L6: PERÚ | M6: Sí | N6: No | O6: No | P6: Contratado | Q6: Tiempo Parcial | R6: 8 | S6: 0 | T6: 8 | U6: No | V6: No | W6: 2016 - I
A7: =R[-1]C+1 -> 7 | B7: AGUIRRE | C7: QUINTANILLA | D7: MERLE MILAGROS | E7: PERÚ | F7: 40377484 | G7: 2012-04-02T00:00:00.000 | H7: Sí | I7: BACHILLER | J7: EDUCACION | K7: UNIVERSIDAD FEMENINA DEL SAGRADO CORAZON | L7: PERÚ | M7: Sí | N7: No | O7: No | P7: Contratado | Q7: Tiempo Parcial | R7: 8 | S7: 0 | T7: 8 | U7: No | V7: No | W7: 2016 - I
A8: =R[-1]C+1 -> 8 | B8: ALARCON | C8: MORE | D8: MODESTO | E8: PERÚ | F8: 07143360 | G8: 2014-03-14T00:00:00.000 | H8: Sí | I8: BACHILLER | J8: INGENIERIA ELECTRONICA | K8: UNIVERSIDAD NACIONAL DE INGENIERIA | L8: PERÚ | M8: Sí | N8: No | O8: No | P8: Contratado | Q8: Tiempo Parcial | R8: 18 | S8: 5 | T8: 23 | U8: No | V8: Sí | W8: 2016 - I
A9: =R[-1]C+1 -> 9 | B9: ALAYZA | C9: ARIAS | D9: MANUEL ENRIQUE | E9: PERÚ | F9: 07809580 | G9: 2014-01-20T00:00:00.000 | H9: Sí | I9: BACHILLER | J9: DERECHO | K9: PONTIFICIA UNIVERSIDAD CATOLICA DEL PERU | L9: PERÚ | M9: Sí | N9: No | O9: No | P9: Contratado | Q9: Tiempo Completo | R9: 0 | S9: 40 | T9: 40 | U9: No | V9: No | W9: 2016 - I | X9: COORDINADOR ADMINISTRATIVO FACULTAD DE DERECHO Y CIENCIAS POLITICAS
A10: =R[-1]C+1 -> 10 | B10: ALBARRAN | C10: MEDINA | D10: ELVIA | E10: PERÚ | F10: 43881278 | G10: 2013-10-09T00:00:00.000 | H10: Sí | I10: BACHILLER | J10: ECONOMIA | K10: UNIVERSIDAD CATOLICA SEDES SAPIENTIAE | L10: PERÚ | M10: Sí | N10: No | O10: No | P10: Contratado | Q10: Tiempo Completo | R10: 0 | S10: 40 | T10: 40 | U10: No | V10: No | W10: 2016 - I | X10: JEFA DE OFICINA DE PROYECTOS
A11: =R[-1]C+1 -> 11 | B11: ALBITRES | C11: INFANTES | D11: JHONNY JAVIER | E11: PERÚ | F11: 18067237 | G11: 2015-09-21T00:00:00.000 | H11: No | I11: MAESTRO | J11: MAESTRO EN DOCENCIA SUPERIOR E INVESTIGACION UNIVERSITARIA | K11: UNIVERSIDAD NACIONAL JOSE FAUSTINO SANCHEZ CARRION | L11: PERÚ | M11: Sí | N11: No | O11: No | P11: Contratado | Q11: Tiempo Parcial | R11: 16 | S11: 0 | T11: 16 | U11: No | V11: Sí | W11: 2016 - I
A12: =R[-1]C+1 -> 12 | B12: ALBUJAR | C12: DE LA CRUZ | D12: MARIA MALENA | E12: PERÚ | F12: 41349511 | G12: 2008-02-01T00:00:00.000 | H12: Sí | I12: BACHILLER | J12: ECONOMIA | K12: UNIVERSIDAD CATOLICA SEDES SAPIENTIAE | L12: PERÚ | M12: Sí | N12: No | O12: No | P12: Ordinario Auxiliar | Q12: Tiempo Completo | R12: 0 | S12: 40 | T12: 40 | U12: No | V12: No | W12: 2016 - I | X12: COORDINADORA PROYECTO PLUSPETROL
A13: =R[-1]C+1 -> 13 | B13: ALCANTARA | C13: BOZA | D13: FRANCISCO ALEJANDRO | E13: PERÚ | F13: 27074721 | G13: 2012-10-12T00:00:00.000 | H13: Sí | I13: DOCTOR | J13: DOCTORIS PHILOSOPHIAE RECURSOS HIDRICOS | K13: UNIVERSIDAD NACIONAL AGRARIA LA MOLINA | L13: PERÚ | M13: Sí | N13: No | O13: No | P13: Contratado | Q13: Tiempo Completo | R13: 18 | S13: 22 | T13: 40 | U13: Sí | V13: Sí | W13: 2016 - I
A14: =R[-1]C+1 -> 14 | B14: ALEGRE | C14: CALDERON | D14: LUIS ENRIQUE | E14: PERÚ | F14: 32899961 | G14: 2013-10-01T00:00:00.000 | H14: Sí | I14: BACHILLER | J14: CIENCIAS ECONOMICAS | K14: UNIVERSIDAD NACIONAL DE TRUJILLO | L14: PERÚ | M14: Sí | N14: No | O14: No | P14: Contratado | Q14: Tiempo Parcial | R14: 20 | S14: 0 | T14: 20 | U14: No | V14: No | W14: 2016 - I
A15: =R[-1]C+1 -> 15 | B15: ALFARO | C15: PALACIOS DE HUAITA | D15: EDITH BETTY | E15: PERÚ | F15: 06095016 | G15: 2006-04-01T00:00:00.000 | H15: Sí | I15: MAESTRO | J15: EDUCACION | K15: PONTIFICIA UNIVERSIDAD CATOLICA DEL PERU | L15: PERÚ | M15: Sí | N15: No | O15: No | P15: Ordinario Asociado | Q15: Tiempo Completo | R15: 4 | S15: 36 | T15: 40 | U15: No | V15: Sí | W15: 2016 - I
A16: =R[-1]C+1 -> 16 | B16: ALIAGA | C16: ROTA | D16: LUIS ANTONIO | E16: PERÚ | F16: 19850381 | G16: 2009-05-01T00:00:00.000 | H16: Sí | I16: BACHILLER | J16: INDUSTRIAS ALIMENTARIAS | K16: UNIVERSIDAD NACIONAL DEL CENTRO DEL PERU | L16: PERÚ | M16: Sí | N16: No | O16: No | P16: Ordinario Auxiliar | Q16: Tiempo Completo | R16: 4 | S16: 36 | T16: 40 | U16: No | V16: No | W16: 2016 - I
A17: =R[-1]C+1 -> 17 | B17: ALVA | C17: PALOMARES | D17: GLADIA MARIBEL | E17: PERÚ | F17: 09638521 | G17: 2007-04-09T00:00:00.000 | H17: Sí | I17: BACHILLER | J17: DERECHO Y CIENCIAS POLITICAS | K17: UNIVERSIDAD DE SAN MARTIN DE PORRES | L17: PERÚ | M17: Sí | N17: No | O17: No | P17: Contratado | Q17: Tiempo Parcial | R17: 4 | S17: 0 | T17: 4 | U17: No | V17: No | W17: 2016 - I
A18: =R[-1]C+1 -> 18 | B18: ALVA | C18: PRETEL | D18: ROSSIO DEL PILAR | E18: PERÚ | F18: 17831799 | G18: 2013-02-15T00:00:00.000 | H18: Sí | I18: BACHILLER | J18: CIENCIAS BIOLOGICAS | K18: UNIVERSIDAD NACIONAL DE TRUJILLO | L18: PERÚ | M18: Sí | N18: No | O18: No | P18: Contratado | Q18: Tiempo Completo | R18: 8 | S18: 32 | T18: 40 | U18: Sí | V18: Sí | W18: 2016 - I
A19: =R[-1]C+1 -> 19 | B19: ALVARADO | C19: VIZCARDO | D19: BETSY ROCIO | E19: PERÚ | F19: 10680956 | G19: 2013-03-13T00:00:00.000 | H19: Sí | I19: BACHILLER | J19: PSICOLOGIA | K19: UNIVERSIDAD DE SAN MARTIN DE PORRES | L19: PERÚ | M19: Sí | N19: No | O19: No | P19: Contratado | Q19: Tiempo Parcial | R19: 8 | S19: 0 | T19: 8 | U19: No | V19: No | W19: 2016 - I
A20: =R[-1]C+1 -> 20 | B20: AMBROSIO | C20: GARCIA | D20: GIULLIANA PATRICIA | E20: PERÚ | F20: 41185035 | G20: 2013-04-15T00:00:00.000 | H20: Sí | I20: BACHILLER | J20: TECNOLOGIA MEDICA | K20: UNIVERSIDAD NACIONAL MAYOR DE SAN MARCOS | L20: PERÚ | M20: Sí | N20: No | O20: No | P20: Contratado | Q20: Tiempo Parcial | R20: 6 | S20: 0 | T20: 6 | U20: No | V20: No | W20: 2016 - I
A21: =R[-1]C+1 -> 21 | B21: AMBULAY | C21: BRICEÑO | D21: JOHNNY PERCY | E21: PERÚ | F21: 41809938 | G21: 2014-10-01T00:00:00.000 | H21: No | I21: MAESTRO | J21: MAGISTER EN BIOQUIMICA Y BIOLOGIA MOLECULAR | K21: UNIVERSIDAD PERUANA CAYETANO HEREDIA | L21: PERÚ | M21: Sí | N21: No | O21: No | P21: Contratado | Q21: Tiempo Parcial | R21: 18 | S21: 0 | T21: 18 | U21: No | V21: Sí | W21: 2016 - I
A22: =R[-1]C+1 -> 22 | B22: ANAYA | C22: RAYMUNDO | D22: MARIO ANTONIO | E22: PERÚ | F22: 09763452 | G22: 2007-02-05T00:00:00.000 | H22: Sí | I22: MAESTRO | J22: MAGISTER EN EVALUACION EDUCATIVA Y ACREDITACION DE CALIDAD EDUCATIVA | K22: UNIVERSIDAD CESAR VALLEJO | L22: PERÚ | M22: Sí | N22: No | O22: No | P22: Ordinario Auxiliar | Q22: Tiempo Completo | R22: 18 | S22: 22 | T22: 40 | U22: No | V22: Sí | W22: 2016 - I
A23: =R[-1]C+1 -> 23 | B23: ANCAJIMA | C23: TIMANA | D23: JUAN CARLOS | E23: PERÚ | F23: 43925029 | G23: 2011-04-01T00:00:00.000 | H23: Sí | I23: BACHILLER | J23: EDUCACION | K23: UNIVERSIDAD CATOLICA SEDES SAPIENTIAE | L23: PERÚ | M23: Sí | N23: No | O23: No | P23: Contratado | Q23: Tiempo Parcial | R23: 0 | S23: 20 | T23: 20 | U23: No | V23: No | W23: 2016 - I | X23: ASISTENTE DE COORDINACION ACADEMICA
A24: =R[-1]C+1 -> 24 | B24: ANDIA | C24: VILCAPOMA | D24: DAVID HERNAN | E24: PERÚ | F24: 42457051 | G24: 2013-03-11T00:00:00.000 | H24: Sí | I24: BACHILLER | J24: TECNOLOGIA MEDICA | K24: UNIVERSIDAD NACIONAL MAYOR DE SAN MARCOS | L24: PERÚ | M24: Sí | N24: No | O24: No | P24: Contratado | Q24: Tiempo Parcial | R24: 14 | S24: 0 | T24: 14 | U24: No | V24: No | W24: 2016 - I
A25: =R[-1]C+1 -> 25 | B25: ANGULO | C25: VALDIVIA | D25: RAFAEL MARTIN | E25: PERÚ | F25: 40706670 | G25: 2013-04-01T00:00:00.000 | H25: Sí | I25: MAESTRO | J25: PROBLEMAS DE APRENDIZAJE | K25: UNIVERSIDAD CESAR VALLEJO | L25: PERÚ | M25: Sí | N25: No | O25: No | P25: Contratado | Q25: Tiempo Completo | R25: 24 | S25: 16 | T25: 40 | U25: No | V25: No | W25: 2016 - I
A26: =R[-1]C+1 -> 26 | B26: ANTONIO | C26: BASILIO | D26: DORILA TEODOSIA | E26: PERÚ | F26: 22406535 | G26: 2011-04-01T00:00:00.000 | H26: Sí | I26: MAESTRO | J26: ADMINISTRACION DE SERVICIOS DE SALUD | K26: UNIVERSIDAD NACIONAL FEDERICO VILLAREAL | L26: PERÚ | M26: Sí | N26: No | O26: No | P26: Ordinario Asociado | Q26: Tiempo Parcial | R26: 11 | S26: 9 | T26: 20 | U26: No | V26: No | W26: 2016 - I
A27: =R[-1]C+1 -> 27 | B27: AQUISSE | C27: TORRES | D27: TEODORO | E27: PERÚ | F27: 25552563 | G27: 2007-04-09T00:00:00.000 | H27: Sí | I27: BACHILLER | J27: EDUCACION | K27: UNIVERSIDAD NACIONAL FEDERICO VILLAREAL | L27: PERÚ | M27: Sí | N27: No | O27: No | P27: Contratado | Q27: Tiempo Completo | R27: 22 | S27: 18 | T27: 40 | U27: No | V27: No | W27: 2016 - I
A28: =R[-1]C+1 -> 28 | B28: ARANIBAR | C28: RIVERO | D28: RUTH MILAGROS | E28: PERÚ | F28: 07197659 | G28: 2012-10-03T00:00:00.000 | H28: Sí | I28: BACHILLER | J28: MEDICINA | K28: UNIVERSIDAD NACIONAL MAYOR DE SAN MARCOS | L28: PERÚ | M28: Sí | N28: No | O28: No | P28: Contratado | Q28: Tiempo Parcial | R28: 6 | S28: 0 | T28: 6 | U28: No | V28: No | W28: 2016 - I
A29: =R[-1]C+1 -> 29 | B29: ARASHIRO | C29: TAMASHIRO | D29: ANA CECILIA | E29: PERÚ | F29: 10283796 | G29: 2000-05-02T00:00:00.000 | H29: Sí | I29: MAESTRO | J29: MAGISTER EN ADMINISTRACION DE NEGOCIOS Y FINANZAS INTERNACIONALES MBA INTERNACIONAL | K29: UNIVERSIDAD CATOLICA SEDES SAPIENTIAE | L29: PERÚ | M29: Sí | N29: No | O29: No | P29: Ordinario Asociado | Q29: Tiempo Completo | R29: 4 | S29: 36 | T29: 40 | U29: No | V29: No | W29: 2016 - I
A30: =R[-1]C+1 -> 30 | B30: ARAUZO | C30: RAMIREZ | D30: GIOVANA | E30: PERÚ | F30: 06785270 | G30: 2000-05-02T00:00:00.000 | H30: Sí | I30: BACHILLER | J30: CIENCIAS ADMINISTRATIVAS | K30: UNIVERSIDAD DE SAN MARTIN DE PORRES | L30: PERÚ | M30: Sí | N30: No | O30: No | P30: Contratado | Q30: Tiempo Completo | R30: 0 | S30: 40 | T30: 40 | U30: No | V30: No | W30: 2016 - I | X30: JEFE DE OFICINA DE GRADOS Y TITULOS
A31: =R[-1]C+1 -> 31 | B31: ARELLANO | C31: CABO | D31: MARIETTA ZORAIDA SOCORRO | E31: PERÚ | F31: 07739006 | G31: 2012-03-07T00:00:00.000 | H31: Sí | I31: BACHILLER | J31: EDUCACION | K31: UNIVERSIDAD FEMENINA DEL SAGRADO CORAZON | L31: PERÚ | M31: Sí | N31: No | O31: No | P31: Contratado | Q31: Tiempo Parcial | R31: 12 | S31: 0 | T31: 12 | U31: No | V31: No | W31: 2016 - I
A32: =R[-1]C+1 -> 32 | B32: ARIAS | C32: MARCOS | D32: ADA GRABIELA | E32: PERÚ | F32: 08578047 | G32: 2009-03-10T00:00:00.000 | H32: Sí | I32: BACHILLER | J32: EDUCACION | K32: UNIVERSIDAD DE SAN MARTIN DE PORRES | L32: PERÚ | M32: Sí | N32: No | O32: No | P32: Contratado | Q32: Tiempo Parcial | R32: 20 | S32: 0 | T32: 20 | U32: No | V32: No | W32: 2016 - I
A33: =R[-1]C+1 -> 33 | B33: ARIAS | C33: PALOMINO | D33: MARCO ANTONIO | E33: PERÚ | F33: 10585743 | G33: 2006-02-01T00:00:00.000 | H33: Sí | I33: BACHILLER | J33: CIENCIAS DE LA COMUNICACION | K33: UNIVERSIDAD DE SAN MARTIN DE PORRES | L33: PERÚ | M33: Sí | N33: No | O33: No | P33: Contratado | Q33: Tiempo Completo | R33: 8 | S33: 32 | T33: 40 | U33: No | V33: No | W33: 2016 - I
A34: =R[-1]C+1 -> 34 | B34: ARIAS | C34: RIMARI | D34: ELIANA MARIA | E34: PERÚ | F34: 21289640 | G34: 2008-10-13T00:00:00.000 | H34: Sí | I34: BACHILLER | J34: EDUCACION | K34: UNIVERSIDAD CATOLICA SEDES SAPIENTIAE | L34: PERÚ | M34: Sí | N34: No | O34: No | P34: Contratado | Q34: Tiempo Completo | R34: 0 | S34: 40 | T34: 40 | U34: No | V34: No | W34: 2016 - I | X34: TUTOR VIRTUAL
A35: =R[-1]C+1 -> 35 | B35: ARRUNATEGUI | C35: SALDARRIAGA | D35: SILVER ANDRES | E35: PERÚ | F35: 44105190 | G35: 2013-03-04T00:00:00.000 | H35: Sí | I35: BACHILLER | J35: MATEMATICA | K35: UNIVERSIDAD NACIONAL DE PIURA | L35: PERÚ | M35: Sí | N35: No | O35: No | P35: Contratado | Q35: Tiempo Parcial | R35: 8 | S35: 0 | T35: 8 | U35: No | V35: No | W35: 2016 - I
A36: =R[-1]C+1 -> 36 | B36: ASPILCUETA | C36: PEREZ | D36: CRISTOBAL URIEL | E36: PERÚ | F36: 08569906 | G36: 2011-03-08T00:00:00.000 | H36: Sí | I36: BACHILLER | J36: EDUCACION SECUNDARIA | K36: UNIVERSIDAD CESAR VALLEJO | L36: PERÚ | M36: Sí | N36: No | O36: No | P36: Contratado | Q36: Tiempo Parcial | R36: 18 | S36: 0 | T36: 18 | U36: No | V36: No | W36: 2016 - I
A37: =R[-1]C+1 -> 37 | B37: AYALA | C37: CALDERON | D37: KRISTHIAN OLIVER | E37: PERÚ | F37: 07501770 | G37: 2002-03-01T00:00:00.000 | H37: Sí | I37: MAESTRO | J37: ESTUDIOS CULTURALES | K37: PONTIFICIA UNIVERSIDAD CATOLICA DEL PERU | L37: PERÚ | M37: Sí | N37: No | O37: No | P37: Ordinario Auxiliar | Q37: Tiempo Completo | R37: 0 | S37: 40 | T37: 40 | U37: No | V37: No | W37: 2016 - I | X37: JEFE DE OFICINA DE IMAGEN INSTITUCIONAL
A38: =R[-1]C+1 -> 38 | B38: AYALA | C38: DIAZ | D38: MARCOS AQUILES | E38: PERÚ | F38: 02848481 | G38: 2014-04-01T00:00:00.000 | H38: Sí | I38: BACHILLER | J38: AGRONOMIA | K38: UNIVERSIDAD NACIONAL DE PIURA | L38: PERÚ | M38: Sí | N38: No | O38: No | P38: Contratado | Q38: Tiempo Parcial | R38: 4 | S38: 0 | T38: 4 | U38: No | V38: Sí | W38: 2016 - I
A39: =R[-1]C+1 -> 39 | B39: AYUDANTE | C39: RELAIZA | D39: ELIZABETH | E39: PERÚ | F39: 06783487 | G39: 2002-09-09T00:00:00.000 | H39: Sí | I39: BACHILLER | J39: CIENCIAS DE LA COMUNICACION | K39: UNIVERSIDAD DE SAN MARTIN DE PORRES | L39: PERÚ | M39: Sí | N39: No | O39: No | P39: Ordinario Asociado | Q39: Tiempo Completo | R39: 4 | S39: 36 | T39: 40 | U39: No | V39: No | W39: 2016 - I
A40: =R[-1]C+1 -> 40 | B40: AZCONA | C40: AVALOS | D40: GUISELLA IVONNE | E40: PERÚ | F40: 43991476 | G40: 2011-09-16T00:00:00.000 | H40: Sí | I40: MAESTRO | J40: EDUCACION CON MENCION EN DOCENCIA Y GESTION EDUCATIVA | K40: UNIVERSIDAD CESAR VALLEJO | L40: PERÚ | M40: Sí | N40: No | O40: No | P40: Contratado | Q40: Tiempo Completo | R40: 15 | S40: 25 | T40: 40 | U40: No | V40: No | W40: 2016 - I
A41: =R[-1]C+1 -> 41 | B41: AZULA | C41: DIAZ | D41: HENRY EDILBERTO | E41: PERÚ | F41: 42109759 | G41: 2012-08-15T00:00:00.000 | H41: Sí | I41: BACHILLER | J41: INGENIERIA QUIMICA | K41: UNIVERSIDAD NACIONAL PEDRO RUIZ GALLO | L41: PERÚ | M41: Sí | N41: No | O41: No | P41: Contratado | Q41: Tiempo Parcial | R41: 18 | S41: 0 | T41: 18 | U41: No | V41: Sí | W41: 2016 - I
A42: =R[-1]C+1 -> 42 | B42: BALLENA | C42: DOMINGUEZ | D42: VICTOR GIOVANNY | E42: PERÚ | F42: 09853135 | G42: 2012-09-05T00:00:00.000 | H42: Sí | I42: BACHILLER | J42: ECONOMIA | K42: UNIVERSIDAD NACIONAL DEL CALLAO | L42: PERÚ | M42: Sí | N42: No | O42: No | P42: Contratado | Q42: Tiempo Parcial | R42: 20 | S42: 2 | T42: 22 | U42: No | V42: Sí | W42: 2016 - I
A43: =R[-1]C+1 -> 43 | B43: BALTODANO | C43: DIAZ | D43: RAUL IVAN | E43: PERÚ | F43: 09549434 | G43: 2009-03-12T00:00:00.000 | H43: Sí | I43: BACHILLER | J43: MEDICINA HUMANA | K43: UNIVERSIDAD NACIONAL JOSE FAUSTINO SANCHEZ CARRION | L43: PERÚ | M43: Sí | N43: No | O43: No | P43: Ordinario Auxiliar | Q43: Tiempo Completo | R43: 12 | S43: 28 | T43: 40 | U43: No | V43: No | W43: 2016 - I
A44: =R[-1]C+1 -> 44 | B44: BALVIN | C44: EGAS | D44: EFRAIN | E44: PERÚ | F44: 20006543 | G44: 2012-10-03T00:00:00.000 | H44: Sí | I44: BACHILLER | J44: PSICOLOGIA | K44: UNIVERSIDAD NACIONAL FEDERICO VILLAREAL | L44: PERÚ | M44: Sí | N44: No | O44: No | P44: Contratado | Q44: Tiempo Parcial | R44: 4 | S44: 0 | T44: 4 | U44: No | V44: No | W44: 2016 - I
A45: =R[-1]C+1 -> 45 | B45: BARNETT | C45: GUILLEN | D45: LIDA ESTHER | E45: PERÚ | F45: 08584551 | G45: 2002-02-01T00:00:00.000 | H45: Sí | I45: BACHILLER | J45: INGENIERIA ADMINISTRATIVA | K45: UNIVERSIDAD INCA GARCILASO DE LA VEGA | L45: PERÚ | M45: Sí | N45: No | O45: No | P45: Ordinario Auxiliar | Q45: Tiempo Completo | R45: 4 | S45: 36 | T45: 40 | U45: No | V45: No | W45: 2016 - I
A46: =R[-1]C+1 -> 46 | B46: BASTO | C46: MUÑOZ | D46: ROSA LILIANA | E46: PERÚ | F46: 10621491 | G46: 2013-04-04T00:00:00.000 | H46: Sí | I46: MAESTRO | J46: MAGISTER EN ADMINISTRACION DE EMPRESAS | K46: UNIVERSIDAD PERUANA DE CIENCIAS APLICADAS | L46: PERÚ | M46: Sí | N46: No | O46: No | P46: Contratado | Q46: Tiempo Parcial | R46: 8 | S46: 0 | T46: 8 | U46: No | V46: No | W46: 2016 - I
A47: =R[-1]C+1 -> 47 | B47: BASUALDO | C47: LOPEZ | D47: ELIAS IVAN | E47: PERÚ | F47: 40611601 | G47: 2016-04-01T00:00:00.000 | H47: No | I47: MAESTRO | J47: MAGISTER EN ADMNISTRACION DE LA EDUCACION | K47: UNIVERSIDAD CESAR VALLEJO | L47: PERÚ | M47: Sí | N47: No | O47: No | P47: Contratado | Q47: Tiempo Parcial | R47: 4 | S47: 0 | T47: 4 | U47: No | V47: No | W47: 2016 - I
A48: =R[-1]C+1 -> 48 | B48: BECERRA | C48: GARCIA | D48: DANIEL | E48: PERÚ | F48: 00160971 | G48: 2014-08-11T00:00:00.000 | H48: No | I48: MAESTRO | J48: CIENCIAS DE LA EDUCACION CON MENCION EN DOCENCIA UNIVERSITARIA | K48: UNIVERSIDAD NACIONAL DE EDUCACION ENRIQUE GUZMAN Y VALLE | L48: PERÚ | M48: Sí | N48: No | O48: No | P48: Contratado | Q48: Tiempo Parcial | R48: 10 | S48: 0 | T48: 10 | U48: No | V48: No | W48: 2016 - I
A49: =R[-1]C+1 -> 49 | B49: BECERRA | C49: PALOMINO | D49: CARLOS ENRIQUE | E49: PERÚ | F49: 08271469 | G49: 2014-04-04T00:00:00.000 | H49: Sí | I49: BACHILLER | J49: DERECHO | K49: UNIVERSIDAD NACIONAL MAYOR DE SAN MARCOS | L49: PERÚ | M49: Sí | N49: No | O49: No | P49: Contratado | Q49: Tiempo Completo | R49: 0 | S49: 40 | T49: 40 | U49: No | V49: No | W49: 2016 - I | X49: DECANO FACULTAD DE DERECHO Y CIENCIAS POLITICAS
A50: =R[-1]C+1 -> 50 | B50: BENITO | C50: RODRIGUEZ | D50: JOSE ANTONIO | E50: ESPAÑA | F50: 000105841 | G50: 2000-05-02T00:00:00.000 | H50: Sí | I50: DOCTOR | J50: FILOSOFIA Y LETRAS | K50: UNIVERSIDAD DE VALLADOLID | L50: ESPAÑA | M50: Sí | N50: No | O50: No | P50: Ordinario Principal | Q50: Tiempo Parcial | R50: 0 | S50: 20 | T50: 20 | U50: No | V50: No | W50: 2016 - I | X50: JEFE DE OFICINA DE CEPAC
A51: =R[-1]C+1 -> 51 | B51: BERMUDEZ | C51: TAPIA | D51: MANUEL ALEXIS | E51: PERÚ | F51: 09854795 | G51: 2015-09-07T00:00:00.000 | H51: No | I51: MAESTRO | J51: MAESTRO EN DERECHO CON MENCION EN DERECHO CIVIL EMPRESARIAL | K51: UNIVERSIDAD PRIVADA ANTENOR ORREGO DE TRUJILLO | L51: PERÚ | M51: Sí | N51: No | O51: No | P51: Contratado | Q51: Tiempo Parcial | R51: 8 | S51: 0 | T51: 8 | U51: No | V51: No | W51: 2016 - I
A52: =R[-1]C+1 -> 52 | B52: BIDINOST | C52: . | D52: PAOLO | E52: ITALIA | F52: 000332855 | G52: 2006-02-01T00:00:00.000 | H52: Sí | I52: DOCTOR | J52: FILOSOFIA | K52: UNIVERSITA CATTOLICA DEL SACRO CUORE | L52: ITALIA | M52: Sí | N52: No | O52: No | P52: Ordinario Principal | Q52: Dedicacion Exclusiva | R52: 0 | S52: 40 | T52: 40 | U52: No | V52: No | W52: 2016 - I | X52: DECANO FACULTAD DE CIENCIAS ECNOMINAS Y COMERCIALES
A53: =R[-1]C+1 -> 53 | B53: BIO | C53: GAIDOLFI | D53: CARLA MARIA | E53: PERÚ | F53: 25629280 | G53: 2002-10-01T00:00:00.000 | H53: Sí | I53: BACHILLER | J53: DERECHO Y CIENCIAS POLITICAS | K53: UNIVERSIDAD DE LIMA | L53: PERÚ | M53: Sí | N53: Sí | O53: No | P53: Ordinario Auxiliar | Q53: Tiempo Completo | R53: 0 | S53: 40 | T53: 40 | U53: No | V53: No | W53: 2016 - I | X53: JEFE DE OFICINA DE PERSONAL Y ASUNTOS LEGALES / SECRETARIO GENERAL
A54: =R[-1]C+1 -> 54 | B54: BIO | C54: GAIDOLFI | D54: FAUSTO MICHELE | E54: PERÚ | F54: 25746345 | G54: 2012-09-03T00:00:00.000 | H54: Sí | I54: MAESTRO | J54: ADMINISTRACION PUBLICA | K54: UNIVERSIDAD CATOLICA SEDES SAPIENTIAE | L54: PERÚ | M54: Sí | N54: Sí | O54: No | P54: Contratado | Q54: Tiempo Parcial | R54: 4 | S54: 0 | T54: 4 | U54: No | V54: No | W54: 2016 - I
A55: =R[-1]C+1 -> 55 | B55: BLAS | C55: MONTENEGRO | D55: LUZ PETRONILA | E55: PERÚ | F55: 07796524 | G55: 2007-11-01T00:00:00.000 | H55: Sí | I55: BACHILLER | J55: EDUCACION PRIMARIA | K55: UNIVERSIDAD CATOLICA SEDES SAPIENTIAE | L55: PERÚ | M55: Sí | N55: No | O55: No | P55: Ordinario Auxiliar | Q55: Tiempo Completo | R55: 8 | S55: 32 | T55: 40 | U55: No | V55: No | W55: 2016 - I
A56: =R[-1]C+1 -> 56 | B56: BOLIS | C56: . | D56: GIAN BATTISTA FAUSTO | E56: ITALIA | F56: 000044710 | G56: 2000-05-02T00:00:00.000 | H56: Sí | I56: DOCTOR | J56: FILOSOFIA | K56: UNIVERSITA DEGLI STUDI DI CAGLIARI | L56: ITALIA | M56: Sí | N56: No | O56: No | P56: Ordinario Principal | Q56: Dedicacion Exclusiva | R56: 8 | S56: 32 | T56: 40 | U56: No | V56: Sí | W56: 2016 - I
A57: =R[-1]C+1 -> 57 | B57: BOZA | C57: OLAECHEA | D57: MARGARITA LUISA | E57: PERÚ | F57: 21448115 | G57: 2013-09-16T00:00:00.000 | H57: Sí | I57: BACHILLER | J57: INGENIERIA CIVIL | K57: UNIVERSIDAD SAN LUIS GONZAGA DE ICA | L57: PERÚ | M57: Sí | N57: No | O57: No | P57: Contratado | Q57: Tiempo Parcial | R57: 6 | S57: 2 | T57: 8 | U57: No | V57: Sí | W57: 2016 - I
A58: =R[-1]C+1 -> 58 | B58: BRAVO | C58: LOPEZ | D58: NATALY | E58: PERÚ | F58: 10530728 | G58: 2016-04-01T00:00:00.000 | H58: No | I58: MAESTRO | J58: MAGISTER EN ADMISTRACION DE NEGOCIOS | K58: UNIVERSIDAD SAN INGNACIO DE LOYOLA | L58: PERÚ | M58: Sí | N58: No | O58: No | P58: Contratado | Q58: Tiempo Parcial | R58: 8 | S58: 0 | T58: 8 | U58: No | V58: Sí | W58: 2016 - I
A59: =R[-1]C+1 -> 59 | B59: BRAVO | C59: SAENZ | D59: WALTER ALEJANDRO | E59: PERÚ | F59: 08080775 | G59: 2010-03-09T00:00:00.000 | H59: Sí | I59: BACHILLER | J59: CONTABILIDAD | K59: UNIVERSIDAD INCA GARCILASO DE LA VEGA | L59: PERÚ | M59: Sí | N59: No | O59: No | P59: Contratado | Q59: Tiempo Parcial | R59: 18 | S59: 2 | T59: 20 | U59: No | V59: No | W59: 2016 - I
A60: =R[-1]C+1 -> 60 | B60: BRIOZZO | C60: PEREYRA | D60: MARIA TERESA | E60: URUGUAY | F60: 000367365 | G60: 2006-04-01T00:00:00.000 | H60: Sí | I60: BACHILLER | J60: TEOLOGIA | K60: PONTIFICIA UNIVERSITAS LATERANENSIS | L60: ITALIA | M60: Sí | N60: No | O60: No | P60: Ordinario Asociado | Q60: Tiempo Completo | R60: 18 | S60: 22 | T60: 40 | U60: No | V60: Sí | W60: 2016 - I
A61: =R[-1]C+1 -> 61 | B61: BUENDIA | C61: ROMERO | D61: CESAR ANTONIO | E61: PERÚ | F61: 40723640 | G61: 2000-09-15T00:00:00.000 | H61: Sí | I61: DOCTOR | J61: SAGRADA TEOLOGIA | K61: FACULTAD DE TEOLOGIA SAN VICENTE FERRER DE VALENCIA | L61: ESPAÑA | M61: Sí | N61: No | O61: No | P61: Ordinario Asociado | Q61: Tiempo Completo | R61: 12 | S61: 28 | T61: 40 | U61: No | V61: Sí | W61: 2016 - I
A62: =R[-1]C+1 -> 62 | B62: BURGA | C62: GUTIERREZ | D62: ROSA MARIA | E62: PERÚ | F62: 07747856 | G62: 2011-09-05T00:00:00.000 | H62: Sí | I62: BACHILLER | J62: EDUCACION | K62: UNIVERSIDAD FEMENINA DEL SAGRADO CORAZON | L62: PERÚ | M62: Sí | N62: No | O62: No | P62: Contratado | Q62: Tiempo Parcial | R62: 8 | S62: 0 | T62: 8 | U62: No | V62: No | W62: 2016 - I
A63: =R[-1]C+1 -> 63 | B63: BURGOS | C63: BASTIDAS | D63: ANGIE ROMY | E63: PERÚ | F63: 40067119 | G63: 2013-03-11T00:00:00.000 | H63: Sí | I63: MAESTRO | J63: MAGISTER SCIENTIAE ECOLOGIA APLICADA | K63: UNIVERSIDAD NACIONAL AGRARIA LA MOLINA | L63: PERÚ | M63: Sí | N63: No | O63: No | P63: Contratado | Q63: Tiempo Parcial | R63: 20 | S63: 0 | T63: 20 | U63: No | V63: Sí | W63: 2016 - I
A64: =R[-1]C+1 -> 64 | B64: CABALLERO | C64: CANTU | D64: JOSE JEREMIAS | E64: PERÚ | F64: 15746875 | G64: 2014-03-17T00:00:00.000 | H64: Sí | I64: BACHILLER | J64: MATEMATICA | K64: UNIVERSIDAD NACIONAL MAYOR DE SAN MARCOS | L64: PERÚ | M64: Sí | N64: No | O64: No | P64: Contratado | Q64: Tiempo Completo | R64: 22 | S64: 18 | T64: 40 | U64: No | V64: Sí | W64: 2016 - I
A65: =R[-1]C+1 -> 65 | B65: CABANILLAS | C65: ROJAS | D65: WILLIAM EUGENIO | E65: PERÚ | F65: 09869377 | G65: 2014-03-14T00:00:00.000 | H65: Sí | I65: BACHILLER | J65: PSICOLOGIA | K65: UNIVERSIDAD RICARDO PALMA | L65: PERÚ | M65: Sí | N65: No | O65: No | P65: Contratado | Q65: Tiempo Parcial | R65: 4 | S65: 0 | T65: 4 | U65: No | V65: No | W65: 2016 - I
A66: =R[-1]C+1 -> 66 | B66: CABELLO | C66: TORRES | D66: RITA JAQUELINE | E66: PERÚ | F66: 08947396 | G66: 2015-05-06T00:00:00.000 | H66: No | I66: MAESTRO | J66: MASTER UNIVERSITARIO EN QUIMICA AMBIENTAL Y FUNDAMENTAL | K66: UNIVERSIDAD DA CORUÑA | L66: ESPAÑA | M66: Sí | N66: No | O66: No | P66: Contratado | Q66: Tiempo Completo | R66: 0 | S66: 40 | T66: 40 | U66: No | V66: Sí | W66: 2016 - I | X66: ASESOR ACADEMICO
A67: =R[-1]C+1 -> 67 | B67: CACERES | C67: URBINA | D67: HILDA YOLANDA | E67: PERÚ | F67: 06456480 | G67: 2006-11-01T00:00:00.000 | H67: Sí | I67: BACHILLER | J67: CONTABILIDAD | K67: UNIVERSIDAD NACIONAL MAYOR DE SAN MARCOS | L67: PERÚ | M67: Sí | N67: No | O67: No | P67: Contratado | Q67: Tiempo Completo | R67: 0 | S67: 40 | T67: 40 | U67: No | V67: No | W67: 2016 - I | X67: COORDINADORA DE AREA DE CONVALIDACION Y PRACTICAS PRE PROFESIONALES FACULTAD DE CIENCIAS ECONOMICAS Y COMERCIALES
A68: =R[-1]C+1 -> 68 | B68: CALIXTO | C68: ALIAGA | D68: SILVIO GUSTAVO | E68: PERÚ | F68: 19857956 | G68: 2011-06-07T00:00:00.000 | H68: Sí | I68: BACHILLER | J68: AGRONOMIA | K68: UNIVERSIDAD NACIONAL DEL CENTRO DEL PERU | L68: PERÚ | M68: Sí | N68: No | O68: No | P68: Contratado | Q68: Tiempo Completo | R68: 0 | S68: 40 | T68: 40 | U68: No | V68: No | W68: 2016 - I | X68: SUPERVISOR DE CULTIVOS
A69: =R[-1]C+1 -> 69 | B69: CALLE | C69: CHEJE | D69: YURI HOLSIN | E69: PERÚ | F69: 29587019 | G69: 2011-03-12T00:00:00.000 | H69: Sí | I69: BACHILLER | J69: CIENCIAS AGRARIAS | K69: UNIVERSIDAD NACIONAL SAN AGUSTIN | L69: PERÚ | M69: Sí | N69: No | O69: No | P69: Contratado | Q69: Tiempo Parcial | R69: 6 | S69: 0 | T69: 6 | U69: No | V69: Sí | W69: 2016 - I
A70: =R[-1]C+1 -> 70 | B70: CAMARENA | C70: ARESTEGUI | D70: JHON JHONY | E70: PERÚ | F70: 08667250 | G70: 2012-09-05T00:00:00.000 | H70: Sí | I70: BACHILLER | J70: EDUCACION | K70: UNIVERSIDAD CATOLICA SEDES SAPIENTIAE | L70: PERÚ | M70: Sí | N70: No | O70: No | P70: Contratado | Q70: Tiempo Completo | R70: 12 | S70: 28 | T70: 40 | U70: No | V70: Sí | W70: 2016 - I
A71: =R[-1]C+1 -> 71 | B71: CAMINO | C71: RIVERA | D71: CRISTIAN ENMANUEL | E71: PERÚ | F71: 42658184 | G71: 2007-07-01T00:00:00.000 | H71: Sí | I71: BACHILLER | J71: EDUCACION SECUNDARIA: INFORMATICA | K71: UNIVERSIDAD CATOLICA SEDES SAPIENTIAE | L71: PERÚ | M71: Sí | N71: No | O71: No | P71: Contratado | Q71: Tiempo Completo | R71: 0 | S71: 40 | T71: 40 | U71: No | V71: No | W71: 2016 - I | X71: RESPONSABLE DE PLATAFORMA VIRTUAL UCSS VIRTUAL
A72: =R[-1]C+1 -> 72 | B72: CAPUÑAY | C72: GONZALES | D72: MARIA LIDIA | E72: PERÚ | F72: 80278308 | G72: 2013-03-18T00:00:00.000 | H72: Sí | I72: BACHILLER | J72: BIOLOGIA | K72: UNIVERSIDAD NACIONAL PEDRO RUIZ GALLO | L72: PERÚ | M72: Sí | N72: No | O72: No | P72: Contratado | Q72: Tiempo Parcial | R72: 13 | S72: 0 | T72: 13 | U72: No | V72: No | W72: 2016 - I
A73: =R[-1]C+1 -> 73 | B73: CARDENAS | C73: CABEZAS | D73: JESUS MEDALIT | E73: PERÚ | F73: 04304833 | G73: 2002-04-22T00:00:00.000 | H73: Sí | I73: BACHILLER | J73: EDUCACION | K73: UNIVERSIDAD MARCELINO CHAMPAGNAT | L73: PERÚ | M73: Sí | N73: No | O73: No | P73: Ordinario Auxiliar | Q73: Tiempo Completo | R73: 12 | S73: 28 | T73: 40 | U73: No | V73: No | W73: 2016 - I
A74: =R[-1]C+1 -> 74 | B74: CARDENAS | C74: LEDESMA | D74: BLUIDSON PABLO | E74: PERÚ | F74: 08665105 | G74: 2014-05-02T00:00:00.000 | H74: Sí | I74: MAESTRO | J74: CIENCIAS DE LA EDUCACION CON MENCION EN ENSEÑANZA DEL IDIOMA INGLES COMO LENGUA EXTRANJERA | K74: UNIVERSIDAD NACIONAL DE EDUCACION ENRIQUE GUZMAN Y VALLE | L74: PERÚ | M74: Sí | N74: No | O74: No | P74: Contratado | Q74: Tiempo Parcial | R74: 4 | S74: 16 | T74: 20 | U74: No | V74: No | W74: 2016 - I
A75: =R[-1]C+1 -> 75 | B75: CARRASCAL | C75: VIZARRETA | D75: URSULA | E75: PERÚ | F75: 10735921 | G75: 2013-03-11T00:00:00.000 | H75: Sí | I75: BACHILLER | J75: PERIODISMO | K75: ESCUELA DE PERIODISMO JAIME BAUSATE Y MEZA | L75: PERÚ | M75: Sí | N75: No | O75: No | P75: Contratado | Q75: Tiempo Parcial | R75: 4 | S75: 6 | T75: 10 | U75: No | V75: No | W75: 2016 - I
A76: =R[-1]C+1 -> 76 | B76: CARRASCO | C76: LOPEZ | D76: ILIANOV PABLO | E76: PERÚ | F76: 09982771 | G76: 2003-09-08T00:00:00.000 | H76: Sí | I76: BACHILLER | J76: CIENCIAS ECONOMIA | K76: UNIVERSIDAD NACIONAL AGRARIA LA MOLINA | L76: PERÚ | M76: Sí | N76: No | O76: No | P76: Ordinario Asociado | Q76: Tiempo Completo | R76: 20 | S76: 20 | T76: 40 | U76: Sí | V76: Sí | W76: 2016 - I
A77: =R[-1]C+1 -> 77 | B77: CARREÑO | C77: MARTINEZ | D77: JUAN ELIAS | E77: PERÚ | F77: 09339841 | G77: 2013-09-14T00:00:00.000 | H77: Sí | I77: BACHILLER | J77: ADMINISTRACION | K77: UNIVERSIDAD RICARDO PALMA | L77: PERÚ | M77: Sí | N77: No | O77: No | P77: Contratado | Q77: Tiempo Parcial | R77: 18 | S77: 2 | T77: 20 | U77: No | V77: No | W77: 2016 - I
A78: =R[-1]C+1 -> 78 | B78: CARREÑO | C78: ROLDAN | D78: ALBERTO DANILO | E78: PERÚ | F78: 15612175 | G78: 2013-03-04T00:00:00.000 | H78: Sí | I78: BACHILLER | J78: BROMATOLOGIA Y NUTRICION | K78: UNIVERSIDAD NACIONAL JOSE FAUSTINO SANCHEZ CARRION | L78: PERÚ | M78: Sí | N78: No | O78: No | P78: Contratado | Q78: Tiempo Parcial | R78: 16 | S78: 0 | T78: 16 | U78: No | V78: No | W78: 2016 - I
A79: =R[-1]C+1 -> 79 | B79: CASTAÑEDA | C79: CHIRRE | D79: ELVIRA TEOFILA | E79: PERÚ | F79: 15744138 | G79: 2016-03-01T00:00:00.000 | H79: No | I79: MAESTRO | J79: MAESTRA EN ECOLOGIA Y GESTION AMBIENTAL | K79: UNIVERSIDAD NACIONAL JOSE FAUSTINO SANCHEZ CARRION | L79: PERÚ | M79: Sí | N79: No | O79: No | P79: Contratado | Q79: Tiempo Parcial | R79: 8 | S79: 0 | T79: 8 | U79: No | V79: No | W79: 2016 - I
A80: =R[-1]C+1 -> 80 | B80: CASTAÑEDA | C80: RAMIREZ | D80: CESAR WALTER | E80: PERÚ | F80: 06188898 | G80: 2007-04-02T00:00:00.000 | H80: Sí | I80: BACHILLER | J80: CONTABILIDAD | K80: UNIVERSIDAD PARTICULAR SAN MARTIN DE PORRES | L80: PERÚ | M80: Sí | N80: No | O80: No | P80: Contratado | Q80: Tiempo Parcial | R80: 8 | S80: 0 | T80: 8 | U80: No | V80: No | W80: 2016 - I
A81: =R[-1]C+1 -> 81 | B81: CASTILLA | C81: CRUZ | D81: HILARIO | E81: PERÚ | F81: 00163075 | G81: 2008-04-01T00:00:00.000 | H81: Sí | I81: MAESTRO | J81: EDUCACION MENCION PSICOPEDAGOGIA | K81: UNIVERSIDAD MARCELINO CHAMPAGNAT | L81: PERÚ | M81: Sí | N81: No | O81: No | P81: Contratado | Q81: Tiempo Completo | R81: 12 | S81: 28 | T81: 40 | U81: No | V81: No | W81: 2016 - I
A82: =R[-1]C+1 -> 82 | B82: CASTILLO | C82: GUTIERREZ | D82: GIANCARLO | E82: PERÚ | F82: 41648542 | G82: 2012-10-03T00:00:00.000 | H82: Sí | I82: BACHILLER | J82: EDUCACION | K82: UNIVERSIDAD CATOLICA SEDES SAPIENTIAE | L82: PERÚ | M82: Sí | N82: No | O82: No | P82: Contratado | Q82: Tiempo Completo | R82: 4 | S82: 36 | T82: 40 | U82: No | V82: No | W82: 2016 - I
A83: =R[-1]C+1 -> 83 | B83: CASTILLO | C83: PICHEN | D83: SEGUNDO CESAR | E83: PERÚ | F83: 08124577 | G83: 2013-03-04T00:00:00.000 | H83: Sí | I83: BACHILLER | J83: MEDICINA HUMANA | K83: UNIVERSIDAD NACIONAL MAYOR DE SAN MARCOS | L83: PERÚ | M83: Sí | N83: No | O83: No | P83: Contratado | Q83: Tiempo Parcial | R83: 16 | S83: 0 | T83: 16 | U83: No | V83: Sí | W83: 2016 - I
A84: =R[-1]C+1 -> 84 | B84: CASTRO | C84: BARTOLOME | D84: HECTOR JORGE | E84: PERÚ | F84: 15601765 | G84: 2015-09-07T00:00:00.000 | H84: No | I84: MAESTRO | J84: MAESTRO EN DOCENCIA SUPERIOR E INVESTIGACION UNIVERSITARIA | K84: UNIVERSIDAD NACIONAL JOSE FAUSTINO SANCHEZ CARRION | L84: PERÚ | M84: Sí | N84: No | O84: No | P84: Contratado | Q84: Tiempo Parcial | R84: 4 | S84: 0 | T84: 4 | U84: No | V84: Sí | W84: 2016 - I
A85: =R[-1]C+1 -> 85 | B85: CASTRO | C85: MEDINA | D85: MAXIMILIANA IRENE | E85: PERÚ | F85: 06962611 | G85: 2013-09-10T00:00:00.000 | H85: Sí | I85: BACHILLER | J85: GEOGRAFA | K85: UNIVERSIDAD NACIONAL MAYOR DE SAN MARCOS | L85: PERÚ | M85: Sí | N85: No | O85: No | P85: Contratado | Q85: Tiempo Completo | R85: 28 | S85: 12 | T85: 40 | U85: No | V85: No | W85: 2016 - I
A86: =R[-1]C+1 -> 86 | B86: CECILIANO | C86: CAMONES | D86: SHIRLEY KARINA | E86: PERÚ | F86: 45473955 | G86: 2014-03-12T00:00:00.000 | H86: Sí | I86: BACHILLER | J86: EDUCACION | K86: UNIVERSIDAD NACIONAL JOSE FAUSTINO SANCHEZ CARRION | L86: PERÚ | M86: Sí | N86: No | O86: No | P86: Contratado | Q86: Tiempo Parcial | R86: 4 | S86: 0 | T86: 4 | U86: No | V86: No | W86: 2016 - I
A87: =R[-1]C+1 -> 87 | B87: CERON | C87: SALAZAR | D87: NORMA JULIETA | E87: PERÚ | F87: 10207235 | G87: 2007-04-09T00:00:00.000 | H87: Sí | I87: BACHILLER | J87: EDUCACION | K87: UNIVERSIDAD NACIONAL DE EDUCACION ENRIQUE GUZMAN Y VALLE | L87: PERÚ | M87: Sí | N87: No | O87: No | P87: Contratado | Q87: Tiempo Parcial | R87: 4 | S87: 0 | T87: 4 | U87: No | V87: No | W87: 2016 - I
A88: =R[-1]C+1 -> 88 | B88: CESPEDES | C88: PANDURO | D88: BERNARDO | E88: PERÚ | F88: 17615559 | G88: 2007-04-02T00:00:00.000 | H88: Sí | I88: BACHILLER | J88: ESTADISTICA | K88: UNIVERSIDAD NACIONAL PEDRO RUIZ GALLO | L88: PERÚ | M88: Sí | N88: No | O88: No | P88: Contratado | Q88: Tiempo Parcial | R88: 12 | S88: 0 | T88: 12 | U88: No | V88: Sí | W88: 2016 - I
A89: =R[-1]C+1 -> 89 | B89: CESPEDES | C89: PANDURO | D89: JACOBA DEL PILAR | E89: PERÚ | F89: 17561750 | G89: 2004-04-01T00:00:00.000 | H89: Sí | I89: BACHILLER | J89: DERECHO | K89: UNIVERSIDAD NACIONAL PEDRO RUIZ GALLO | L89: PERÚ | M89: Sí | N89: No | O89: No | P89: Ordinario Auxiliar | Q89: Tiempo Completo | R89: 4 | S89: 36 | T89: 40 | U89: No | V89: No | W89: 2016 - I
A90: =R[-1]C+1 -> 90 | B90: CESPEDES | C90: PANDURO | D90: SUGEIT EMPERATRIZ | E90: PERÚ | F90: 17634166 | G90: 2000-10-13T00:00:00.000 | H90: Sí | I90: BACHILLER | J90: TURISMO Y HOTELERIA | K90: UNIVERSIDAD DE SAN MARTIN DE PORRES | L90: PERÚ | M90: Sí | N90: No | O90: No | P90: Ordinario Auxiliar | Q90: Tiempo Completo | R90: 0 | S90: 40 | T90: 40 | U90: No | V90: No | W90: 2016 - I | X90: COORDINADORA ADMINISTARTIVA FACULTAD DE CIENCIAS ECONOMICAS Y COMERCIALES
A91: =R[-1]C+1 -> 91 | B91: CHAVEZ | C91: BARCES | D91: MARIA ELENA | E91: PERÚ | F91: 08500622 | G91: 2001-06-15T00:00:00.000 | H91: Sí | I91: BACHILLER | J91: COMPUTACION | K91: UNIVERSIDAD NACIONAL MAYOR DE SAN MARCOS | L91: PERÚ | M91: Sí | N91: No | O91: No | P91: Ordinario Auxiliar | Q91: Tiempo Completo | R91: 0 | S91: 40 | T91: 40 | U91: Sí | V91: Sí | W91: 2016 - I | X91: OSEL- DOCENTE NOMBRADO
A92: =R[-1]C+1 -> 92 | B92: CHAVEZ | C92: MEDRANO | D92: VICTOR RICARDO | E92: PERÚ | F92: 09883255 | G92: 2014-03-10T00:00:00.000 | H92: Sí | I92: BACHILLER | J92: PSICOLOGIA | K92: UNIVERSIDAD INCA GARCILASO DE LA VEGA | L92: PERÚ | M92: Sí | N92: No | O92: No | P92: Contratado | Q92: Tiempo Parcial | R92: 16 | S92: 0 | T92: 16 | U92: No | V92: Sí | W92: 2016 - I
A93: =R[-1]C+1 -> 93 | B93: CHAVEZ | C93: NORABUENA | D93: KARINA JUDITH | E93: PERÚ | F93: 09893536 | G93: 2007-04-09T00:00:00.000 | H93: Sí | I93: BACHILLER | J93: EDUCACION | K93: UNIVERSIDAD MARCELINO CHAMPAGNAT | L93: PERÚ | M93: Sí | N93: No | O93: No | P93: Contratado | Q93: Tiempo Parcial | R93: 12 | S93: 0 | T93: 12 | U93: No | V93: No | W93: 2016 - I
A94: =R[-1]C+1 -> 94 | B94: CHAVEZ | C94: PRADO | D94: ANGELICA MARITZA | E94: PERÚ | F94: 09140700 | G94: 2000-05-02T00:00:00.000 | H94: Sí | I94: BACHILLER | J94: TURISMO Y HOTELERIA | K94: UNIVERSIDAD DE SAN MARTIN DE PORRES | L94: PERÚ | M94: Sí | N94: No | O94: No | P94: Ordinario Auxiliar | Q94: Tiempo Completo | R94: 0 | S94: 40 | T94: 40 | U94: No | V94: No | W94: 2016 - I | X94: LCGH - DOCENTE NOMBRADO
A95: =R[-1]C+1 -> 95 | B95: CHAVEZ | C95: VEGA | D95: CARLOS | E95: PERÚ | F95: 08470274 | G95: 2001-04-16T00:00:00.000 | H95: Sí | I95: DOCTOR | J95: DOCTORADO EN CIENCIAS MATEMATICAS | K95: UNIVERSIDAD DE BUENOS AIRES | L95: ARGENTINA | M95: Sí | N95: No | O95: No | P95: Contratado | Q95: Tiempo Parcial | R95: 8 | S95: 0 | T95: 8 | U95: No | V95: No | W95: 2016 - I
A96: =R[-1]C+1 -> 96 | B96: CHINCHA | C96: ALVAREZ | D96: ANA MARIA NINOSHKA | E96: PERÚ | F96: 08185119 | G96: 2013-09-09T00:00:00.000 | H96: Sí | I96: MAESTRO | J96: MAGISTER EN ADMINISTRACION DE NEGOCIOS Y FINANZAS INTERNACIONALES MBA INTERNACIONAL | K96: UNIVERSIDAD CATOLICA SEDES SAPIENTIAE | L96: PERÚ | M96: Sí | N96: No | O96: No | P96: Contratado | Q96: Tiempo Parcial | R96: 8 | S96: 0 | T96: 8 | U96: No | V96: No | W96: 2016 - I
A97: =R[-1]C+1 -> 97 | B97: CHIROQUE | C97: FLORES | D97: VICTOR MANUEL | E97: PERÚ | F97: 03317072 | G97: 2013-08-19T00:00:00.000 | H97: Sí | I97: BACHILLER | J97: PERIODISMO | K97: ESCUELA DE PERIODISMO JAIME BAUSATE Y MEZA | L97: PERÚ | M97: Sí | N97: No | O97: No | P97: Contratado | Q97: Tiempo Parcial | R97: 19 | S97: 0 | T97: 19 | U97: No | V97: No | W97: 2016 - I
A98: =R[-1]C+1 -> 98 | B98: CHIROQUE | C98: VELASQUEZ | D98: GRISEL VIOLETA | E98: PERÚ | F98: 40664123 | G98: 2014-03-10T00:00:00.000 | H98: Sí | I98: MAESTRO | J98: MAGISTER EN DESARROLLO RURAL | K98: UNIVERSIDAD AUSTRAL DE CHILE | L98: CHILE | M98: Sí | N98: No | O98: No | P98: Contratado | Q98: Tiempo Parcial | R98: 12 | S98: 0 | T98: 12 | U98: No | V98: No | W98: 2016 - I
A99: =R[-1]C+1 -> 99 | B99: CHONG | C99: CENTURION | D99: ERNESTO GALVARINO | E99: PERÚ | F99: 06157624 | G99: 2007-04-02T00:00:00.000 | H99: Sí | I99: MAESTRO | J99: PSICOPEDAGOGIA | K99: UNIVERSIDAD CESAR VALLEJO | L99: PERÚ | M99: Sí | N99: No | O99: No | P99: Contratado | Q99: Tiempo Parcial | R99: 4 | S99: 8 | T99: 12 | U99: No | V99: No | W99: 2016 - I
A100: =R[-1]C+1 -> 100 | B100: CHURA | C100: GOMEZ | D100: CESAR | E100: PERÚ | F100: 02434440 | G100: 2013-05-15T00:00:00.000 | H100: Sí | I100: BACHILLER | J100: INGENIERO DE SISTEMAS Y COMPUTO | K100: UNIVERSIDAD INCA GARCILASO DE LA VEGA | L100: PERÚ | M100: Sí | N100: No | O100: No | P100: Contratado | Q100: Tiempo Completo | R100: 0 | S100: 40 | T100: 40 | U100: No | V100: No | W100: 2016 - I | X100: ANALISTA PROGRAMADOR OFICINA DE SISTEMAS
A101: =R[-1]C+1 -> 101 | B101: CISNEROS | C101: AYALA | D101: CLAUDIA | E101: PERÚ | F101: 09673277 | G101: 2013-03-14T00:00:00.000 | H101: Sí | I101: BACHILLER | J101: CIENCIAS DE LA EDUCACION | K101: UNIVERSIDAD NACIONAL DE EDUCACION ENRIQUE GUZMAN Y VALLE | L101: PERÚ | M101: Sí | N101: No | O101: No | P101: Contratado | Q101: Tiempo Parcial | R101: 12 | S101: 0 | T101: 12 | U101: No | V101: No | W101: 2016 - I
A102: =R[-1]C+1 -> 102 | B102: CJAHUA | C102: HUANACHI | D102: ZITA SILVIA | E102: PERÚ | F102: 08732585 | G102: 2011-03-07T00:00:00.000 | H102: Sí | I102: BACHILLER | J102: ENFERMERIA | K102: UNIVERSIDAD NACIONAL FEDERICO VILLAREAL | L102: PERÚ | M102: Sí | N102: No | O102: No | P102: Contratado | Q102: Tiempo Parcial | R102: 6 | S102: 0 | T102: 6 | U102: No | V102: No | W102: 2016 - I
A103: =R[-1]C+1 -> 103 | B103: CLAROS | C103: SANTIAGO | D103: CARLOS EDUARDO | E103: PERÚ | F103: 40343126 | G103: 2012-04-02T00:00:00.000 | H103: Sí | I103: BACHILLER | J103: CIENCIAS SOCIALES ESPECIALIDAD DE ANTROPOLOGIA | K103: UNIVERSIDAD NACIONAL MAYOR DE SAN MARCOS | L103: PERÚ | M103: Sí | N103: No | O103: No | P103: Contratado | Q103: Tiempo Parcial | R103: 8 | S103: 0 | T103: 8 | U103: No | V103: No | W103: 2016 - I
A104: =R[-1]C+1 -> 104 | B104: COLAN | C104: VALLADARES | D104: CESAR EDUARDO | E104: PERÚ | F104: 41376156 | G104: 2014-04-01T00:00:00.000 | H104: Sí | I104: BACHILLER | J104: EDUCACION | K104: UNIVERSIDAD NACIONAL JOSE FAUSTINO SANCHEZ CARRION | L104: PERÚ | M104: Sí | N104: No | O104: No | P104: Contratado | Q104: Tiempo Parcial | R104: 4 | S104: 0 | T104: 4 | U104: No | V104: No | W104: 2016 - I
A105: =R[-1]C+1 -> 105 | B105: COLLAZOS | C105: GUTIERREZ | D105: ADELMA ELIZABETH | E105: PERÚ | F105: 08042573 | G105: 2000-09-15T00:00:00.000 | H105: Sí | I105: BACHILLER | J105: EDUCACION | K105: UNIVERSIDAD NACIONAL FEDERICO VILLAREAL | L105: PERÚ | M105: Sí | N105: No | O105: No | P105: Contratado | Q105: Tiempo Parcial | R105: 12 | S105: 0 | T105: 12 | U105: No | V105: No | W105: 2016 - I
A106: =R[-1]C+1 -> 106 | B106: CONTINI | C106: . | D106: GIULIANA | E106: ITALIA | F106: 000420096 | G106: 2007-04-14T00:00:00.000 | H106: Sí | I106: BACHILLER | J106: LETRAS | K106: UNIVERSITA CATTOLICA DEL SACRO CUORE | L106: ITALIA | M106: Sí | N106: No | O106: No | P106: Ordinario Principal | Q106: Dedicacion Exclusiva | R106: 8 | S106: 32 | T106: 40 | U106: No | V106: No | W106: 2016 - I | X106: UNIVERSIDAD DE ORIGEN NO OTORGA GRADO ACADEMICO DE BACHILLERA SINO TITULO PROFESIONAL
A107: =R[-1]C+1 -> 107 | B107: CONTRERAS | C107: FLORES | D107: WALTER PEDRO | E107: PERÚ | F107: 07743259 | G107: 2000-09-15T00:00:00.000 | H107: Sí | I107: BACHILLER | J107: COMPUTACION | K107: UNIVERSIDAD NACIONAL MAYOR DE SAN MARCOS | L107: PERÚ | M107: Sí | N107: No | O107: No | P107: Ordinario Auxiliar | Q107: Tiempo Completo | R107: 8 | S107: 32 | T107: 40 | U107: Sí | V107: Sí | W107: 2016 - I
A108: =R[-1]C+1 -> 108 | B108: CORAL | C108: YGNACIO | D108: MARCO ANTONIO | E108: PERÚ | F108: 09983907 | G108: 2011-09-05T00:00:00.000 | H108: Sí | I108: MAESTRO | J108: MAESTRO EN CIENCIAS EN INGENIERIA DE SISTEMAS Y COMPUTACION | K108: UNIVERSIDAD INCA GARCILASO DE LA VEGA | L108: PERÚ | M108: Sí | N108: No | O108: No | P108: Contratado | Q108: Tiempo Parcial | R108: 14 | S108: 0 | T108: 14 | U108: Sí | V108: Sí | W108: 2016 - I
A109: =R[-1]C+1 -> 109 | B109: CORDOVA | C109: SALCEDO | D109: FELIMON DOMINGO | E109: PERÚ | F109: 16647035 | G109: 2012-03-05T00:00:00.000 | H109: Sí | I109: MAESTRO | J109: CIENCIAS DE LA EDUCACION CON MENCION EN DOCENCIA UNIVERSITARIA | K109: UNIVERSIDAD NACIONAL DE EDUCACION ENRIQUE GUZMAN Y VALLE | L109: PERÚ | M109: Sí | N109: No | O109: No | P109: Contratado | Q109: Tiempo Completo | R109: 20 | S109: 20 | T109: 40 | U109: No | V109: Sí | W109: 2016 - I
A110: =R[-1]C+1 -> 110 | B110: CORONADO | C110: SANTILLAN | D110: LUIS AUGUSTO | E110: PERÚ | F110: 21444290 | G110: 2014-03-14T00:00:00.000 | H110: Sí | I110: BACHILLER | J110: MEDICINA HUMANA | K110: UNIVERSIDAD SAN LUIS GONZAGA DE ICA | L110: PERÚ | M110: Sí | N110: No | O110: No | P110: Contratado | Q110: Tiempo Parcial | R110: 4 | S110: 0 | T110: 4 | U110: No | V110: No | W110: 2016 - I
A111: =R[-1]C+1 -> 111 | B111: CORONEL | C111: QUINTEROS | D111: EDITH MARIA | E111: PERÚ | F111: 21060243 | G111: 2014-03-18T00:00:00.000 | H111: Sí | I111: BACHILLER | J111: LICENCIADA EN CIENCIAS RELIGIOSAS | K111: UNIVERSIDAD CATOLICA BOLIVARIANA SAN PABLO | L111: BOLIVIA | M111: Sí | N111: No | O111: No | P111: Contratado | Q111: Tiempo Completo | R111: 26 | S111: 14 | T111: 40 | U111: No | V111: No | W111: 2016 - I | X111: UNIVERSIDAD DE ORIGEN NO OTORGA GRADO ACADEMICO DE BACHILLERA SINO TITULO PROFESIONAL
A112: =R[-1]C+1 -> 112 | B112: CORTEZ | C112: MONDRAGON | D112: CESAR SEGUNDO | E112: PERÚ | F112: 08569923 | G112: 2000-05-02T00:00:00.000 | H112: Sí | I112: BACHILLER | J112: EDUCACION | K112: UNIVERSIDAD NACIONAL MAYOR DE SAN MARCOS | L112: PERÚ | M112: Sí | N112: No | O112: No | P112: Ordinario Auxiliar | Q112: Tiempo Completo | R112: 16 | S112: 24 | T112: 40 | U112: No | V112: No | W112: 2016 - I
A113: =R[-1]C+1 -> 113 | B113: COSTA | C113: RODRIGUEZ | D113: JORGE EDUARDO | E113: PERÚ | F113: 10063247 | G113: 2010-03-09T00:00:00.000 | H113: Sí | I113: MAESTRO | J113: MASTER UNIVERSITARIO DE I LIVELLO IN GESTIONE STRATEGICA FINANZA E INTERNAZIONALIZZAZIONE DELLE IMPR | K113: UNIVERSITA DEGLI STUDI DI GENOVA | L113: ITALIA | M113: Sí | N113: Sí | O113: No | P113: Ordinario Auxiliar | Q113: Tiempo Completo | R113: 12 | S113: 28 | T113: 40 | U113: No | V113: Sí | W113: 2016 - I
A114: =R[-1]C+1 -> 114 | B114: COZ | C114: CONTRERAS | D114: SOFIA | E114: PERÚ | F114: 40580884 | G114: 2007-03-01T00:00:00.000 | H114: Sí | I114: BACHILLER | J114: PSICOLOGIA | K114: UNIVERSIDAD DE SAN MARTIN DE PORRES | L114: PERÚ | M114: Sí | N114: No | O114: No | P114: Ordinario Auxiliar | Q114: Tiempo Completo | R114: 8 | S114: 32 | T114: 40 | U114: No | V114: No | W114: 2016 - I
A115: =R[-1]C+1 -> 115 | B115: COZ | C115: CONTRERAS | D115: VANESA CAROLINA | E115: PERÚ | F115: 06807083 | G115: 2008-10-01T00:00:00.000 | H115: Sí | I115: BACHILLER | J115: MEDICINA | K115: UNIVERSIDAD DE SAN MARTIN DE PORRES | L115: PERÚ | M115: Sí | N115: No | O115: No | P115: Ordinario Auxiliar | Q115: Tiempo Completo | R115: 13 | S115: 27 | T115: 40 | U115: No | V115: No | W115: 2016 - I
A116: =R[-1]C+1 -> 116 | B116: CRISTOBAL | C116: VELASQUEZ | D116: DORIS HILDA | E116: PERÚ | F116: 08780148 | G116: 2000-05-02T00:00:00.000 | H116: Sí | I116: BACHILLER | J116: EDUCACION | K116: UNIVERSIDAD RICARDO PALMA | L116: PERÚ | M116: Sí | N116: No | O116: No | P116: Ordinario Auxiliar | Q116: Tiempo Completo | R116: 4 | S116: 36 | T116: 40 | U116: No | V116: No | W116: 2016 - I
A117: =R[-1]C+1 -> 117 | B117: CRUZ | C117: ACUÑA | D117: EDGAR ODON | E117: PERÚ | F117: 06660409 | G117: 2010-03-09T00:00:00.000 | H117: Sí | I117: MAESTRO | J117: MAESTRIA EN SAGRADA TEOLOGIA MENCION EN TEOLOGIA DOGMATICA | K117: FACULTAD DE TEOLOGIA PONTIFICIA Y CIVIL DE LIMA | L117: PERÚ | M117: Sí | N117: No | O117: No | P117: Contratado | Q117: Tiempo Completo | R117: 16 | S117: 24 | T117: 40 | U117: No | V117: Sí | W117: 2016 - I
A118: =R[-1]C+1 -> 118 | B118: CRUZADO | C118: MELENDEZ | D118: MELINA ROXANA | E118: PERÚ | F118: 40113161 | G118: 2010-09-09T00:00:00.000 | H118: Sí | I118: BACHILLER | J118: TECNOLOGIA MEDICA | K118: UNIVERSIDAD NACIONAL MAYOR DE SAN MARCOS | L118: PERÚ | M118: Sí | N118: No | O118: No | P118: Ordinario Auxiliar | Q118: Tiempo Completo | R118: 8 | S118: 32 | T118: 40 | U118: No | V118: No | W118: 2016 - I
A119: =R[-1]C+1 -> 119 | B119: DAVALOS | C119: ARCA | D119: JOSEPH KENNETH | E119: PERÚ | F119: 41414387 | G119: 2013-09-11T00:00:00.000 | H119: Sí | I119: BACHILLER | J119: NUTRICION | K119: UNIVERSIDAD NACIONAL MAYOR DE SAN MARCOS | L119: PERÚ | M119: Sí | N119: No | O119: No | P119: Contratado | Q119: Tiempo Parcial | R119: 10 | S119: 0 | T119: 10 | U119: No | V119: No | W119: 2016 - I
A120: =R[-1]C+1 -> 120 | B120: DAVILA | C120: LAGUNA | D120: RONALD FERNANDO | E120: PERÚ | F120: 22423025 | G120: 2016-03-05T00:00:00.000 | H120: No | I120: MAESTRO | J120: MAGISTER EN GESTION DEL DESARROLLO SOCIAL | K120: UNIVERSIDAD NACIONAL HERMILIO VALDIZAN | L120: PERÚ | M120: Sí | N120: No | O120: No | P120: Contratado | Q120: Tiempo Parcial | R120: 6 | S120: 0 | T120: 6 | U120: No | V120: No | W120: 2016 - I
A121: =R[-1]C+1 -> 121 | B121: DAVILA | C121: TAPIA | D121: JOSE VICENTE | E121: PERÚ | F121: 08519098 | G121: 2013-03-11T00:00:00.000 | H121: Sí | I121: BACHILLER | J121: CIENCIAS CON MENCION EN INGENIERIA QUIMICA | K121: UNIVERSIDAD NACIONAL DE INGENIERIA | L121: PERÚ | M121: Sí | N121: No | O121: No | P121: Contratado | Q121: Tiempo Parcial | R121: 4 | S121: 0 | T121: 4 | U121: No | V121: No | W121: 2016 - I
A122: =R[-1]C+1 -> 122 | B122: DE LA CRUZ | C122: CAMACO | D122: DANTE PEDRO | E122: PERÚ | F122: 07681903 | G122: 2014-06-02T00:00:00.000 | H122: Sí | I122: BACHILLER | J122: CIENCIAS DE LA EDUCACION | K122: UNIVERSIDAD NACIONAL DE EDUCACION ENRIQUE GUZMAN Y VALLE | L122: PERÚ | M122: Sí | N122: No | O122: No | P122: Contratado | Q122: Tiempo Completo | R122: 14 | S122: 26 | T122: 40 | U122: No | V122: No | W122: 2016 - I
A123: =R[-1]C+1 -> 123 | B123: DE LA ROSA | C123: VALVERDE | D123: CECILIA MELCHORA | E123: PERÚ | F123: 08707499 | G123: 2014-03-13T00:00:00.000 | H123: Sí | I123: MAESTRO | J123: MAGISTER EN PSICOLOGIA MENCION PSICOLOGIA EMPRESARIAL | K123: UNIVERSIDAD FEMENINA DEL SAGRADO CORAZON | L123: PERÚ | M123: Sí | N123: No | O123: No | P123: Contratado | Q123: Tiempo Completo | R123: 8 | S123: 32 | T123: 40 | U123: No | V123: Sí | W123: 2016 - I
A124: =R[-1]C+1 -> 124 | B124: DE LA ROSA | C124: VALVERDE | D124: PEDRO LUIS ENRIQUE | E124: PERÚ | F124: 08737456 | G124: 2002-04-08T00:00:00.000 | H124: Sí | I124: BACHILLER | J124: CIENCIAS CONTABLES | K124: UNIVERSIDAD DE SAN MARTIN DE PORRES | L124: PERÚ | M124: Sí | N124: No | O124: No | P124: Ordinario Auxiliar | Q124: Tiempo Completo | R124: 22 | S124: 18 | T124: 40 | U124: No | V124: No | W124: 2016 - I
A125: =R[-1]C+1 -> 125 | B125: DEL BUSTO | C125: BRETONECHE | D125: RAFAEL MARTIN | E125: PERÚ | F125: 07760676 | G125: 2005-02-01T00:00:00.000 | H125: Sí | I125: BACHILLER | J125: PSICOLOGIA | K125: UNIVERSIDAD DE SAN MARTIN DE PORRES | L125: PERÚ | M125: Sí | N125: No | O125: No | P125: Ordinario Auxiliar | Q125: Tiempo Completo | R125: 32 | S125: 8 | T125: 40 | U125: No | V125: No | W125: 2016 - I
A126: =R[-1]C+1 -> 126 | B126: DEL BUSTO | C126: BRETONECHE | D126: RAUL ENRIQUE | E126: PERÚ | F126: 07764635 | G126: 2007-04-02T00:00:00.000 | H126: Sí | I126: BACHILLER | J126: EDUCACION | K126: UNIVERSIDAD MARCELINO CHAMPAGNAT | L126: PERÚ | M126: Sí | N126: No | O126: No | P126: Contratado | Q126: Tiempo Completo | R126: 8 | S126: 32 | T126: 40 | U126: No | V126: No | W126: 2016 - I
A127: =R[-1]C+1 -> 127 | B127: DEL CAMPO | C127: GAYTAN | D127: TEOBALDO JULIO | E127: PERÚ | F127: 07876526 | G127: 2016-03-04T00:00:00.000 | H127: No | I127: MAESTRO | J127: MAGISTER EN DERECHO DEL TRABAJO Y DE LA SEGURIDAD SOCIAL | K127: PONTIFICIA UNIVERSIDAD CATOLICA DEL PERU | L127: PERÚ | M127: Sí | N127: No | O127: No | P127: Contratado | Q127: Tiempo Parcial | R127: 4 | S127: 0 | T127: 4 | U127: No | V127: No | W127: 2016 - I
A128: =R[-1]C+1 -> 128 | B128: DELGADO | C128: HEREDIA | D128: ELIAS | E128: PERÚ | F128: 41296093 | G128: 2012-04-18T00:00:00.000 | H128: Sí | I128: BACHILLER | J128: EDUCACION | K128: FACULTAD DE TEOLOGIA PONTIFICIA Y CIVIL DE LIMA | L128: PERÚ | M128: Sí | N128: No | O128: No | P128: Contratado | Q128: Tiempo Parcial | R128: 8 | S128: 0 | T128: 8 | U128: No | V128: No | W128: 2016 - I
A129: =R[-1]C+1 -> 129 | B129: DIAZ | C129: DIAZ | D129: LILIANA | E129: PERÚ | F129: 10738430 | G129: 2013-03-12T00:00:00.000 | H129: Sí | I129: MAESTRO | J129: TERAPIA DE CONDUCTA | K129: UNIVERSIDAD NACIONAL DE EDUCACION A DISTANCIA | L129: ESPAÑA | M129: Sí | N129: No | O129: No | P129: Contratado | Q129: Tiempo Parcial | R129: 4 | S129: 0 | T129: 4 | U129: No | V129: No | W129: 2016 - I
A130: =R[-1]C+1 -> 130 | B130: DIAZ | C130: GERVASI | D130: GIOVANI MARTIN | E130: PERÚ | F130: 10301350 | G130: 2009-05-01T00:00:00.000 | H130: Sí | I130: MAESTRO | J130: PSICOLOGIA CLINICA CON MENCION EN PSICOLOGIA DE LA SALUD | K130: UNIVERSIDAD PERUANA CAYETANO HEREDIA | L130: PERÚ | M130: Sí | N130: No | O130: No | P130: Contratado | Q130: Tiempo Completo | R130: 8 | S130: 32 | T130: 40 | U130: Sí | V130: Sí | W130: 2016 - I
A131: =R[-1]C+1 -> 131 | B131: DIAZ | C131: NONATO | D131: MIGUEL ALCIDES | E131: PERÚ | F131: 15693637 | G131: 2013-03-15T00:00:00.000 | H131: Sí | I131: BACHILLER | J131: AGRONOMIA | K131: UNIVERSIDAD NACIONAL JOSE FAUSTINO SANCHEZ CARRION | L131: PERÚ | M131: Sí | N131: No | O131: No | P131: Contratado | Q131: Tiempo Parcial | R131: 4 | S131: 0 | T131: 4 | U131: No | V131: No | W131: 2016 - I
A132: =R[-1]C+1 -> 132 | B132: DIAZ | C132: PARDAVE | D132: MIGUEL ANGEL | E132: PERÚ | F132: 40074376 | G132: 2014-03-14T00:00:00.000 | H132: Sí | I132: BACHILLER | J132: INGENIERIA CIVIL | K132: UNIVERSIDAD NACIONAL DE INGENIERIA | L132: PERÚ | M132: Sí | N132: No | O132: No | P132: Contratado | Q132: Tiempo Parcial | R132: 10 | S132: 2 | T132: 12 | U132: No | V132: Sí | W132: 2016 - I
A133: =R[-1]C+1 -> 133 | B133: DIAZ | C133: VARGAS | D133: SELENI ADILIA | E133: PERÚ | F133: 10603883 | G133: 2008-05-01T00:00:00.000 | H133: Sí | I133: BACHILLER | J133: EDUCACION | K133: UNIVERSIDAD CATOLICA SEDES SAPIENTIAE | L133: PERÚ | M133: Sí | N133: No | O133: No | P133: Contratado | Q133: Tiempo Parcial | R133: 8 | S133: 15 | T133: 23 | U133: No | V133: No | W133: 2016 - I
A134: =R[-1]C+1 -> 134 | B134: DOMINGUEZ | C134: JARA | D134: ALICIO VICTOR | E134: PERÚ | F134: 07149775 | G134: 2000-09-15T00:00:00.000 | H134: Sí | I134: BACHILLER | J134: DERECHO | K134: UNIVERSIDAD NACIONAL FEDERICO VILLAREAL | L134: PERÚ | M134: Sí | N134: No | O134: No | P134: Ordinario Auxiliar | Q134: Tiempo Completo | R134: 10 | S134: 30 | T134: 40 | U134: No | V134: No | W134: 2016 - I
A135: =R[-1]C+1 -> 135 | B135: DUCOS | C135: CASAS | D135: TEODORICO JESUS ADOLFO ST | E135: PERÚ | F135: 07847018 | G135: 2014-04-01T00:00:00.000 | H135: Sí | I135: BACHILLER | J135: INGENIERIA INDUSTRIAL | K135: UNIVERSIDAD NACIONAL DEL CALLAO | L135: PERÚ | M135: Sí | N135: No | O135: No | P135: Contratado | Q135: Tiempo Parcial | R135: 6 | S135: 8 | T135: 14 | U135: No | V135: No | W135: 2016 - I
A136: =R[-1]C+1 -> 136 | B136: ECHEGARAY | C136: ROMERO | D136: HECTOR ORLANDO | E136: PERÚ | F136: 15607816 | G136: 2012-09-11T00:00:00.000 | H136: Sí | I136: BACHILLER | J136: CIENCIAS CONTABLES Y FINANCIERAS | K136: UNIVERSIDAD NACIONAL JOSE FAUSTINO SANCHEZ CARRION | L136: PERÚ | M136: Sí | N136: No | O136: No | P136: Contratado | Q136: Tiempo Parcial | R136: 12 | S136: 0 | T136: 12 | U136: No | V136: Sí | W136: 2016 - I
A137: =R[-1]C+1 -> 137 | B137: EGOAVIL | C137: DE LA CRUZ | D137: CARLOS HUGO | E137: PERÚ | F137: 09887433 | G137: 2011-05-02T00:00:00.000 | H137: Sí | I137: BACHILLER | J137: CIENCIAS AGRONOMIA | K137: UNIVERSIDAD NACIONAL AGRARIA | L137: PERÚ | M137: Sí | N137: No | O137: No | P137: Contratado | Q137: Tiempo Parcial | R137: 16 | S137: 0 | T137: 16 | U137: No | V137: No | W137: 2016 - I
A138: =R[-1]C+1 -> 138 | B138: ELESCANO | C138: CORDOVA | D138: WILFREDO CLEMENTE | E138: PERÚ | F138: 08581718 | G138: 2000-02-05T00:00:00.000 | H138: Sí | I138: MAESTRO | J138: MAESTRO EN INGENIERIA DE SISTEMAS | K138: UNIVERSIDAD ALAS PERUANAS | L138: PERÚ | M138: Sí | N138: No | O138: No | P138: Ordinario Auxiliar | Q138: Tiempo Completo | R138: 20 | S138: 20 | T138: 40 | U138: No | V138: Sí | W138: 2016 - I
A139: =R[-1]C+1 -> 139 | B139: ENCISO | C139: ZAVALA | D139: FAUSTA ISABEL | E139: PERÚ | F139: 10000717 | G139: 2003-03-01T00:00:00.000 | H139: Sí | I139: BACHILLER | J139: CIENCIAS FINANCIERAS | K139: UNIVERSIDAD NACIONAL FEDERICO VILLAREAL | L139: PERÚ | M139: Sí | N139: No | O139: No | P139: Ordinario Auxiliar | Q139: Tiempo Completo | R139: 0 | S139: 40 | T139: 40 | U139: No | V139: No | W139: 2016 - I | X139: JEFE DE OFICINA DE FINANZAS
A140: =R[-1]C+1 -> 140 | B140: ENRIQUE | C140: CORDOVA | D140: ELBERT | E140: PERÚ | F140: 80224089 | G140: 2013-08-19T00:00:00.000 | H140: Sí | I140: MAESTRO | J140: ADMINISTRACION CON MENCION EN NEGOCIOS INTERNACIONALES Y LOGISTICA DE EXPORTACION | K140: UNIVERSIDAD NACIONAL DE PIURA | L140: PERÚ | M140: Sí | N140: No | O140: No | P140: Contratado | Q140: Tiempo Parcial | R140: 23 | S140: 0 | T140: 23 | U140: No | V140: No | W140: 2016 - I
A141: =R[-1]C+1 -> 141 | B141: ENRIQUEZ | C141: CACERES | D141: MANUEL IGNACIO | E141: PERÚ | F141: 29533833 | G141: 2011-05-13T00:00:00.000 | H141: Sí | I141: BACHILLER | J141: MEDICINA | K141: UNIVERSIDAD NACIONAL DE SAN AGUSTIN | L141: PERÚ | M141: Sí | N141: No | O141: No | P141: Ordinario Auxiliar | Q141: Tiempo Parcial | R141: 0 | S141: 20 | T141: 20 | U141: No | V141: No | W141: 2016 - I | X141: LSGH- DOCENTE NONBRADO
A142: =R[-1]C+1 -> 142 | B142: ENRIQUEZ | C142: CANTO | D142: YORDANIS | E142: CUBA | F142: 001067402 | G142: 2014-04-21T00:00:00.000 | H142: Sí | I142: DOCTOR | J142: DOTTORATO DI RICERCA IN BIOETICA | K142: UNIVERSITA CATTOLICA DEL SACRO CUORE | L142: ITALIA | M142: Sí | N142: No | O142: No | P142: Contratado | Q142: Tiempo Completo | R142: 10 | S142: 30 | T142: 40 | U142: Sí | V142: Sí | W142: 2016 - I
A143: =R[-1]C+1 -> 143 | B143: ERAZO | C143: CAMACHO | D143: MILTON ROYER | E143: PERÚ | F143: 44369968 | G143: 2012-03-05T00:00:00.000 | H143: Sí | I143: BACHILLER | J143: ECONOMIA Y FINANZAS | K143: UNIVERSIDAD NACIONAL JOSE FAUSTINO SANCHEZ CARRION | L143: PERÚ | M143: Sí | N143: No | O143: No | P143: Contratado | Q143: Tiempo Parcial | R143: 16 | S143: 0 | T143: 16 | U143: No | V143: No | W143: 2016 - I
A144: =R[-1]C+1 -> 144 | B144: ESPINOLA | C144: MARIÑOS | D144: WILDER ALEX | E144: PERÚ | F144: 18170287 | G144: 2012-03-12T00:00:00.000 | H144: Sí | I144: BACHILLER | J144: MEDICINA | K144: UNIVERSIDAD NACIONAL DE TRUJILLO | L144: PERÚ | M144: Sí | N144: No | O144: No | P144: Contratado | Q144: Tiempo Parcial | R144: 12 | S144: 0 | T144: 12 | U144: No | V144: No | W144: 2016 - I
A145: =R[-1]C+1 -> 145 | B145: ESPINOZA | C145: ALATA | D145: REYNALDO VICTOR | E145: PERÚ | F145: 08042574 | G145: 2000-09-15T00:00:00.000 | H145: Sí | I145: BACHILLER | J145: INGENIERIA INDUSTRIAL | K145: UNIVERSIDAD NACIONAL FEDERICO VILLAREAL | L145: PERÚ | M145: Sí | N145: No | O145: No | P145: Contratado | Q145: Tiempo Parcial | R145: 18 | S145: 0 | T145: 18 | U145: No | V145: No | W145: 2016 - I
A146: =R[-1]C+1 -> 146 | B146: ESTARES | C146: PORRAS | D146: OMAR EDUARDO | E146: PERÚ | F146: 21134423 | G146: 2012-09-03T00:00:00.000 | H146: Sí | I146: BACHILLER | J146: CIENCIAS PECUARIAS | K146: UNIVERSIDAD NACIONAL AGRARIA DE LA SELVA | L146: PERÚ | M146: Sí | N146: No | O146: No | P146: Contratado | Q146: Tiempo Parcial | R146: 6 | S146: 0 | T146: 6 | U146: No | V146: No | W146: 2016 - I
A147: =R[-1]C+1 -> 147 | B147: FARFAN | C147: ZEGARRA | D147: HAROLD MARTIN | E147: PERÚ | F147: 32544407 | G147: 2012-03-15T00:00:00.000 | H147: Sí | I147: BACHILLER | J147: ZOOTECNIA | K147: UNIVERSIDAD NACIONAL DE PIURA | L147: PERÚ | M147: Sí | N147: No | O147: No | P147: Contratado | Q147: Tiempo Parcial | R147: 13 | S147: 0 | T147: 13 | U147: No | V147: No | W147: 2016 - I
A148: =R[-1]C+1 -> 148 | B148: FERNANDEZ | C148: CARDOZA | D148: JANET DEL ROSARIO | E148: PERÚ | F148: 32543625 | G148: 2013-03-04T00:00:00.000 | H148: Sí | I148: BACHILLER | J148: TECNOLOGIA MEDICA | K148: UNIVERSIDAD PERUANA CAYETANO HEREDIA | L148: PERÚ | M148: Sí | N148: No | O148: No | P148: Contratado | Q148: Tiempo Parcial | R148: 8 | S148: 0 | T148: 8 | U148: No | V148: No | W148: 2016 - I
A149: =R[-1]C+1 -> 149 | B149: FERNANDEZ | C149: CONDORI | D149: ROXANA CARLA | E149: PERÚ | F149: 09600036 | G149: 2011-09-08T00:00:00.000 | H149: Sí | I149: MAESTRO | J149: MAESTRA EN BIOQUIMICA Y NUTRICION | K149: UNIVERSIDAD DE SAN MARTIN DE PORRES | L149: PERÚ | M149: Sí | N149: No | O149: No | P149: Ordinario Asociado | Q149: Tiempo Parcial | R149: 4 | S149: 16 | T149: 20 | U149: No | V149: No | W149: 2016 - I
A150: =R[-1]C+1 -> 150 | B150: FERNANDEZ | C150: CRUZ | D150: EMILIANO | E150: PERÚ | F150: 42153498 | G150: 2013-09-12T00:00:00.000 | H150: Sí | I150: BACHILLER | J150: CIENCIAS ADMINISTRATIVAS | K150: UNIVERSIDAD NACIONAL AGRARIA DE LA SELVA | L150: PERÚ | M150: Sí | N150: No | O150: No | P150: Contratado | Q150: Tiempo Parcial | R150: 8 | S150: 0 | T150: 8 | U150: No | V150: No | W150: 2016 - I
A151: =R[-1]C+1 -> 151 | B151: FERNANDEZ | C151: MONTEMAYOR | D151: VERONICA INES | E151: PERÚ | F151: 40962158 | G151: 2011-05-02T00:00:00.000 | H151: Sí | I151: MAESTRO | J151: MAGISTER EN LITERATURA INFANTIL JUVENIL Y ANIMACION A LA LECTURA | K151: UNIVERSIDAD CATOLICA SEDES SAPIENTIAE | L151: PERÚ | M151: Sí | N151: No | O151: No | P151: Contratado | Q151: Tiempo Parcial | R151: 0 | S151: 23 | T151: 23 | U151: No | V151: No | W151: 2016 - I | X151: COORDINADORA DE MAESTRIA DE FACULTAD DE CIENCIAS DE LA EDUCACION - ESCUELA POSTGRAGO
A152: =R[-1]C+1 -> 152 | B152: FERNANDEZ | C152: SUASNABAR | D152: SELENA CELESTE | E152: PERÚ | F152: 21133103 | G152: 2014-03-17T00:00:00.000 | H152: Sí | I152: BACHILLER | J152: PSICOLOGIA | K152: UNIVERSIDAD NACIONAL MAYOR DE SAN MARCOS | L152: PERÚ | M152: Sí | N152: No | O152: No | P152: Contratado | Q152: Tiempo Completo | R152: 26 | S152: 14 | T152: 40 | U152: No | V152: No | W152: 2016 - I
A153: =R[-1]C+1 -> 153 | B153: FIGUEROA | C153: ANAMARIA | D153: JORGE HUGO | E153: PERÚ | F153: 10683741 | G153: 2004-04-01T00:00:00.000 | H153: Sí | I153: BACHILLER | J153: ECONOMIA | K153: UNIVERSIDAD NACIONAL MAYOR DE SAN MARCOS | L153: PERÚ | M153: Sí | N153: No | O153: No | P153: Ordinario Auxiliar | Q153: Tiempo Completo | R153: 8 | S153: 32 | T153: 40 | U153: No | V153: No | W153: 2016 - I
A154: =R[-1]C+1 -> 154 | B154: FLORES | C154: BALLESTEROS | D154: TEODORO EMILIO | E154: PERÚ | F154: 08612078 | G154: 2007-09-03T00:00:00.000 | H154: Sí | I154: MAESTRO | J154: MAESTRO EN FINANZAS | K154: UNIVERSIDAD NACIONAL FEDERICO VILLAREAL | L154: PERÚ | M154: Sí | N154: Sí | O154: No | P154: Ordinario Auxiliar | Q154: Tiempo Completo | R154: 20 | S154: 20 | T154: 40 | U154: No | V154: No | W154: 2016 - I
A155: =R[-1]C+1 -> 155 | B155: FLORES | C155: MORALES | D155: JORGE ALBERTO | E155: PERÚ | F155: 08039505 | G155: 2016-03-01T00:00:00.000 | H155: No | I155: DOCTOR | J155: ADMINISTRACION DE LA EDUCACION | K155: UNIVERSIDAD CESAR VALLEJO | L155: PERÚ | M155: Sí | N155: No | O155: No | P155: Contratado | Q155: Tiempo Parcial | R155: 4 | S155: 0 | T155: 4 | U155: No | V155: Sí | W155: 2016 - I
A156: =R[-1]C+1 -> 156 | B156: FLORES | C156: ORTEGA | D156: YESSIKA GRAYA | E156: PERÚ | F156: 09854418 | G156: 2008-04-08T00:00:00.000 | H156: Sí | I156: BACHILLER | J156: MEDICINA | K156: UNIVERSIDAD PERUANA CAYETANO HEREDIA | L156: PERÚ | M156: Sí | N156: No | O156: No | P156: Ordinario Auxiliar | Q156: Tiempo Completo | R156: 0 | S156: 40 | T156: 40 | U156: No | V156: No | W156: 2016 - I
A157: =R[-1]C+1 -> 157 | B157: FLORES | C157: PALOMINO | D157: FLORESMILO | E157: PERÚ | F157: 06859230 | G157: 2008-04-05T00:00:00.000 | H157: Sí | I157: BACHILLER | J157: CIENCIAS ECONOMICAS | K157: UNIVERSIDAD NACIONAL FEDERICO VILLAREAL | L157: PERÚ | M157: Sí | N157: No | O157: No | P157: Contratado | Q157: Tiempo Parcial | R157: 20 | S157: 0 | T157: 20 | U157: No | V157: Sí | W157: 2016 - I
A158: =R[-1]C+1 -> 158 | B158: FONSECA | C158: RIVERA | D158: IRMA CAROLINA | E158: PERÚ | F158: 17611959 | G158: 2014-04-01T00:00:00.000 | H158: Sí | I158: BACHILLER | J158: CIENCIAS BIOLOGICAS | K158: UNIVERSIDAD NACIONAL PEDRO RUIZ GALLO | L158: PERÚ | M158: Sí | N158: No | O158: No | P158: Contratado | Q158: Tiempo Parcial | R158: 22 | S158: 0 | T158: 22 | U158: No | V158: No | W158: 2016 - I
A159: =R[-1]C+1 -> 159 | B159: FRANCO | C159: DEL CASTILLO | D159: GLORIA NADIA | E159: PERÚ | F159: 41291740 | G159: 2013-04-10T00:00:00.000 | H159: Sí | I159: BACHILLER | J159: PSICOLOGIA | K159: UNIVERSIDAD NACIONAL FEDERICO VILLAREAL | L159: PERÚ | M159: Sí | N159: No | O159: No | P159: Contratado | Q159: Tiempo Parcial | R159: 8 | S159: 0 | T159: 8 | U159: No | V159: No | W159: 2016 - I
A160: =R[-1]C+1 -> 160 | B160: FUENTES | C160: SUPANTA DE FUKUNAGA | D160: NORMA | E160: PERÚ | F160: 07708918 | G160: 2000-02-05T00:00:00.000 | H160: Sí | I160: MAESTRO | J160: EDUCACION | K160: UNIVERSIDAD DE SAN MARTIN DE PORRES | L160: PERÚ | M160: Sí | N160: No | O160: No | P160: Ordinario Asociado | Q160: Tiempo Completo | R160: 8 | S160: 32 | T160: 40 | U160: No | V160: Sí | W160: 2016 - I
A161: =R[-1]C+1 -> 161 | B161: GAGO | C161: RODRIGO | D161: KATIA ELVA | E161: PERÚ | F161: 40660826 | G161: 2012-10-03T00:00:00.000 | H161: Sí | I161: BACHILLER | J161: TECNOLOGIA MEDICA | K161: UNIVERSIDAD NACIONAL MAYOR DE SAN MARCOS | L161: PERÚ | M161: Sí | N161: No | O161: No | P161: Contratado | Q161: Tiempo Parcial | R161: 4 | S161: 0 | T161: 4 | U161: No | V161: No | W161: 2016 - I
A162: =R[-1]C+1 -> 162 | B162: GALINDO | C162: GONZALES | D162: TANIA DEL CARMEN | E162: PERÚ | F162: 09607929 | G162: 2011-09-05T00:00:00.000 | H162: Sí | I162: MAESTRO | J162: EDUCACION CON MENCION EN DOCENCIA Y GESTION EDUCATIVA | K162: UNIVERSIDAD CESAR VALLEJO | L162: PERÚ | M162: Sí | N162: No | O162: No | P162: Contratado | Q162: Tiempo Parcial | R162: 12 | S162: 0 | T162: 12 | U162: No | V162: No | W162: 2016 - I
A163: =R[-1]C+1 -> 163 | B163: GAMARRA | C163: CUEVA | D163: ALEXANDER | E163: PERÚ | F163: 43253292 | G163: 2013-09-09T00:00:00.000 | H163: Sí | I163: BACHILLER | J163: INGENIERIA ELECTRONICA | K163: UNIVERSIDAD NACIONAL PEDRO RUIZ GALLO | L163: PERÚ | M163: Sí | N163: No | O163: No | P163: Contratado | Q163: Tiempo Parcial | R163: 18 | S163: 0 | T163: 18 | U163: No | V163: No | W163: 2016 - I
A164: =R[-1]C+1 -> 164 | B164: GAMBATESA | C164: . | D164: RUGGIERO | E164: ITALIA | F164: 000834605 | G164: 2013-06-01T00:00:00.000 | H164: Sí | I164: BACHILLER | J164: CIRUJANO DENTISTA | K164: UNIVERSIDAD PERUANA CAYETANO HEREDIA | L164: PERÚ | M164: Sí | N164: No | O164: No | P164: Contratado | Q164: Tiempo Completo | R164: 0 | S164: 40 | T164: 40 | U164: No | V164: No | W164: 2016 - I | X164: TITULO PROFESIONAL REVALIDADO POR LA UNIVERSIDAD PERUANA CAYETANO HEREDIA. TITULO PROFESIONAL CIRUJANO DENTISTA UNIVERSIDAD PERUANA CAYETANO HEREDIA PERÚ / CIRUJANO DEL CENTRO ODONTOLOGICO.
A165: =R[-1]C+1 -> 165 | B165: GARCES | C165: DIAZ | D165: VICTOR | E165: PERÚ | F165: 32860015 | G165: 2014-03-11T00:00:00.000 | H165: Sí | I165: BACHILLER | J165: INGENIERIA CIVIL | K165: UNIVERSIDAD PRIVADA LOS ANGELES | L165: PERÚ | M165: Sí | N165: No | O165: No | P165: Contratado | Q165: Tiempo Parcial | R165: 6 | S165: 4 | T165: 10 | U165: No | V165: No | W165: 2016 - I
A166: =R[-1]C+1 -> 166 | B166: GARCIA | C166: MASIAS | D166: JESSICA VANESSA | E166: PERÚ | F166: 10818578 | G166: 2008-10-01T00:00:00.000 | H166: Sí | I166: BACHILLER | J166: CIENCIAS PECUARIAS | K166: UNIVERSIDAD NACIONAL AGRARIA DE LA SELVA | L166: PERÚ | M166: Sí | N166: No | O166: No | P166: Ordinario Auxiliar | Q166: Tiempo Completo | R166: 0 | S166: 40 | T166: 40 | U166: No | V166: Sí | W166: 2016 - I | X166: LCGH
A167: =R[-1]C+1 -> 167 | B167: GARCIA | C167: REGAL | D167: RAUL FRANCISCO | E167: PERÚ | F167: 07722412 | G167: 2007-04-02T00:00:00.000 | H167: Sí | I167: BACHILLER | J167: BIOLOGIA | K167: UNIVERSIDAD RICARDO PALMA | L167: PERÚ | M167: Sí | N167: No | O167: No | P167: Ordinario Auxiliar | Q167: Tiempo Completo | R167: 18 | S167: 22 | T167: 40 | U167: No | V167: Sí | W167: 2016 - I
A168: =R[-1]C+1 -> 168 | B168: GARCIA | C168: ROJAS | D168: VIDAL SATURNINO | E168: PERÚ | F168: 09781789 | G168: 2011-09-05T00:00:00.000 | H168: Sí | I168: BACHILLER | J168: CIENCIAS DE LA EDUCACION | K168: UNIVERSIDAD NACIONAL DE EDUCACION ENRIQUE GUZMAN Y VALLE | L168: PERÚ | M168: Sí | N168: No | O168: No | P168: Contratado | Q168: Tiempo Completo | R168: 12 | S168: 28 | T168: 40 | U168: No | V168: No | W168: 2016 - I
A169: =R[-1]C+1 -> 169 | B169: GARCIA | C169: ROJAS | D169: YRMA DORIS | E169: PERÚ | F169: 06914150 | G169: 2000-09-15T00:00:00.000 | H169: Sí | I169: BACHILLER | J169: CIENCIAS DE LA EDUCACION | K169: UNIVERSIDAD NACIONAL HERMILIO VALDIZAN | L169: PERÚ | M169: Sí | N169: No | O169: No | P169: Ordinario Auxiliar | Q169: Tiempo Completo | R169: 12 | S169: 28 | T169: 40 | U169: No | V169: No | W169: 2016 - I
A170: =R[-1]C+1 -> 170 | B170: GARCIA | C170: SUSANO | D170: MARITZA GIOVANA | E170: PERÚ | F170: 15727139 | G170: 2013-08-19T00:00:00.000 | H170: Sí | I170: BACHILLER | J170: INGENIERIA QUIMICA | K170: UNIVERSIDAD NACIONAL JOSE FAUSTINO SANCHEZ CARRION | L170: PERÚ | M170: Sí | N170: No | O170: No | P170: Contratado | Q170: Tiempo Parcial | R170: 14 | S170: 0 | T170: 14 | U170: No | V170: No | W170: 2016 - I
A171: =R[-1]C+1 -> 171 | B171: GARCIA | C171: TRIGOZO | D171: JOSE ABEL | E171: PERÚ | F171: 05256191 | G171: 2007-09-03T00:00:00.000 | H171: Sí | I171: MAESTRO | J171: MASTER UNIVERSITARIO DE I LIVELLO IN GESTIONE STRATEGICA FINANZA E INTERNAZIONALIZZAZIONE DELLE IMPR | K171: UNIVERSITA DEGLI STUDI DI GENOVA | L171: ITALIA | M171: Sí | N171: Sí | O171: No | P171: Ordinario Auxiliar | Q171: Tiempo Completo | R171: 16 | S171: 24 | T171: 40 | U171: No | V171: No | W171: 2016 - I
A172: =R[-1]C+1 -> 172 | B172: GARCIA | C172: VILCAPOMA | D172: GLADYS HORTENCIA | E172: PERÚ | F172: 06889871 | G172: 2002-04-08T00:00:00.000 | H172: Sí | I172: MAESTRO | J172: DOCENCIA UNIVERSITARIA | K172: UNIVERSIDAD NACIONAL FEDERICO VILLAREAL | L172: PERÚ | M172: Sí | N172: No | O172: No | P172: Ordinario Auxiliar | Q172: Tiempo Completo | R172: 8 | S172: 32 | T172: 40 | U172: Sí | V172: Sí | W172: 2016 - I
A173: =R[-1]C+1 -> 173 | B173: GASTELLO | C173: MATHEWS | D173: WILLY | E173: PERÚ | F173: 09635561 | G173: 2011-03-17T00:00:00.000 | H173: Sí | I173: BACHILLER | J173: ADMINISTRACION | K173: UNIVERSIDAD CATOLICA SEDES SAPIENTIAE | L173: PERÚ | M173: Sí | N173: No | O173: No | P173: Contratado | Q173: Tiempo Parcial | R173: 10 | S173: 2 | T173: 12 | U173: No | V173: Sí | W173: 2016 - I
A174: =R[-1]C+1 -> 174 | B174: GOMERO | C174: ESPINOZA | D174: CLARA ROSIO | E174: PERÚ | F174: 10117155 | G174: 2009-09-08T00:00:00.000 | H174: Sí | I174: BACHILLER | J174: CIENCIAS FINANCIERAS Y CONTABLES | K174: UNIVERSIDAD DE SAN MARTIN DE PORRES | L174: PERÚ | M174: Sí | N174: No | O174: No | P174: Contratado | Q174: Tiempo Parcial | R174: 16 | S174: 0 | T174: 16 | U174: No | V174: No | W174: 2016 - I
A175: =R[-1]C+1 -> 175 | B175: GONZAGA | C175: ESPINOZA | D175: MARIA NELLY | E175: PERÚ | F175: 09630967 | G175: 2013-09-12T00:00:00.000 | H175: Sí | I175: BACHILLER | J175: ADMINISTRACION | K175: PONTIFICIA UNIVERSIDAD CATOLICA DEL PERU | L175: PERÚ | M175: Sí | N175: No | O175: No | P175: Contratado | Q175: Tiempo Parcial | R175: 12 | S175: 0 | T175: 12 | U175: No | V175: Sí | W175: 2016 - I
A176: =R[-1]C+1 -> 176 | B176: GONZALES | C176: ANAMPA | D176: LUIS OMAR | E176: PERÚ | F176: 10683679 | G176: 2012-03-05T00:00:00.000 | H176: Sí | I176: BACHILLER | J176: ADMINISTRACION | K176: UNIVERSIDAD CATOLICA SEDES SAPIENTIAE | L176: PERÚ | M176: Sí | N176: No | O176: No | P176: Contratado | Q176: Tiempo Completo | R176: 20 | S176: 20 | T176: 40 | U176: No | V176: No | W176: 2016 - I
A177: =R[-1]C+1 -> 177 | B177: GONZALES | C177: CALLE | D177: FREDY ABELARDO | E177: PERÚ | F177: 43667732 | G177: 2013-09-16T00:00:00.000 | H177: Sí | I177: BACHILLER | J177: INGENIERIA DE SISTEMAS | K177: INSTITUTO CIENTIFICO Y TECNOLOGICO DEL EJERCITO | L177: PERÚ | M177: Sí | N177: No | O177: No | P177: Contratado | Q177: Tiempo Parcial | R177: 10 | S177: 0 | T177: 10 | U177: No | V177: No | W177: 2016 - I
A178: =R[-1]C+1 -> 178 | B178: GONZALES | C178: CONTRERAS | D178: NORMA DE LOS MILAGROS | E178: PERÚ | F178: 47017231 | G178: 2013-09-09T00:00:00.000 | H178: Sí | I178: BACHILLER | J178: PSICOLOGIA | K178: UNIVERSIDAD SEÑOR DE SIPAN | L178: PERÚ | M178: Sí | N178: No | O178: No | P178: Contratado | Q178: Tiempo Completo | R178: 18 | S178: 22 | T178: 40 | U178: No | V178: No | W178: 2016 - I
A179: =R[-1]C+1 -> 179 | B179: GONZALES | C179: COTRINA | D179: JULIO CESAR | E179: PERÚ | F179: 00165739 | G179: 2010-05-01T00:00:00.000 | H179: Sí | I179: BACHILLER | J179: EDUCACION | K179: UNIVERSIDAD MARCELINO CHAMPAGNAT | L179: PERÚ | M179: Sí | N179: No | O179: No | P179: Contratado | Q179: Tiempo Completo | R179: 7 | S179: 33 | T179: 40 | U179: No | V179: No | W179: 2016 - I
A180: =R[-1]C+1 -> 180 | B180: GONZALES | C180: QUISPE | D180: HUMBERTO FERNANDO | E180: PERÚ | F180: 21135050 | G180: 2011-03-14T00:00:00.000 | H180: Sí | I180: BACHILLER | J180: CIENCIAS DE LA EDUCACION | K180: UNIVERSIDAD NACIONAL DE EDUCACION ENRIQUE GUZMAN Y VALLE | L180: PERÚ | M180: Sí | N180: No | O180: No | P180: Contratado | Q180: Tiempo Parcial | R180: 18 | S180: 0 | T180: 18 | U180: No | V180: No | W180: 2016 - I
A181: =R[-1]C+1 -> 181 | B181: GONZALEZ | C181: FARFAN | D181: MARIA EUGENIA | E181: PERÚ | F181: 09486797 | G181: 2013-03-11T00:00:00.000 | H181: Sí | I181: BACHILLER | J181: TECNOLOGIA MEDICA | K181: UNIVERSIDAD NACIONAL FEDERICO VILLAREAL | L181: PERÚ | M181: Sí | N181: No | O181: No | P181: Contratado | Q181: Tiempo Parcial | R181: 6 | S181: 0 | T181: 6 | U181: No | V181: No | W181: 2016 - I
A182: =R[-1]C+1 -> 182 | B182: GONZALEZ | C182: SAENZ | D182: MODESTA MARIA ADELA | E182: PERÚ | F182: 06269543 | G182: 2008-04-01T00:00:00.000 | H182: Sí | I182: BACHILLER | J182: DERECHO | K182: UNIVERSIDAD DE SAN MARTIN DE PORRES | L182: PERÚ | M182: Sí | N182: Sí | O182: No | P182: Ordinario Auxiliar | Q182: Tiempo Completo | R182: 19 | S182: 21 | T182: 40 | U182: No | V182: No | W182: 2016 - I
A183: =R[-1]C+1 -> 183 | B183: GOYBURU | C183: MOLINA DE GOMEZ | D183: MARLENE ESTHER | E183: PERÚ | F183: 25426710 | G183: 2011-10-05T00:00:00.000 | H183: Sí | I183: BACHILLER | J183: ENFERMERIA | K183: UNIVERSIDAD RICARDO PALMA | L183: PERÚ | M183: Sí | N183: No | O183: No | P183: Ordinario Auxiliar | Q183: Tiempo Parcial | R183: 14 | S183: 6 | T183: 20 | U183: No | V183: No | W183: 2016 - I
A184: =R[-1]C+1 -> 184 | B184: GRANDEZ | C184: PORTOCARRERO | D184: AUGUSTO MARINO | E184: PERÚ | F184: 00860188 | G184: 2013-03-18T00:00:00.000 | H184: Sí | I184: MAESTRO | J184: CIENCIAS DE LA EDUCACION CON MENCION EN DOCENCIA Y GESTION UNIVERSITARIA | K184: UNIVERSIDAD NACIONAL PEDRO RUIZ GALLO | L184: PERÚ | M184: Sí | N184: No | O184: No | P184: Contratado | Q184: Tiempo Parcial | R184: 17 | S184: 0 | T184: 17 | U184: No | V184: No | W184: 2016 - I
A185: =R[-1]C+1 -> 185 | B185: GUEVARA | C185: LOPEZ | D185: HERLINDA ESTELA | E185: PERÚ | F185: 07556886 | G185: 2007-04-02T00:00:00.000 | H185: Sí | I185: DOCTOR | J185: EDUCACION | K185: UNIVERSIDAD DE SAN MARTIN DE PORRES | L185: PERÚ | M185: Sí | N185: No | O185: No | P185: Ordinario Auxiliar | Q185: Tiempo Completo | R185: 16 | S185: 24 | T185: 40 | U185: Sí | V185: Sí | W185: 2016 - I
A186: =R[-1]C+1 -> 186 | B186: GUTIERREZ | C186: ASCARZA | D186: LUZ YOLANDA | E186: PERÚ | F186: 10284099 | G186: 2010-03-11T00:00:00.000 | H186: Sí | I186: BACHILLER | J186: EDUCACION | K186: UNIVERSIDAD NACIONAL MAYOR DE SAN MARCOS | L186: PERÚ | M186: Sí | N186: No | O186: No | P186: Contratado | Q186: Tiempo Completo | R186: 4 | S186: 36 | T186: 40 | U186: No | V186: No | W186: 2016 - I
A187: =R[-1]C+1 -> 187 | B187: GUTIERREZ | C187: AZCARZA | D187: DORIS EDITH | E187: PERÚ | F187: 10280181 | G187: 2011-09-06T00:00:00.000 | H187: Sí | I187: BACHILLER | J187: EDUCACION | K187: UNIVERSIDAD MARCELINO CHAMPAGNAT | L187: PERÚ | M187: Sí | N187: No | O187: No | P187: Contratado | Q187: Tiempo Parcial | R187: 6 | S187: 10 | T187: 16 | U187: No | V187: No | W187: 2016 - I
A188: =R[-1]C+1 -> 188 | B188: GUTIERREZ | C188: BUSTAMANTE | D188: SILVIA | E188: PERÚ | F188: 23946287 | G188: 2011-09-05T00:00:00.000 | H188: Sí | I188: MAESTRO | J188: MAGISTER SCIENTIAE MANEJO INTEGRADO DE PLAGAS | K188: UNIVERSIDAD NACIONAL AGRARIA LA MOLINA | L188: PERÚ | M188: Sí | N188: No | O188: No | P188: Contratado | Q188: Tiempo Completo | R188: 0 | S188: 40 | T188: 40 | U188: No | V188: Sí | W188: 2016 - I | X188: COORDINADORA PROGRAMA ACADEMICO DE CHULUCANAS - FACULTAD DE INGENIERIA AGRARIA
A189: =R[-1]C+1 -> 189 | B189: GUTIERREZ | C189: CASTILLO | D189: MARIO ANTONIO | E189: PERÚ | F189: 08798497 | G189: 2008-03-01T00:00:00.000 | H189: Sí | I189: BACHILLER | J189: INGENIERIA INDUSTRIAL | K189: UNIVERSIDAD DE LIMA | L189: PERÚ | M189: Sí | N189: No | O189: No | P189: Ordinario Principal | Q189: Dedicacion Exclusiva | R189: 0 | S189: 40 | T189: 40 | U189: No | V189: No | W189: 2016 - I | X189: ADMINSITRADOR GENERAL DE LA UNIVERSIDAD
A190: =R[-1]C+1 -> 190 | B190: GUTIERREZ | C190: PUSARI | D190: JUSTINIANO | E190: PERÚ | F190: 06957981 | G190: 2011-03-12T00:00:00.000 | H190: Sí | I190: BACHILLER | J190: CIENCIAS INGENIERIA AGRICOLA | K190: UNIVERSIDAD NACIONAL AGRARIA LA MOLINA | L190: PERÚ | M190: Sí | N190: No | O190: No | P190: Contratado | Q190: Tiempo Parcial | R190: 8 | S190: 0 | T190: 8 | U190: No | V190: No | W190: 2016 - I
A191: =R[-1]C+1 -> 191 | B191: HERNANDEZ | C191: PINO | D191: GIOVANA LOURDES | E191: PERÚ | F191: 10727756 | G191: 2004-03-09T00:00:00.000 | H191: Sí | I191: BACHILLER | J191: PSICOLOGIA | K191: UNIVERSIDAD DE SAN MARTIN DE PORRES | L191: PERÚ | M191: Sí | N191: No | O191: No | P191: Ordinario Auxiliar | Q191: Tiempo Completo | R191: 16 | S191: 24 | T191: 40 | U191: No | V191: No | W191: 2016 - I
A192: =R[-1]C+1 -> 192 | B192: HERNANDEZ | C192: VASQUEZ | D192: ERICK BRANDUZ | E192: PERÚ | F192: 44008733 | G192: 2014-01-15T00:00:00.000 | H192: Sí | I192: BACHILLER | J192: MATEMATICAS | K192: UNIVERSIDAD NACIONAL PEDRO RUIZ GALLO | L192: PERÚ | M192: Sí | N192: No | O192: No | P192: Contratado | Q192: Tiempo Completo | R192: 22 | S192: 18 | T192: 40 | U192: No | V192: No | W192: 2016 - I
A193: =R[-1]C+1 -> 193 | B193: HERRERA | C193: CONCHA | D193: RENAN ALBERTO | E193: PERÚ | F193: 40660575 | G193: 2014-03-11T00:00:00.000 | H193: Sí | I193: MAESTRO | J193: MASTER EN DERECHO EMPRESARIAL | K193: UNIVERSIDAD DE LIMA | L193: PERÚ | M193: Sí | N193: No | O193: No | P193: Contratado | Q193: Tiempo Parcial | R193: 8 | S193: 2 | T193: 10 | U193: No | V193: No | W193: 2016 - I
A194: =R[-1]C+1 -> 194 | B194: HIDALGO | C194: GOMEZ | D194: ALFONSO GREGORIO | E194: PERÚ | F194: 06775252 | G194: 2012-03-15T00:00:00.000 | H194: Sí | I194: BACHILLER | J194: CIENCIAS CON MENCION EN INGENIERIA INDUSTRIAL | K194: PONTIFICIA UNIVERSIDAD CATOLICA DEL PERU | L194: PERÚ | M194: Sí | N194: No | O194: No | P194: Contratado | Q194: Tiempo Completo | R194: 28 | S194: 12 | T194: 40 | U194: No | V194: No | W194: 2016 - I
A195: =R[-1]C+1 -> 195 | B195: HUAMAN | C195: GUTIERREZ | D195: JOSE MANUEL | E195: PERÚ | F195: 09905355 | G195: 2013-04-04T00:00:00.000 | H195: Sí | I195: MAESTRO | J195: MAESTRO EN ADMINISTRACION Y DIRECCION DE EMPRESAS | K195: UNIVERSIDAD ALAS PERUANAS | L195: PERÚ | M195: Sí | N195: No | O195: No | P195: Contratado | Q195: Tiempo Parcial | R195: 16 | S195: 4 | T195: 20 | U195: No | V195: No | W195: 2016 - I
A196: =R[-1]C+1 -> 196 | B196: HUAMAN | C196: GUTIERREZ | D196: OSCAR GUSTAVO | E196: PERÚ | F196: 10454580 | G196: 2011-09-05T00:00:00.000 | H196: Sí | I196: MAESTRO | J196: BIOQUIMICA | K196: UNIVERSIDAD NACIONAL MAYOR DE SAN MARCOS | L196: PERÚ | M196: Sí | N196: No | O196: No | P196: Contratado | Q196: Tiempo Parcial | R196: 12 | S196: 0 | T196: 12 | U196: No | V196: Sí | W196: 2016 - I
A197: =R[-1]C+1 -> 197 | B197: HUAPAYA | C197: PARDAVE | D197: RICHARD JOAO | E197: PERÚ | F197: 44127158 | G197: 2015-09-11T00:00:00.000 | H197: No | I197: MAESTRO | J197: MAGISTER EN ADMINISTRACION | K197: UNIVERSIDAD ESAN | L197: PERÚ | M197: Sí | N197: No | O197: No | P197: Contratado | Q197: Tiempo Parcial | R197: 6 | S197: 0 | T197: 6 | U197: No | V197: No | W197: 2016 - I
A198: =R[-1]C+1 -> 198 | B198: HUIMAN | C198: SANDOVAL | D198: JOSE ALBERTO | E198: PERÚ | F198: 16170336 | G198: 2009-03-09T00:00:00.000 | H198: Sí | I198: BACHILLER | J198: OCEANOGRAFIA Y PESQUERIA | K198: UNIVERSIDAD NACIONAL FEDERICO VILLAREAL | L198: PERÚ | M198: Sí | N198: No | O198: No | P198: Contratado | Q198: Tiempo Parcial | R198: 18 | S198: 0 | T198: 18 | U198: No | V198: No | W198: 2016 - I
A199: =R[-1]C+1 -> 199 | B199: HURTADO | C199: MERINO | D199: ALBERTO ZACARIAS | E199: PERÚ | F199: 42643059 | G199: 2013-03-04T00:00:00.000 | H199: Sí | I199: BACHILLER | J199: BIOLOGIA | K199: UNIVERSIDAD NACIONAL PEDRO RUIZ GALLO | L199: PERÚ | M199: Sí | N199: No | O199: No | P199: Contratado | Q199: Tiempo Completo | R199: 22 | S199: 18 | T199: 40 | U199: No | V199: Sí | W199: 2016 - I
A200: =R[-1]C+1 -> 200 | B200: IBERICO | C200: CHAVEZ | D200: ROLANDO RAMIRO | E200: PERÚ | F200: 10735796 | G200: 2001-04-16T00:00:00.000 | H200: Sí | I200: DOCTOR | J200: DOCTOR EN GESTION EMPRESARIAL | K200: UNIVERSIDAD NACIONAL HERMILIO VALDIZAN | L200: PERÚ | M200: Sí | N200: No | O200: No | P200: Contratado | Q200: Tiempo Parcial | R200: 12 | S200: 0 | T200: 12 | U200: No | V200: Sí | W200: 2016 - I
A201: =R[-1]C+1 -> 201 | B201: IMAN | C201: MORAN | D201: ANGHELA MIRELLA | E201: PERÚ | F201: 46532718 | G201: 2014-03-03T00:00:00.000 | H201: Sí | I201: BACHILLER | J201: TECNOLOGIA MEDICA CON MENCION EN TERAPIA FISICA Y REHABILITACION | K201: UNIVERSIDAD SAN PEDRO DE CHIMBOTE | L201: PERÚ | M201: Sí | N201: No | O201: No | P201: Contratado | Q201: Tiempo Parcial | R201: 12 | S201: 0 | T201: 12 | U201: No | V201: No | W201: 2016 - I
A202: =R[-1]C+1 -> 202 | B202: INCA | C202: BAZAN | D202: FERNANDO | E202: PERÚ | F202: 08646807 | G202: 2011-09-10T00:00:00.000 | H202: Sí | I202: BACHILLER | J202: EDUCACION | K202: UNIVERSIDAD INCA GARCILASO DE LA VEGA | L202: PERÚ | M202: Sí | N202: No | O202: No | P202: Contratado | Q202: Tiempo Parcial | R202: 4 | S202: 0 | T202: 4 | U202: No | V202: No | W202: 2016 - I
A203: =R[-1]C+1 -> 203 | B203: INFANTES | C203: SANTILLAN | D203: EDUARDO | E203: PERÚ | F203: 08396132 | G203: 2012-09-04T00:00:00.000 | H203: Sí | I203: BACHILLER | J203: PSICOLOGIA | K203: UNIVERSIDAD INCA GARCILASO DE LA VEGA | L203: PERÚ | M203: Sí | N203: No | O203: No | P203: Contratado | Q203: Tiempo Parcial | R203: 8 | S203: 10 | T203: 18 | U203: No | V203: No | W203: 2016 - I
A204: =R[-1]C+1 -> 204 | B204: IZQUIERDO | C204: HERNANDEZ | D204: DENIS | E204: PERÚ | F204: 43089939 | G204: 2014-04-04T00:00:00.000 | H204: Sí | I204: BACHILLER | J204: EDUCACION | K204: UNIVERSIDAD NACIONAL DE SAN MARTIN | L204: PERÚ | M204: Sí | N204: No | O204: No | P204: Contratado | Q204: Tiempo Completo | R204: 10 | S204: 30 | T204: 40 | U204: No | V204: Sí | W204: 2016 - I
A205: =R[-1]C+1 -> 205 | B205: JARA | C205: ASENCIOS DE MENDOZA | D205: IRMA VICTORIA | E205: PERÚ | F205: 07589826 | G205: 2011-03-07T00:00:00.000 | H205: Sí | I205: BACHILLER | J205: EDUCACION | K205: UNIVERSIDAD NACIONAL FEDERICO VILLAREAL | L205: PERÚ | M205: Sí | N205: No | O205: No | P205: Contratado | Q205: Tiempo Parcial | R205: 18 | S205: 0 | T205: 18 | U205: No | V205: No | W205: 2016 - I
A206: =R[-1]C+1 -> 206 | B206: KCOMT | C206: CHUCAN DE MUJICA | D206: OLINDA ROXANA | E206: PERÚ | F206: 09304104 | G206: 2014-03-14T00:00:00.000 | H206: Sí | I206: BACHILLER | J206: ADMINISTRACION | K206: UNIVERSIDAD RICARDO PALMA | L206: PERÚ | M206: Sí | N206: No | O206: No | P206: Contratado | Q206: Tiempo Parcial | R206: 12 | S206: 10 | T206: 22 | U206: No | V206: No | W206: 2016 - I
A207: =R[-1]C+1 -> 207 | B207: KUONG | C207: MERIK | D207: MIGUEL ANGEL | E207: PERÚ | F207: 09626330 | G207: 2012-09-07T00:00:00.000 | H207: Sí | I207: BACHILLER | J207: CONTABILIDAD | K207: UNIVERSIDAD NACIONAL MAYOR DE SAN MARCOS | L207: PERÚ | M207: Sí | N207: No | O207: No | P207: Contratado | Q207: Tiempo Parcial | R207: 16 | S207: 0 | T207: 16 | U207: No | V207: No | W207: 2016 - I
A208: =R[-1]C+1 -> 208 | B208: LA ROSA | C208: BENEDICTO | D208: CARLOS GIOVANI | E208: PERÚ | F208: 15736641 | G208: 2011-09-08T00:00:00.000 | H208: Sí | I208: BACHILLER | J208: DERECHO Y CIENCIAS POLITICAS | K208: UNIVERSIDAD NACIONAL JOSE FAUSTINO SANCHEZ CARRION | L208: PERÚ | M208: Sí | N208: No | O208: No | P208: Contratado | Q208: Tiempo Parcial | R208: 8 | S208: 0 | T208: 8 | U208: No | V208: No | W208: 2016 - I
A209: =R[-1]C+1 -> 209 | B209: LA ROSA | C209: BOTONERO | D209: JAVIER | E209: PERÚ | F209: 07961578 | G209: 2002-09-09T00:00:00.000 | H209: Sí | I209: BACHILLER | J209: CIENCIAS CON MENCION EN INGENIERIA ELECTRICA | K209: UNIVERSIDAD NACIONAL DE INGENIERIA | L209: PERÚ | M209: Sí | N209: No | O209: No | P209: Contratado | Q209: Tiempo Parcial | R209: 22 | S209: 0 | T209: 22 | U209: No | V209: No | W209: 2016 - I
A210: =R[-1]C+1 -> 210 | B210: LABAN | C210: ELERA | D210: VICTOR TEODORO | E210: PERÚ | F210: 02689556 | G210: 2014-03-03T00:00:00.000 | H210: Sí | I210: MAESTRO | J210: INGENIERIA AMBIENTAL | K210: UNIVERSIDAD NACIONAL DE PIURA | L210: PERÚ | M210: Sí | N210: No | O210: No | P210: Contratado | Q210: Tiempo Parcial | R210: 11 | S210: 0 | T210: 11 | U210: No | V210: No | W210: 2016 - I
A211: =R[-1]C+1 -> 211 | B211: LAFOSSE | C211: MASIAS | D211: JORGE LUIS | E211: PERÚ | F211: 40376829 | G211: 2008-01-01T00:00:00.000 | H211: Sí | I211: MAESTRO | J211: DOCTRINA SOCIAL DE LA IGLESIA | K211: PONTIFICIA UNIVERSITAS LATERANENSIS | L211: ITALIA | M211: Sí | N211: No | O211: No | P211: Ordinario Auxiliar | Q211: Tiempo Completo | R211: 20 | S211: 20 | T211: 40 | U211: No | V211: No | W211: 2016 - I
A212: =R[-1]C+1 -> 212 | B212: LAGOS | C212: LIBERATO | D212: DAVID | E212: PERÚ | F212: 42548764 | G212: 2011-03-01T00:00:00.000 | H212: Sí | I212: BACHILLER | J212: EDUCACION | K212: UNIVERSIDAD CATOLICA SEDES SAPIENTIAE | L212: PERÚ | M212: Sí | N212: No | O212: No | P212: Contratado | Q212: Tiempo Completo | R212: 24 | S212: 16 | T212: 40 | U212: No | V212: No | W212: 2016 - I
A213: =R[-1]C+1 -> 213 | B213: LALUPU | C213: VALLADOLID | D213: JOSE HUMBERTO | E213: PERÚ | F213: 41494750 | G213: 2012-03-15T00:00:00.000 | H213: Sí | I213: BACHILLER | J213: EDUCACION | K213: UNIVERSIDAD NACIONAL DE PIURA | L213: PERÚ | M213: Sí | N213: No | O213: No | P213: Contratado | Q213: Tiempo Parcial | R213: 14 | S213: 0 | T213: 14 | U213: No | V213: No | W213: 2016 - I
A214: =R[-1]C+1 -> 214 | B214: LARCO | C214: AGUILAR | D214: AMADA VICTORIA | E214: PERÚ | F214: 40438250 | G214: 2009-09-07T00:00:00.000 | H214: Sí | I214: BACHILLER | J214: AGRONOMIA | K214: UNIVERSIDAD NACIONAL DE TRUJILLO | L214: PERÚ | M214: Sí | N214: No | O214: No | P214: Contratado | Q214: Tiempo Completo | R214: 16 | S214: 24 | T214: 40 | U214: Sí | V214: Sí | W214: 2016 - I
A215: =R[-1]C+1 -> 215 | B215: LASTARRIA | C215: ZAPATA | D215: JOSE ALEJANDRO | E215: PERÚ | F215: 06121782 | G215: 2007-04-02T00:00:00.000 | H215: Sí | I215: DOCTOR | J215: DOCTOR EN CIENCIAS DE LA EDUCACION | K215: UNIVERSIDAD NACIONAL DE EDUCACION ENRIQUE GUZMAN Y VALLE | L215: PERÚ | M215: Sí | N215: No | O215: No | P215: Ordinario Auxiliar | Q215: Tiempo Completo | R215: 8 | S215: 32 | T215: 40 | U215: No | V215: No | W215: 2016 - I
A216: =R[-1]C+1 -> 216 | B216: LAURENCIO | C216: LUNA | D216: MANUEL ISMAEL | E216: PERÚ | F216: 42362708 | G216: 2012-06-01T00:00:00.000 | H216: Sí | I216: BACHILLER | J216: CIENCIAS CON MENCION EN INGENIERIA CIVIL | K216: UNIVERSIDAD NACIONAL DE INGENIERIA | L216: PERÚ | M216: Sí | N216: No | O216: No | P216: Contratado | Q216: Tiempo Completo | R216: 6 | S216: 34 | T216: 40 | U216: No | V216: No | W216: 2016 - I
A217: =R[-1]C+1 -> 217 | B217: LECETA | C217: GOBITZ | D217: ROSSINA ALDA | E217: PERÚ | F217: 10734053 | G217: 2009-09-07T00:00:00.000 | H217: Sí | I217: BACHILLER | J217: HUMANIDADES CON MENCION EN LINGUISTICA Y LITERATURA | K217: PONTIFICIA UNIVERSIDAD CATOLICA DEL PERU | L217: PERÚ | M217: Sí | N217: No | O217: No | P217: Contratado | Q217: Tiempo Parcial | R217: 20 | S217: 0 | T217: 20 | U217: No | V217: No | W217: 2016 - I
A218: =R[-1]C+1 -> 218 | B218: LEONARDO | C218: RAMOS | D218: MILAGROS ELISA | E218: PERÚ | F218: 41658689 | G218: 2013-03-18T00:00:00.000 | H218: Sí | I218: MAESTRO | J218: ADMINISTRACION DE LA EDUCACION | K218: UNIVERSIDAD CESAR VALLEJO | L218: PERÚ | M218: Sí | N218: No | O218: No | P218: Contratado | Q218: Tiempo Completo | R218: 28 | S218: 12 | T218: 40 | U218: No | V218: No | W218: 2016 - I
A219: =R[-1]C+1 -> 219 | B219: LEYTON | C219: CARDENAS | D219: CARLOS ALBERTO | E219: COLOMBIA | F219: 000754989 | G219: 2011-07-05T00:00:00.000 | H219: Sí | I219: BACHILLER | J219: INGENIERO FORESTAL | K219: UNIVERSIDAD DEL TOLIMA | L219: COLOMBIA | M219: Sí | N219: No | O219: No | P219: Contratado | Q219: Tiempo Completo | R219: 0 | S219: 40 | T219: 40 | U219: No | V219: No | W219: 2016 - I | X219: UNIVERSIDAD DE ORIGEN NO OTORGA GRADO ACADEMICO DE BACHILLERA SINO TITULO PROFESIONAL
A220: =R[-1]C+1 -> 220 | B220: LIMONCHI | C220: CANALES | D220: ITALO ALDO | E220: PERÚ | F220: 07924964 | G220: 2013-09-17T00:00:00.000 | H220: Sí | I220: MAESTRO | J220: MAGISTER EN EDUCACION CON MENCION EN DOCENCIA Y GESTION EDUCATIVA | K220: UNIVERSIDAD CESAR VALLEJO DE TRUJILLO | L220: PERÚ | M220: Sí | N220: No | O220: No | P220: Contratado | Q220: Tiempo Parcial | R220: 12 | S220: 0 | T220: 12 | U220: No | V220: No | W220: 2016 - I
A221: =R[-1]C+1 -> 221 | B221: LINO | C221: QUICAÑA | D221: HECTOR JOSE | E221: PERÚ | F221: 07282807 | G221: 2015-04-01T00:00:00.000 | H221: No | I221: MAESTRO | J221: MAGISTER EN ADMNISTRACION DE LA EDUCACION | K221: UNIVERSIDAD CESAR VALLEJO | L221: PERÚ | M221: Sí | N221: No | O221: No | P221: Contratado | Q221: Tiempo Parcial | R221: 12 | S221: 4 | T221: 16 | U221: No | V221: Sí | W221: 2016 - I
A222: =R[-1]C+1 -> 222 | B222: LIZANO | C222: CARMEN | D222: LAZARO ELIAS | E222: PERÚ | F222: 03110339 | G222: 2013-08-19T00:00:00.000 | H222: Sí | I222: BACHILLER | J222: SAGRADA TEOLOGIA | K222: FACULTAD DE TEOLOGIA PONTIFICIA Y CIVIL DE LIMA | L222: PERÚ | M222: Sí | N222: No | O222: No | P222: Contratado | Q222: Tiempo Completo | R222: 6 | S222: 34 | T222: 40 | U222: No | V222: No | W222: 2016 - I
A223: =R[-1]C+1 -> 223 | B223: LOBATO | C223: CALDERON | D223: GODOFREDO ROMAN | E223: PERÚ | F223: 21087618 | G223: 2012-03-15T00:00:00.000 | H223: Sí | I223: MAESTRO | J223: MAESTRO EN GESTION EMPRESARIAL | K223: UNIVERSIDAD NACIONAL DANIEL ALCIDES CARRION | L223: PERÚ | M223: Sí | N223: No | O223: No | P223: Contratado | Q223: Tiempo Parcial | R223: 20 | S223: 0 | T223: 20 | U223: No | V223: Sí | W223: 2016 - I
A224: =R[-1]C+1 -> 224 | B224: LOPEZ | C224: AVILES | D224: NESTOR MANUEL | E224: PERÚ | F224: 06674117 | G224: 2000-05-02T00:00:00.000 | H224: Sí | I224: BACHILLER | J224: EDUCACION FISICA | K224: UNIVERSIDAD NACIONAL MAYOR DE SAN MARCOS | L224: PERÚ | M224: Sí | N224: No | O224: No | P224: Contratado | Q224: Tiempo Parcial | R224: 4 | S224: 0 | T224: 4 | U224: No | V224: No | W224: 2016 - I
A225: =R[-1]C+1 -> 225 | B225: LOPEZ | C225: BRAVO | D225: RODOLFO ODLANIER | E225: CHILE | F225: 000380761 | G225: 2006-10-01T00:00:00.000 | H225: Sí | I225: BACHILLER | J225: INGENIERO COMERCIAL MENCION ADMINISTRACION | K225: UNIVERSIDAD GABRIELA MISTRAL | L225: CHILE | M225: Sí | N225: No | O225: No | P225: Ordinario Auxiliar | Q225: Tiempo Completo | R225: 16 | S225: 24 | T225: 40 | U225: No | V225: No | W225: 2016 - I | X225: UNIVERSIDAD DE ORIGEN NO OTORGA GRADO ACADEMICO DE BACHILLERA SINO TITULO PROFESIONAL
A226: =R[-1]C+1 -> 226 | B226: LOPEZ | C226: BULNES | D226: JORGE LUIS | E226: PERÚ | F226: 08153969 | G226: 2016-03-02T00:00:00.000 | H226: No | I226: MAESTRO | J226: EDUCACION CON MENCION EN DOCENCIA Y GESTION EDUCATIVA | K226: UNIVERSIDAD CESAR VALLEJO | L226: PERÚ | M226: Sí | N226: No | O226: No | P226: Contratado | Q226: Tiempo Parcial | R226: 6 | S226: 8 | T226: 14 | U226: No | V226: Sí | W226: 2016 - I
A227: =R[-1]C+1 -> 227 | B227: LOPEZ | C227: DEL MAR | D227: JOEL BENIGNO | E227: PERÚ | F227: 08584920 | G227: 2000-09-15T00:00:00.000 | H227: Sí | I227: BACHILLER | J227: COMPUTACION | K227: UNIVERSIDAD NACIONAL MAYOR DE SAN MARCOS | L227: PERÚ | M227: Sí | N227: No | O227: No | P227: Ordinario Auxiliar | Q227: Tiempo Completo | R227: 20 | S227: 20 | T227: 40 | U227: Sí | V227: Sí | W227: 2016 - I
A228: =R[-1]C+1 -> 228 | B228: LOPEZ | C228: REQUENA | D228: JUAN EDUARDO | E228: PERÚ | F228: 00373720 | G228: 2004-04-01T00:00:00.000 | H228: Sí | I228: BACHILLER | J228: EDUCACION | K228: UNIVERSIDAD MARCELINO CHAMPAGNAT | L228: PERÚ | M228: Sí | N228: No | O228: No | P228: Contratado | Q228: Tiempo Parcial | R228: 6 | S228: 6 | T228: 12 | U228: No | V228: No | W228: 2016 - I
A229: =R[-1]C+1 -> 229 | B229: LUNA | C229: MIRANDA | D229: RAUL | E229: PERÚ | F229: 09639954 | G229: 2015-03-11T00:00:00.000 | H229: No | I229: DOCTOR | J229: DOCTOREM IN SCIENTIIIS BIBLICIS ET ARCHAEOLOGIA | K229: PONTIFICIA UNIBERSITAS ANTONIANUM | L229: ITALIA | M229: Sí | N229: No | O229: No | P229: Contratado | Q229: Tiempo Completo | R229: 24 | S229: 16 | T229: 40 | U229: No | V229: No | W229: 2016 - I
A230: =R[-1]C+1 -> 230 | B230: LUNA | C230: RAMIREZ | D230: EDITH NORMA | E230: PERÚ | F230: 10157753 | G230: 2007-04-02T00:00:00.000 | H230: Sí | I230: BACHILLER | J230: MATEMATICA | K230: UNIVERSIDAD NACIONAL DEL CALLAO | L230: PERÚ | M230: Sí | N230: No | O230: No | P230: Ordinario Auxiliar | Q230: Tiempo Completo | R230: 24 | S230: 16 | T230: 40 | U230: No | V230: No | W230: 2016 - I
A231: =R[-1]C+1 -> 231 | B231: LUNA | C231: SANTOS | D231: JUAN CARLOS | E231: PERÚ | F231: 15723552 | G231: 2014-03-13T00:00:00.000 | H231: Sí | I231: MAESTRO | J231: MAESTRO EN CIENCIAS DE LA GESTION EDUCATIVA CON MENCION EN PEDAGOGIA | K231: UNIVERSIDAD NACIONAL JOSE FAUSTINO SANCHEZ CARRION | L231: PERÚ | M231: Sí | N231: No | O231: No | P231: Contratado | Q231: Tiempo Parcial | R231: 4 | S231: 0 | T231: 4 | U231: No | V231: No | W231: 2016 - I
A232: =R[-1]C+1 -> 232 | B232: LUY | C232: MONTEJO | D232: CARLOS AUGUSTO | E232: PERÚ | F232: 09392792 | G232: 2013-03-14T00:00:00.000 | H232: Sí | I232: MAESTRO | J232: EDUCACION CON MENCION EN CIENCIAS RELIGIOSAS E INVESTIGACION | K232: UNIVERSIDAD CATOLICA LOS ANGELES DE CHIMBOTE | L232: PERÚ | M232: Sí | N232: No | O232: No | P232: Contratado | Q232: Tiempo Parcial | R232: 12 | S232: 0 | T232: 12 | U232: No | V232: No | W232: 2016 - I
A233: =R[-1]C+1 -> 233 | B233: MACEDO | C233: BARRERA | D233: EUFEMIO MAGNO | E233: PERÚ | F233: 15612229 | G233: 2014-03-12T00:00:00.000 | H233: Sí | I233: BACHILLER | J233: BROMATOLOGIA Y NUTRICION | K233: UNIVERSIDAD NACIONAL JOSE FAUSTINO SANCHEZ CARRION | L233: PERÚ | M233: Sí | N233: No | O233: No | P233: Contratado | Q233: Tiempo Parcial | R233: 6 | S233: 0 | T233: 6 | U233: No | V233: No | W233: 2016 - I
A234: =R[-1]C+1 -> 234 | B234: MAGGI | C234: . | D234: GUIDO EUGENIO MARIO | E234: ITALIA | F234: 000057480 | G234: 2004-09-06T00:00:00.000 | H234: Sí | I234: DOCTOR | J234: ECONOMIA Y COMERCIO | K234: UNIVERSITA CATTOLICA DEL SACRO CUORE | L234: ITALIA | M234: Sí | N234: No | O234: No | P234: Ordinario Asociado | Q234: Tiempo Completo | R234: 4 | S234: 36 | T234: 40 | U234: No | V234: No | W234: 2016 - I
A235: =R[-1]C+1 -> 235 | B235: MAGUIÑA | C235: MENDOZA | D235: MARIO ARTURO | E235: PERÚ | F235: 06217919 | G235: 2007-04-02T00:00:00.000 | H235: Sí | I235: MAESTRO | J235: MAESTRO EN CIENCIAS CON MENCION EN PROYECTOS DE INVERSION | K235: UNIVERSIDAD NACIONAL DE INGENIERIA | L235: PERÚ | M235: Sí | N235: Sí | O235: No | P235: Contratado | Q235: Tiempo Parcial | R235: 8 | S235: 0 | T235: 8 | U235: No | V235: No | W235: 2016 - I
A236: =R[-1]C+1 -> 236 | B236: MANRIQUE | C236: PINO | D236: OSCAR | E236: PERÚ | F236: 08740729 | G236: 2002-09-09T00:00:00.000 | H236: Sí | I236: BACHILLER | J236: INGENIERIA INDUSTRIAL | K236: UNIVERSIDAD NACIONAL FEDERICO VILLAREAL | L236: PERÚ | M236: Sí | N236: No | O236: No | P236: Ordinario Auxiliar | Q236: Tiempo Completo | R236: 22 | S236: 18 | T236: 40 | U236: No | V236: No | W236: 2016 - I
A237: =R[-1]C+1 -> 237 | B237: MARQUINA | C237: MAUNY | D237: WILFREDO JAVIER | E237: PERÚ | F237: 25620629 | G237: 2012-03-08T00:00:00.000 | H237: Sí | I237: BACHILLER | J237: PSICOLOGIA | K237: UNIVERSIDAD DE SAN MARTIN DE PORRES | L237: PERÚ | M237: Sí | N237: No | O237: No | P237: Contratado | Q237: Tiempo Parcial | R237: 12 | S237: 0 | T237: 12 | U237: No | V237: No | W237: 2016 - I
A238: =R[-1]C+1 -> 238 | B238: MAS | C238: CARO | D238: NIXON LUIS | E238: PERÚ | F238: 43272586 | G238: 2012-08-15T00:00:00.000 | H238: Sí | I238: BACHILLER | J238: ADMINISTRACION DE EMPRESAS | K238: UNIVERSIDAD PARTICULAR DE CHICLAYO | L238: PERÚ | M238: Sí | N238: No | O238: No | P238: Contratado | Q238: Tiempo Completo | R238: 16 | S238: 24 | T238: 40 | U238: No | V238: No | W238: 2016 - I
A239: =R[-1]C+1 -> 239 | B239: MASCELLARO | C239: LUPERDI | D239: GIANCARLO ENZO PASCQUALE | E239: PERÚ | F239: 25739572 | G239: 2001-04-16T00:00:00.000 | H239: Sí | I239: MAESTRO | J239: COOPERACION ECONOMICA POLITICA Y SOCIAL AL DESARROLLO | K239: UNIVERSIDAD DE GENOVA | L239: ITALIA | M239: Sí | N239: Sí | O239: No | P239: Ordinario Asociado | Q239: Tiempo Completo | R239: 8 | S239: 32 | T239: 40 | U239: No | V239: No | W239: 2016 - I | X239: RECONOCIDO POR SUNEDU
A240: =R[-1]C+1 -> 240 | B240: MASGO | C240: LARA | D240: LUIS ALBERTO | E240: PERÚ | F240: 09607876 | G240: 2001-09-17T00:00:00.000 | H240: Sí | I240: BACHILLER | J240: INGENIERIA CIVIL | K240: UNIVERSIDAD NACIONAL FEDERICO VILLAREAL | L240: PERÚ | M240: Sí | N240: No | O240: No | P240: Contratado | Q240: Tiempo Parcial | R240: 18 | S240: 0 | T240: 18 | U240: No | V240: No | W240: 2016 - I
A241: =R[-1]C+1 -> 241 | B241: MATHEUS | C241: ROMERO | D241: JORGE HERNANDO | E241: PERÚ | F241: 09697998 | G241: 2011-09-05T00:00:00.000 | H241: Sí | I241: BACHILLER | J241: PSICOLOGIA | K241: UNIVERSIDAD NACIONAL FEDERICO VILLAREAL | L241: PERÚ | M241: Sí | N241: No | O241: No | P241: Ordinario Auxiliar | Q241: Tiempo Parcial | R241: 12 | S241: 8 | T241: 20 | U241: No | V241: No | W241: 2016 - I
A242: =R[-1]C+1 -> 242 | B242: MATTA | C242: SANTIVAÑEZ | D242: KARINA | E242: PERÚ | F242: 10613109 | G242: 2008-02-01T00:00:00.000 | H242: Sí | I242: BACHILLER | J242: CIENCIAS ZOOTECNIA | K242: UNIVERSIDAD NACIONAL AGRARIA LA MOLINA | L242: PERÚ | M242: Sí | N242: No | O242: No | P242: Ordinario Auxiliar | Q242: Tiempo Completo | R242: 6 | S242: 34 | T242: 40 | U242: No | V242: No | W242: 2016 - I
A243: =R[-1]C+1 -> 243 | B243: MAZA | C243: CHUMPITAZ | D243: ANGELA GIOVANA | E243: PERÚ | F243: 40935708 | G243: 2008-02-01T00:00:00.000 | H243: Sí | I243: BACHILLER | J243: ADMINISTRACION | K243: UNIVERSIDAD CATOLICA SEDES SAPIENTIAE | L243: PERÚ | M243: Sí | N243: No | O243: No | P243: Ordinario Auxiliar | Q243: Tiempo Completo | R243: 2 | S243: 38 | T243: 40 | U243: No | V243: No | W243: 2016 - I
A244: =R[-1]C+1 -> 244 | B244: MEDINA | C244: INFANTE | D244: MAGALY BETZABE | E244: PERÚ | F244: 32983656 | G244: 2011-04-05T00:00:00.000 | H244: Sí | I244: BACHILLER | J244: PSICOLOGIA | K244: UNIVERSIDAD NACIONAL FEDERICO VILLAREAL | L244: PERÚ | M244: Sí | N244: No | O244: No | P244: Contratado | Q244: Tiempo Parcial | R244: 10 | S244: 4 | T244: 14 | U244: No | V244: No | W244: 2016 - I
A245: =R[-1]C+1 -> 245 | B245: MEDINA | C245: PEREZ | D245: MARIA YOVANI | E245: PERÚ | F245: 40517760 | G245: 2008-01-01T00:00:00.000 | H245: Sí | I245: BACHILLER | J245: EDUCACION PRIMARIA | K245: UNIVERSIDAD CATOLICA SEDES SAPIENTIAE | L245: PERÚ | M245: Sí | N245: No | O245: No | P245: Contratado | Q245: Tiempo Completo | R245: 0 | S245: 40 | T245: 40 | U245: No | V245: No | W245: 2016 - I | X245: TUTOR VIRTUAL
A246: =R[-1]C+1 -> 246 | B246: MEDINA | C246: SIRLOPU | D246: MARTHA | E246: PERÚ | F246: 25791096 | G246: 2001-04-16T00:00:00.000 | H246: Sí | I246: BACHILLER | J246: DERECHO Y CIENCIAS POLITICAS | K246: UNIVERSIDAD DE SAN MARTIN DE PORRES | L246: PERÚ | M246: Sí | N246: No | O246: No | P246: Ordinario Auxiliar | Q246: Tiempo Completo | R246: 6 | S246: 34 | T246: 40 | U246: No | V246: No | W246: 2016 - I
A247: =R[-1]C+1 -> 247 | B247: MELGAREJO | C247: SALAZAR | D247: MARGARITA GLADYS | E247: PERÚ | F247: 25634361 | G247: 2012-04-02T00:00:00.000 | H247: Sí | I247: MAESTRO | J247: EDUCACION CON MENCION EN DOCENCIA Y GESTION EDUCATIVA | K247: UNIVERSIDAD CESAR VALLEJO | L247: PERÚ | M247: Sí | N247: No | O247: No | P247: Contratado | Q247: Tiempo Parcial | R247: 8 | S247: 10 | T247: 18 | U247: No | V247: No | W247: 2016 - I
A248: =R[-1]C+1 -> 248 | B248: MENDOZA | C248: CABALLERO | D248: WILFREDO | E248: PERÚ | F248: 23978854 | G248: 2012-03-06T00:00:00.000 | H248: Sí | I248: MAESTRO | J248: BOTANICA TROPICAL CON MENCION EN TAXONOMIA Y SISTEMATICA EVOLUTIVA | K248: UNIVERSIDAD NACIONAL MAYOR DE SAN MARCOS | L248: PERÚ | M248: Sí | N248: No | O248: No | P248: Contratado | Q248: Tiempo Completo | R248: 18 | S248: 22 | T248: 40 | U248: Sí | V248: Sí | W248: 2016 - I
A249: =R[-1]C+1 -> 249 | B249: MENDOZA | C249: NAVARRO | D249: AIDA LUZ | E249: PERÚ | F249: 08308467 | G249: 2010-11-01T00:00:00.000 | H249: Sí | I249: DOCTOR | J249: DERECHO | K249: UNIVERSIDAD NACIONAL FEDERICO VILLAREAL | L249: PERÚ | M249: Sí | N249: No | O249: No | P249: Contratado | Q249: Tiempo Completo | R249: 8 | S249: 32 | T249: 40 | U249: No | V249: No | W249: 2016 - I
A250: =R[-1]C+1 -> 250 | B250: MENENDEZ | C250: MUERAS | D250: ROSA | E250: PERÚ | F250: 10246770 | G250: 2011-09-03T00:00:00.000 | H250: Sí | I250: BACHILLER | J250: INGENIERO DE COMPUTACION Y SISTEMAS | K250: UNIVERSIDAD DE SAN MARTIN DE PORRES | L250: PERÚ | M250: Sí | N250: No | O250: No | P250: Contratado | Q250: Tiempo Completo | R250: 0 | S250: 40 | T250: 40 | U250: No | V250: Sí | W250: 2016 - I | X250: EQUIPO DE ACREDITACION FACULTAD DE INGENIERIA
A251: =R[-1]C+1 -> 251 | B251: MERA | C251: NAVAL | D251: HUGO JAIME | E251: PERÚ | F251: 01051153 | G251: 2015-09-08T00:00:00.000 | H251: No | I251: MAESTRO | J251: MAESTRO EN CIENCIAS DE LA EDUCACION CON MENCION EN INVESTIGACION Y DOCENCIA | K251: UNIVERSIDAD NACIONAL PEDRO RUIZ GALLO | L251: PERÚ | M251: Sí | N251: No | O251: No | P251: Contratado | Q251: Tiempo Parcial | R251: 12 | S251: 0 | T251: 12 | U251: No | V251: No | W251: 2016 - I
A252: =R[-1]C+1 -> 252 | B252: MERINO | C252: ZEVALLOS | D252: CARLOS ANTONIO | E252: PERÚ | F252: 07969037 | G252: 2008-09-08T00:00:00.000 | H252: Sí | I252: BACHILLER | J252: CIENCIAS ECONOMICAS | K252: UNIVERSIDAD NACIONAL FEDERICO VILLAREAL | L252: PERÚ | M252: Sí | N252: No | O252: No | P252: Contratado | Q252: Tiempo Parcial | R252: 4 | S252: 0 | T252: 4 | U252: No | V252: No | W252: 2016 - I
A253: =R[-1]C+1 -> 253 | B253: MESTAS | C253: VALERO | D253: ROGER MANUEL | E253: PERÚ | F253: 23842285 | G253: 2013-04-03T00:00:00.000 | H253: Sí | I253: MAESTRO | J253: INGENIERIA AGRICOLA | K253: UNIVERSIDAD ESTATAL DE CAMPINAS | L253: BRASIL | M253: Sí | N253: No | O253: No | P253: Contratado | Q253: Tiempo Completo | R253: 22 | S253: 18 | T253: 40 | U253: No | V253: No | W253: 2016 - I
A254: =R[-1]C+1 -> 254 | B254: MINGA | C254: SARMIENTO | D254: ROLANDO NOLVERTHY | E254: PERÚ | F254: 00838777 | G254: 2011-09-01T00:00:00.000 | H254: Sí | I254: BACHILLER | J254: CIENCIAS CONTABLES | K254: UNIVERSIDAD CESAR VALLEJO | L254: PERÚ | M254: Sí | N254: No | O254: No | P254: Contratado | Q254: Tiempo Parcial | R254: 8 | S254: 0 | T254: 8 | U254: No | V254: No | W254: 2016 - I
A255: =R[-1]C+1 -> 255 | B255: MITTA | C255: CURAY | D255: EVER RAMIRO | E255: PERÚ | F255: 25697416 | G255: 2011-03-09T00:00:00.000 | H255: Sí | I255: BACHILLER | J255: MEDICINA | K255: UNIVERSIDAD NACIONAL MAYOR DE SAN MARCOS | L255: PERÚ | M255: Sí | N255: No | O255: No | P255: Ordinario Auxiliar | Q255: Tiempo Completo | R255: 24 | S255: 16 | T255: 40 | U255: No | V255: No | W255: 2016 - I
A256: =R[-1]C+1 -> 256 | B256: MOISES | C256: GONZALES | D256: NORMA ROCIO | E256: PERÚ | F256: 40894989 | G256: 2013-03-18T00:00:00.000 | H256: Sí | I256: BACHILLER | J256: INGENIERIA CIVIL | K256: UNIVERSIDAD NACIONAL DE SAN MARTIN | L256: PERÚ | M256: Sí | N256: No | O256: No | P256: Contratado | Q256: Tiempo Parcial | R256: 18 | S256: 0 | T256: 18 | U256: No | V256: No | W256: 2016 - I
A257: =R[-1]C+1 -> 257 | B257: MONDRAGON | C257: LIMA | D257: MARITZA ELIZABETH | E257: PERÚ | F257: 03688780 | G257: 2014-03-03T00:00:00.000 | H257: Sí | I257: BACHILLER | J257: AGRONOMIA | K257: UNIVERSIDAD NACIONAL DE PIURA | L257: PERÚ | M257: Sí | N257: No | O257: No | P257: Contratado | Q257: Tiempo Parcial | R257: 4 | S257: 0 | T257: 4 | U257: No | V257: No | W257: 2016 - I
A258: =R[-1]C+1 -> 258 | B258: MONTERROSO | C258: CORONADO | D258: CESAR ANTONIO | E258: PERÚ | F258: 10271073 | G258: 2003-04-07T00:00:00.000 | H258: Sí | I258: MAESTRO | J258: MAGISTER EN ADMINISTRACION DE NEGOCIOS Y FINANZAS INTERNACIONALES MBA INTERNACIONAL | K258: UNIVERSIDAD CATOLICA SEDES SAPIENTIAE | L258: PERÚ | M258: Sí | N258: No | O258: No | P258: Ordinario Auxiliar | Q258: Tiempo Completo | R258: 20 | S258: 20 | T258: 40 | U258: Sí | V258: Sí | W258: 2016 - I
A259: =R[-1]C+1 -> 259 | B259: MONTES | C259: VILLANUEVA | D259: NILDA DORIS | E259: PERÚ | F259: 08633219 | G259: 2014-04-07T00:00:00.000 | H259: Sí | I259: DOCTOR | J259: DOUTOR EM ALIMENTOS E NUTRICAO | K259: UNIVERSIDADE ESTADUAL DE CAPINAS | L259: BRASIL | M259: Sí | N259: No | O259: No | P259: Contratado | Q259: Tiempo Completo | R259: 4 | S259: 36 | T259: 40 | U259: Sí | V259: Sí | W259: 2016 - I
A260: =R[-1]C+1 -> 260 | B260: MONTOYA | C260: SALDAÑA | D260: SILVIA MARIANA | E260: PERÚ | F260: 09994755 | G260: 2012-03-10T00:00:00.000 | H260: Sí | I260: MAESTRO | J260: ADMINISTRACION | K260: UNIVERSIDAD ESAN | L260: PERÚ | M260: Sí | N260: No | O260: No | P260: Contratado | Q260: Tiempo Completo | R260: 8 | S260: 32 | T260: 40 | U260: No | V260: Sí | W260: 2016 - I
A261: =R[-1]C+1 -> 261 | B261: MONTOYA | C261: TEJADA | D261: WILSON EDUARDO | E261: PERÚ | F261: 02841777 | G261: 2011-05-02T00:00:00.000 | H261: Sí | I261: MAESTRO | J261: MAGISTER EN PSICOLOGIA EDUCATIVA | K261: UNIVERSIDAD CESAR VALLEJO | L261: PERÚ | M261: Sí | N261: No | O261: No | P261: Contratado | Q261: Tiempo Parcial | R261: 4 | S261: 0 | T261: 4 | U261: No | V261: No | W261: 2016 - I
A262: =R[-1]C+1 -> 262 | B262: MOQUILLAZA | C262: CASTILLA | D262: JORGE LUIS | E262: PERÚ | F262: 21521372 | G262: 2011-05-02T00:00:00.000 | H262: Sí | I262: BACHILLER | J262: FARMACIA Y BIOQUIMICA | K262: UNIVERSIDAD SAN LUIS GONZAGA DE ICA | L262: PERÚ | M262: Sí | N262: No | O262: No | P262: Contratado | Q262: Tiempo Completo | R262: 31 | S262: 9 | T262: 40 | U262: No | V262: No | W262: 2016 - I
A263: =R[-1]C+1 -> 263 | B263: MORA | C263: CUMPA | D263: LUIS ENRIQUE | E263: PERÚ | F263: 16717938 | G263: 2012-08-22T00:00:00.000 | H263: Sí | I263: BACHILLER | J263: GEOGRAFIA | K263: UNIVERSIDAD NACIONAL PEDRO RUIZ GALLO | L263: PERÚ | M263: Sí | N263: No | O263: No | P263: Contratado | Q263: Tiempo Parcial | R263: 10 | S263: 0 | T263: 10 | U263: No | V263: No | W263: 2016 - I
A264: =R[-1]C+1 -> 264 | B264: MORALES | C264: ROJAS | D264: WILLIAM ANTONY | E264: PERÚ | F264: 42007303 | G264: 2014-09-08T00:00:00.000 | H264: No | I264: MAESTRO | J264: ADMINISTRACION ESTRATEGICA DE EMPRESAS | K264: PONTIFICIA UNIVERSIDAD CATOLICA DEL PERU | L264: PERÚ | M264: Sí | N264: No | O264: No | P264: Contratado | Q264: Tiempo Parcial | R264: 10 | S264: 0 | T264: 10 | U264: No | V264: No | W264: 2016 - I
A265: =R[-1]C+1 -> 265 | B265: MORALES | C265: VASQUEZ | D265: CESAR ALBERTO | E265: PERÚ | F265: 40064308 | G265: 2014-03-12T00:00:00.000 | H265: Sí | I265: BACHILLER | J265: PSICOLOGIA | K265: UNIVERSIDAD DE SAN MARTIN DE PORRES | L265: PERÚ | M265: Sí | N265: No | O265: No | P265: Contratado | Q265: Tiempo Completo | R265: 16 | S265: 24 | T265: 40 | U265: No | V265: No | W265: 2016 - I
A266: =R[-1]C+1 -> 266 | B266: MORENO | C266: CUEVA | D266: MAXIMO ALBERTO | E266: PERÚ | F266: 08500743 | G266: 2002-05-02T00:00:00.000 | H266: Sí | I266: BACHILLER | J266: INGENIERIA QUIMICA | K266: UNIVERSIDAD NACIONAL DE INGENIERIA | L266: PERÚ | M266: Sí | N266: No | O266: No | P266: Contratado | Q266: Tiempo Parcial | R266: 10 | S266: 0 | T266: 10 | U266: No | V266: No | W266: 2016 - I
A267: =R[-1]C+1 -> 267 | B267: MORENO | C267: PALOMINO | D267: JEAN PAUL | E267: PERÚ | F267: 21133559 | G267: 2015-09-07T00:00:00.000 | H267: No | I267: MAESTRO | J267: MAESTRO EN ECONOMIA CONTABILIDAD Y ADMINISTRACION MENCION EN FINANZAS | K267: UNIVERSIDAD NACIONAL DANIEL ALCIDES CARRION | L267: PERÚ | M267: Sí | N267: No | O267: No | P267: Contratado | Q267: Tiempo Completo | R267: 30 | S267: 10 | T267: 40 | U267: Sí | V267: Sí | W267: 2016 - I
A268: =R[-1]C+1 -> 268 | B268: MUCHA | C268: MONTOYA | D268: RUTH HAYDEE | E268: PERÚ | F268: 19870721 | G268: 2009-09-10T00:00:00.000 | H268: Sí | I268: BACHILLER | J268: CIENCIAS DE LA SALUD ENFERMERIA | K268: UNIVERSIDAD NACIONAL DANIEL ALCIDES CARRION | L268: PERÚ | M268: Sí | N268: No | O268: No | P268: Ordinario Auxiliar | Q268: Tiempo Completo | R268: 31 | S268: 9 | T268: 40 | U268: No | V268: Sí | W268: 2016 - I
A269: =R[-1]C+1 -> 269 | B269: MUNIVE | C269: JAUREGUI | D269: HONORIO ELOY | E269: PERÚ | F269: 20662522 | G269: 2011-03-07T00:00:00.000 | H269: Sí | I269: DOCTOR | J269: MEDIO AMBIENTE Y DESARROLLO SOSTENIBLE | K269: UNIVERSIDAD NACIONAL FEDERICO VILLAREAL | L269: PERÚ | M269: Sí | N269: No | O269: No | P269: Contratado | Q269: Tiempo Completo | R269: 22 | S269: 18 | T269: 40 | U269: No | V269: No | W269: 2016 - I
A270: =R[-1]C+1 -> 270 | B270: MUÑIZ | C270: PAUCARMAYTA | D270: ABEL ALBERTO | E270: PERÚ | F270: 23851049 | G270: 2015-03-09T00:00:00.000 | H270: No | I270: DOCTOR | J270: CIENCIAS DE LA EDUCACION | K270: UNIVERSIDAD ALAS PERUANAS | L270: PERÚ | M270: Sí | N270: No | O270: No | P270: Contratado | Q270: Tiempo Parcial | R270: 10 | S270: 0 | T270: 10 | U270: No | V270: Sí | W270: 2016 - I
A271: =R[-1]C+1 -> 271 | B271: MUÑOZ | C271: MARTICORENA | D271: WILLIAM AMADEO | E271: PERÚ | F271: 08269783 | G271: 2000-05-02T00:00:00.000 | H271: Sí | I271: MAESTRO | J271: ADMINISTRACION | K271: ESCUELA DE ADMINISTRACION DE NEGOCIOS PARA GRADUADOS - ESAN | L271: PERÚ | M271: Sí | N271: Sí | O271: No | P271: Ordinario Asociado | Q271: Tiempo Completo | R271: 8 | S271: 32 | T271: 40 | U271: Sí | V271: Sí | W271: 2016 - I
A272: =R[-1]C+1 -> 272 | B272: MUÑOZ | C272: QUICHIZ | D272: JAVIER ANGEL | E272: PERÚ | F272: 15761830 | G272: 2013-09-10T00:00:00.000 | H272: Sí | I272: BACHILLER | J272: CIENCIAS CONTABLES Y FINANCIERAS | K272: UNIVERSIDAD NACIONAL JOSE FAUSTINO SANCHEZ CARRION | L272: PERÚ | M272: Sí | N272: No | O272: No | P272: Contratado | Q272: Tiempo Parcial | R272: 10 | S272: 0 | T272: 10 | U272: No | V272: No | W272: 2016 - I
A273: =R[-1]C+1 -> 273 | B273: MUÑOZ | C273: TORRE | D273: HERLINDA MARLENI | E273: PERÚ | F273: 09738114 | G273: 2009-03-11T00:00:00.000 | H273: Sí | I273: BACHILLER | J273: CONTABILIDAD | K273: UNIVERSIDAD INCA GARCILASO DE LA VEGA | L273: PERÚ | M273: Sí | N273: No | O273: No | P273: Contratado | Q273: Tiempo Parcial | R273: 8 | S273: 0 | T273: 8 | U273: No | V273: No | W273: 2016 - I
A274: =R[-1]C+1 -> 274 | B274: MURILLO | C274: PONTE | D274: RICARDO VICTOR | E274: PERÚ | F274: 10230085 | G274: 2003-09-13T00:00:00.000 | H274: Sí | I274: BACHILLER | J274: PSICOLOGIA | K274: UNIVERSIDAD DE SAN MARTIN DE PORRES | L274: PERÚ | M274: Sí | N274: No | O274: No | P274: Contratado | Q274: Tiempo Parcial | R274: 10 | S274: 0 | T274: 10 | U274: No | V274: No | W274: 2016 - I
A275: =R[-1]C+1 -> 275 | B275: NAUPARI | C275: CASTILLO | D275: HEROINA DINA | E275: PERÚ | F275: 09593605 | G275: 2007-06-01T00:00:00.000 | H275: Sí | I275: BACHILLER | J275: EDUCACION | K275: UNIVERSIDAD DE SAN MARTIN DE PORRES | L275: PERÚ | M275: Sí | N275: No | O275: No | P275: Ordinario Auxiliar | Q275: Tiempo Completo | R275: 0 | S275: 40 | T275: 40 | U275: No | V275: Sí | W275: 2016 - I | X275: OFICINA DE CALIDAD
A276: =R[-1]C+1 -> 276 | B276: NAVARRO | C276: GUERRERO | D276: TITO RICARDO | E276: PERÚ | F276: 06145294 | G276: 2007-04-02T00:00:00.000 | H276: Sí | I276: MAESTRO | J276: ESTADISTICA MATEMATICA | K276: CENTRO INTERAMERICANO DE ENSEÑANZA DE ESTADISTICA | L276: CHILE | M276: Sí | N276: No | O276: No | P276: Contratado | Q276: Tiempo Completo | R276: 18 | S276: 22 | T276: 40 | U276: No | V276: Sí | W276: 2016 - I
A277: =R[-1]C+1 -> 277 | B277: NAVARRO | C277: LINARES | D277: JANINA DEL ROCIO | E277: PERÚ | F277: 41438407 | G277: 2008-05-01T00:00:00.000 | H277: Sí | I277: BACHILLER | J277: EDUCACION SECUNDARIA FILOSOFIA Y RELIGION | K277: UNIVERSIDAD CATOLICA SEDES SAPIENTIAE | L277: PERÚ | M277: Sí | N277: No | O277: No | P277: Contratado | Q277: Tiempo Parcial | R277: 8 | S277: 12 | T277: 20 | U277: No | V277: Sí | W277: 2016 - I
A278: =R[-1]C+1 -> 278 | B278: NAVARRO | C278: MONTEAGUDO | D278: CARMEN CECILIA | E278: PERÚ | F278: 07517476 | G278: 2003-03-17T00:00:00.000 | H278: Sí | I278: MAESTRO | J278: MASTER UNIVERSITARIO DI PRIMO LIVELLO IN RISORSE UMANE E ORGANIZZAZIONE | K278: UNIVERSITA CATTOLICA DEL SACRO CUORE | L278: ITALIA | M278: Sí | N278: No | O278: No | P278: Contratado | Q278: Tiempo Completo | R278: 0 | S278: 40 | T278: 40 | U278: No | V278: No | W278: 2016 - I | X278: JEFE DE DIRECCION DE ATENCION INTEGRAL AL ALUMNO
A279: =R[-1]C+1 -> 279 | B279: NAVARRO | C279: VILCHEZ | D279: IGOR | E279: PERÚ | F279: 07626510 | G279: 2000-05-02T00:00:00.000 | H279: Sí | I279: BACHILLER | J279: CIENCIAS DE LA COMUNICACION | K279: UNIVERSIDAD DE SAN MARTIN DE PORRES | L279: PERÚ | M279: Sí | N279: No | O279: No | P279: Contratado | Q279: Tiempo Completo | R279: 12 | S279: 28 | T279: 40 | U279: No | V279: No | W279: 2016 - I
A280: =R[-1]C+1 -> 280 | B280: NEYRA | C280: DE LA ROSA | D280: LUIS | E280: PERÚ | F280: 09952010 | G280: 2002-05-02T00:00:00.000 | H280: Sí | I280: BACHILLER | J280: MEDICINA | K280: UNIVERSIDAD DE SAN MARTIN DE PORRES | L280: PERÚ | M280: Sí | N280: No | O280: No | P280: Ordinario Auxiliar | Q280: Tiempo Completo | R280: 0 | S280: 40 | T280: 40 | U280: No | V280: No | W280: 2016 - I | X280: COORDINADOR ACADEMICO DE LA FACULTAD DE CIENCIAS DE LA SALUD
A281: =R[-1]C+1 -> 281 | B281: NEYRA | C281: DE LA ROSA | D281: NILDRE GERALDINE | E281: PERÚ | F281: 09936559 | G281: 2000-05-02T00:00:00.000 | H281: Sí | I281: MAESTRO | J281: MAGISTER EN ADMINISTRACION DE NEGOCIOS Y FINANZAS INTERNACIONALES MBA INTERNACIONAL | K281: UNIVERSIDAD CATOLICA SEDES SAPIENTIAE | L281: PERÚ | M281: Sí | N281: No | O281: No | P281: Contratado | Q281: Tiempo Completo | R281: 0 | S281: 40 | T281: 40 | U281: No | V281: No | W281: 2016 - I | X281: COORDINADORA ADMINISTRATIVA ESCUELA DE POSTGRADO
A282: =R[-1]C+1 -> 282 | B282: NOLAZCO | C282: VICENTE | D282: LUIS ARTURO | E282: PERÚ | F282: 06902484 | G282: 2011-09-01T00:00:00.000 | H282: Sí | I282: BACHILLER | J282: PSICOLOGIA | K282: UNIVERSIDAD DE SAN MARTIN DE PORRES | L282: PERÚ | M282: Sí | N282: No | O282: No | P282: Contratado | Q282: Tiempo Parcial | R282: 18 | S282: 2 | T282: 20 | U282: No | V282: No | W282: 2016 - I
A283: =R[-1]C+1 -> 283 | B283: NUÑEZ | C283: MANRIQUE | D283: ANA MARIA | E283: PERÚ | F283: 09377701 | G283: 2002-06-15T00:00:00.000 | H283: Sí | I283: BACHILLER | J283: ARQUITECTURA | K283: UNIVERSIDAD RICARDO PALMA | L283: PERÚ | M283: Sí | N283: No | O283: No | P283: Contratado | Q283: Tiempo Completo | R283: 0 | S283: 40 | T283: 40 | U283: No | V283: No | W283: 2016 - I | X283: ARQUITECTA
A284: =R[-1]C+1 -> 284 | B284: NUÑEZ | C284: SOTO | D284: LUIS GUILLERMO | E284: PERÚ | F284: 08820367 | G284: 2011-04-01T00:00:00.000 | H284: Sí | I284: BACHILLER | J284: EDUCACION | K284: UNIVERSIDAD NACIONAL MAYOR DE SAN MARCOS | L284: PERÚ | M284: Sí | N284: No | O284: No | P284: Contratado | Q284: Tiempo Parcial | R284: 8 | S284: 8 | T284: 16 | U284: No | V284: No | W284: 2016 - I
A285: =R[-1]C+1 -> 285 | B285: OLIVA | C285: NAVARRO | D285: JORGE ALEJANDRO | E285: PERÚ | F285: 41110999 | G285: 2008-04-07T00:00:00.000 | H285: Sí | I285: DOCTOR | J285: DOCTOR IN PHILOSOPHIA | K285: PONTIFICIA UNIVERSITAS LATERANENSIS | L285: ITALIA | M285: Sí | N285: Sí | O285: No | P285: Contratado | Q285: Tiempo Completo | R285: 10 | S285: 30 | T285: 40 | U285: Sí | V285: Sí | W285: 2016 - I
A286: =R[-1]C+1 -> 286 | B286: OLIVARES | C286: LLONA | D286: EDUARDO EDMUNDO | E286: PERÚ | F286: 07729635 | G286: 2000-05-02T00:00:00.000 | H286: Sí | I286: BACHILLER | J286: PSICOLOGIA | K286: UNIVERSIDAD NACIONAL MAYOR DE SAN MARCOS | L286: PERÚ | M286: Sí | N286: No | O286: No | P286: Ordinario Auxiliar | Q286: Tiempo Completo | R286: 0 | S286: 40 | T286: 40 | U286: No | V286: No | W286: 2016 - I | X286: JEFE DE CENTRO PRE UNIVERSITARIO
A287: =R[-1]C+1 -> 287 | B287: ORE | C287: RIVAS | D287: RAUL JAVIER | E287: PERÚ | F287: 08763051 | G287: 2007-04-09T00:00:00.000 | H287: Sí | I287: BACHILLER | J287: CIENCIAS SOCIALES CON MENCION EN ECONOMIA | K287: PONTIFICIA UNIVERSIDAD CATOLICA DEL PERU | L287: PERÚ | M287: Sí | N287: No | O287: No | P287: Ordinario Auxiliar | Q287: Tiempo Completo | R287: 24 | S287: 16 | T287: 40 | U287: No | V287: No | W287: 2016 - I
A288: =R[-1]C+1 -> 288 | B288: ORTIZ | C288: DUCLOS | D288: JUAN CARLOS | E288: PERÚ | F288: 08095469 | G288: 2011-09-05T00:00:00.000 | H288: Sí | I288: BACHILLER | J288: PSICOLOGIA | K288: UNIVERSIDAD DE SAN MARTIN DE PORRES | L288: PERÚ | M288: Sí | N288: No | O288: No | P288: Contratado | Q288: Tiempo Parcial | R288: 12 | S288: 0 | T288: 12 | U288: No | V288: No | W288: 2016 - I
A289: =R[-1]C+1 -> 289 | B289: OTSU | C289: NAVARRETE | D289: GRACIELA RAQUEL | E289: PERÚ | F289: 08801690 | G289: 2011-12-01T00:00:00.000 | H289: Sí | I289: DOCTOR | J289: MISIOLOGIA ESPECIALIDAD PASTORAL Y EVANGELIZACION | K289: PONTIFICIA UNIVERSITA URBANIANA | L289: ITALIA | M289: Sí | N289: No | O289: No | P289: Contratado | Q289: Tiempo Parcial | R289: 8 | S289: 0 | T289: 8 | U289: No | V289: No | W289: 2016 - I
A290: =R[-1]C+1 -> 290 | B290: OVALLE | C290: FERNANDEZ | D290: ALEXIS | E290: PERÚ | F290: 41670439 | G290: 2013-03-04T00:00:00.000 | H290: Sí | I290: BACHILLER | J290: NUTRICION Y DIETETICA | K290: UNIVERSIDAD NACIONAL DE SAN AGUSTIN DE AREQUIPA | L290: PERÚ | M290: Sí | N290: No | O290: No | P290: Contratado | Q290: Tiempo Parcial | R290: 20 | S290: 0 | T290: 20 | U290: No | V290: No | W290: 2016 - I
A291: =R[-1]C+1 -> 291 | B291: PACAYA | C291: DIAZ | D291: DARINKA | E291: PERÚ | F291: 41786787 | G291: 2008-04-01T00:00:00.000 | H291: Sí | I291: BACHILLER | J291: EDUCACION | K291: UNIVERSIDAD MARCELINO CHAMPAGNAT | L291: PERÚ | M291: Sí | N291: No | O291: No | P291: Contratado | Q291: Tiempo Completo | R291: 20 | S291: 20 | T291: 40 | U291: No | V291: No | W291: 2016 - I
A292: =R[-1]C+1 -> 292 | B292: PACCOSI | C292: . | D292: GIOVANNI | E292: ITALIA | F292: 000080198 | G292: 2001-04-16T00:00:00.000 | H292: Sí | I292: BACHILLER | J292: TEOLOGIA | K292: FACOLTA TEOLOGICA DELL ITALIA CENTRALE | L292: ITALIA | M292: Sí | N292: No | O292: No | P292: Ordinario Asociado | Q292: Tiempo Completo | R292: 16 | S292: 24 | T292: 40 | U292: No | V292: No | W292: 2016 - I
A293: =R[-1]C+1 -> 293 | B293: PACCOTAIPE | C293: ESPINOZA | D293: SALOME | E293: PERÚ | F293: 06851633 | G293: 2011-09-05T00:00:00.000 | H293: Sí | I293: BACHILLER | J293: ENFERMERIA | K293: UNIVERSIDAD PERUANA CAYETANO HEREDIA | L293: PERÚ | M293: Sí | N293: No | O293: No | P293: Contratado | Q293: Tiempo Parcial | R293: 4 | S293: 0 | T293: 4 | U293: No | V293: No | W293: 2016 - I
A294: =R[-1]C+1 -> 294 | B294: PACIFICO | C294: SOTO | D294: CARLOS DELFIN | E294: PERÚ | F294: 15760945 | G294: 2012-09-11T00:00:00.000 | H294: Sí | I294: BACHILLER | J294: LICENCIADO EN COMERCIALIZACION | K294: UNIVERSIDAD ARGENTINA DE LA EMPRESA | L294: ARGENTINA | M294: Sí | N294: No | O294: No | P294: Contratado | Q294: Tiempo Completo | R294: 0 | S294: 40 | T294: 40 | U294: No | V294: No | W294: 2016 - I | X294: UNIVERSIDAD DE ORIGEN NO OTORGA GRADO ACADEMICO DE BACHILLERA SINO TITULO PROFESIONAL
A295: =R[-1]C+1 -> 295 | B295: PALACIOS | C295: FARFAN | D295: PEDRO MIGUEL | E295: PERÚ | F295: 32543302 | G295: 2012-03-15T00:00:00.000 | H295: Sí | I295: BACHILLER | J295: INGENIERIA QUIMICA | K295: UNIVERSIDAD NACIONAL DE TRUJILLO | L295: PERÚ | M295: Sí | N295: No | O295: No | P295: Contratado | Q295: Tiempo Completo | R295: 20 | S295: 20 | T295: 40 | U295: No | V295: No | W295: 2016 - I
A296: =R[-1]C+1 -> 296 | B296: PALOMINO | C296: VALDEZ | D296: MARIA ISABEL | E296: PERÚ | F296: 03376528 | G296: 2013-08-19T00:00:00.000 | H296: Sí | I296: BACHILLER | J296: DERECHO | K296: UNIVERSIDAD DE PIURA | L296: PERÚ | M296: Sí | N296: No | O296: No | P296: Contratado | Q296: Tiempo Parcial | R296: 11 | S296: 0 | T296: 11 | U296: No | V296: No | W296: 2016 - I
A297: =R[-1]C+1 -> 297 | B297: PANIZZA | C297: RICHERO | D297: LINO MARIO | E297: PERÚ | F297: 40010019 | G297: 2004-06-01T00:00:00.000 | H297: Sí | I297: BACHILLER | J297: FILOSOFIA | K297: FACULTAD DE TEOLOGIA PONTIFICIA Y CIVIL DE LIMA | L297: PERÚ | M297: Sí | N297: No | O297: No | P297: Contratado | Q297: Tiempo Completo | R297: 0 | S297: 40 | T297: 40 | U297: No | V297: No | W297: 2016 - I | X297: GRAN CANCILLER
A298: =R[-1]C+1 -> 298 | B298: PAREDES | C298: AGUIRRE | D298: FREDY ROMAN | E298: PERÚ | F298: 15859960 | G298: 2015-09-01T00:00:00.000 | H298: No | I298: MAESTRO | J298: MAESTRO EN DOCENCIA SUPERIOR E INVESTIGACION UNIVERSITARIA | K298: UNIVERSIDAD NACIONAL JOSE FAUSTINO SANCHEZ CARRION | L298: PERÚ | M298: Sí | N298: No | O298: No | P298: Contratado | Q298: Tiempo Parcial | R298: 10 | S298: 0 | T298: 10 | U298: No | V298: Sí | W298: 2016 - I
A299: =R[-1]C+1 -> 299 | B299: PAREDES | C299: SERRANO | D299: MARIA SALOME | E299: PERÚ | F299: 08677518 | G299: 2013-03-04T00:00:00.000 | H299: Sí | I299: BACHILLER | J299: TECNOLOGIA MEDICA | K299: UNIVERSIDAD NACIONAL MAYOR DE SAN MARCOS | L299: PERÚ | M299: Sí | N299: No | O299: No | P299: Contratado | Q299: Tiempo Parcial | R299: 4 | S299: 0 | T299: 4 | U299: No | V299: No | W299: 2016 - I
A300: =R[-1]C+1 -> 300 | B300: PAREJA | C300: FERNANDEZ | D300: ANA CECILIA | E300: PERÚ | F300: 07735674 | G300: 2014-05-02T00:00:00.000 | H300: Sí | I300: MAESTRO | J300: MAGISTER EN PSICOLOGIA CON MENCION EN PSICOLOGIA EDUCATIVA | K300: UNIVERSIDAD NACIONAL MAYOR DE SAN MARCOS | L300: PERÚ | M300: Sí | N300: No | O300: No | P300: Contratado | Q300: Tiempo Parcial | R300: 8 | S300: 0 | T300: 8 | U300: No | V300: No | W300: 2016 - I
A301: =R[-1]C+1 -> 301 | B301: PASCUAL | C301: MENDOZA | D301: EDISSON PEDRO | E301: PERÚ | F301: 40511186 | G301: 2011-03-14T00:00:00.000 | H301: Sí | I301: BACHILLER | J301: CIENCIAS BIOLOGICAS | K301: UNIVERSIDAD NACIONAL MAYOR DE SAN MARCOS | L301: PERÚ | M301: Sí | N301: No | O301: No | P301: Contratado | Q301: Tiempo Completo | R301: 24 | S301: 16 | T301: 40 | U301: No | V301: No | W301: 2016 - I
A302: =R[-1]C+1 -> 302 | B302: PASTEN | C302: MONARDEZ | D302: JUAN IGNACIO | E302: CHILE | F302: 000812857 | G302: 2012-03-12T00:00:00.000 | H302: Sí | I302: BACHILLER | J302: INGENIERO AGRONOMO | K302: PONTIFICIA UNIVERSIDAD CATOLICA DE VALPARAISO | L302: CHILE | M302: Sí | N302: No | O302: No | P302: Contratado | Q302: Tiempo Completo | R302: 4 | S302: 36 | T302: 40 | U302: No | V302: Sí | W302: 2016 - I | X302: UNIVERSIDAD DE ORIGEN NO OTORGA GRADO ACADEMICO DE BACHILLERA SINO TITULO PROFESIONAL
A303: =R[-1]C+1 -> 303 | B303: PASTRANA | C303: BANDAN | D303: JESSICA MIRIAM | E303: PERÚ | F303: 42750570 | G303: 2014-03-10T00:00:00.000 | H303: Sí | I303: BACHILLER | J303: TECNOLOGIA MEDICA | K303: UNIVERSIDAD NACIONAL MAYOR DE SAN MARCOS | L303: PERÚ | M303: Sí | N303: No | O303: No | P303: Contratado | Q303: Tiempo Parcial | R303: 4 | S303: 0 | T303: 4 | U303: No | V303: No | W303: 2016 - I
A304: =R[-1]C+1 -> 304 | B304: PECEROS | C304: ARIAS | D304: IRMA ROXANA | E304: PERÚ | F304: 21814639 | G304: 2010-05-01T00:00:00.000 | H304: Sí | I304: BACHILLER | J304: ENFERMERIA | K304: UNIVERSIDAD DE SAN MARTIN DE PORRES | L304: PERÚ | M304: Sí | N304: No | O304: No | P304: Contratado | Q304: Tiempo Parcial | R304: 4 | S304: 0 | T304: 4 | U304: No | V304: No | W304: 2016 - I
A305: =R[-1]C+1 -> 305 | B305: PERALTA | C305: VERA | D305: JUAN CARLOS | E305: PERÚ | F305: 10144128 | G305: 2013-09-01T00:00:00.000 | H305: Sí | I305: MAESTRO | J305: MAGISTER EN CIENCIAS DE LA EDUCACION CON MENCION EN GESTION EDUCACIONAL | K305: UNIVERSIDAD NACIONAL DE EDUCACION ENRIQUE GUZMAN Y VALLE | L305: PERÚ | M305: Sí | N305: No | O305: No | P305: Contratado | Q305: Tiempo Completo | R305: 6 | S305: 34 | T305: 40 | U305: No | V305: Sí | W305: 2016 - I
A306: =R[-1]C+1 -> 306 | B306: PERALTA | C306: VILLANUEVA | D306: JENNY MAGALY | E306: PERÚ | F306: 41925884 | G306: 2010-04-06T00:00:00.000 | H306: Sí | I306: BACHILLER | J306: CIENCIAS DE LA EDUCACION | K306: UNIVERSIDAD NACIONAL DE EDUCACION ENRIQUE GUZMAN Y VALLE | L306: PERÚ | M306: Sí | N306: No | O306: No | P306: Contratado | Q306: Tiempo Parcial | R306: 16 | S306: 0 | T306: 16 | U306: No | V306: Sí | W306: 2016 - I
A307: =R[-1]C+1 -> 307 | B307: PEREYRA | C307: ROMERO | D307: FLOR DE MARIA | E307: PERÚ | F307: 08661070 | G307: 2011-04-04T00:00:00.000 | H307: Sí | I307: BACHILLER | J307: TECNOLOGIA MEDICA | K307: UNIVERSIDAD INCA GARCILASO DE LA VEGA | L307: PERÚ | M307: Sí | N307: No | O307: No | P307: Contratado | Q307: Tiempo Parcial | R307: 6 | S307: 2 | T307: 8 | U307: No | V307: No | W307: 2016 - I
A308: =R[-1]C+1 -> 308 | B308: PEREZ | C308: ESTRELLA | D308: EPIFANIA EULOGIA | E308: PERÚ | F308: 09843721 | G308: 2014-04-10T00:00:00.000 | H308: Sí | I308: BACHILLER | J308: INGENIERIA ELECTRONICA | K308: UNIVERSIDAD NACIONAL DE INGENIERIA | L308: PERÚ | M308: Sí | N308: No | O308: No | P308: Contratado | Q308: Tiempo Completo | R308: 22 | S308: 18 | T308: 40 | U308: No | V308: Sí | W308: 2016 - I
A309: =R[-1]C+1 -> 309 | B309: PEREZ | C309: FERNANDEZ | D309: JOSE HIGINIO | E309: PERÚ | F309: 08805048 | G309: 2010-09-01T00:00:00.000 | H309: Sí | I309: BACHILLER | J309: INGENIERO INDUSTRIAL | K309: UNIVERSIDAD DE LIMA | L309: PERÚ | M309: Sí | N309: No | O309: No | P309: Ordinario Principal | Q309: Tiempo Completo | R309: 6 | S309: 34 | T309: 40 | U309: Sí | V309: Sí | W309: 2016 - I
A310: =R[-1]C+1 -> 310 | B310: PEREZ | C310: PEREZ | D310: ITALA | E310: PERÚ | F310: 40292729 | G310: 2012-03-12T00:00:00.000 | H310: Sí | I310: BACHILLER | J310: EDUCACION | K310: UNIVERSIDAD CATOLICA SEDES SAPIENTIAE | L310: PERÚ | M310: Sí | N310: No | O310: No | P310: Contratado | Q310: Tiempo Completo | R310: 20 | S310: 20 | T310: 40 | U310: No | V310: No | W310: 2016 - I
A311: =R[-1]C+1 -> 311 | B311: PEREZ | C311: RODRIGUEZ | D311: RUTH EVELY | E311: PERÚ | F311: 25777787 | G311: 2007-04-02T00:00:00.000 | H311: Sí | I311: BACHILLER | J311: ODONTOLOGIA | K311: UNIVERSIDAD DE SAN MARTIN DE PORRES | L311: PERÚ | M311: Sí | N311: No | O311: No | P311: Contratado | Q311: Tiempo Parcial | R311: 4 | S311: 0 | T311: 4 | U311: No | V311: No | W311: 2016 - I
A312: =R[-1]C+1 -> 312 | B312: PINAZO | C312: HERENCIA | D312: RENE ALFREDO | E312: PERÚ | F312: 01323959 | G312: 2009-01-06T00:00:00.000 | H312: Sí | I312: MAESTRO | J312: MAGISTER SCIENTIAE ESPECIALIDAD PRODUCCION ANIMAL | K312: UNIVERSIDAD NACIONAL AGRARIA LA MOLINA | L312: PERÚ | M312: Sí | N312: No | O312: No | P312: Ordinario Auxiliar | Q312: Tiempo Completo | R312: 0 | S312: 40 | T312: 40 | U312: No | V312: Sí | W312: 2016 - I | X312: LSGH - DOCENTE NOMBRADO
A313: =R[-1]C+1 -> 313 | B313: PINEDA | C313: LEON | D313: ROBERTO | E313: PERÚ | F313: 07119662 | G313: 2014-03-10T00:00:00.000 | H313: Sí | I313: MAESTRO | J313: INGENIERIA DE APLICACION ENERGETICA DEL GAS NATURAL | K313: UNIVERSIDAD NACIONAL DE INGENIERIA | L313: PERÚ | M313: Sí | N313: No | O313: No | P313: Contratado | Q313: Tiempo Completo | R313: 16 | S313: 24 | T313: 40 | U313: No | V313: Sí | W313: 2016 - I
A314: =R[-1]C+1 -> 314 | B314: PINEDO | C314: CANTA | D314: JUAN JOSE | E314: PERÚ | F314: 01152072 | G314: 2014-04-01T00:00:00.000 | H314: Sí | I314: BACHILLER | J314: AGRONOMIA | K314: UNIVERSIDAD NACIONAL DE PIURA | L314: PERÚ | M314: Sí | N314: No | O314: No | P314: Contratado | Q314: Tiempo Parcial | R314: 10 | S314: 0 | T314: 10 | U314: No | V314: No | W314: 2016 - I
A315: =R[-1]C+1 -> 315 | B315: PINEDO | C315: FERNANDEZ | D315: MARINA | E315: PERÚ | F315: 21564297 | G315: 2013-03-18T00:00:00.000 | H315: Sí | I315: BACHILLER | J315: CIENCIAS DE LA SALUD ENFERMERIA | K315: UNIVERSIDAD UNION INCAICA | L315: PERÚ | M315: Sí | N315: No | O315: No | P315: Contratado | Q315: Tiempo Parcial | R315: 10 | S315: 0 | T315: 10 | U315: No | V315: No | W315: 2016 - I
A316: =R[-1]C+1 -> 316 | B316: PINTO | C316: TORPOCO | D316: ALBERTO DONALD | E316: PERÚ | F316: 07671136 | G316: 2011-11-03T00:00:00.000 | H316: Sí | I316: BACHILLER | J316: CONTABILIDAD | K316: UNIVERSIDAD DE SAN MARTIN DE PORRES | L316: PERÚ | M316: Sí | N316: No | O316: No | P316: Contratado | Q316: Tiempo Parcial | R316: 8 | S316: 0 | T316: 8 | U316: No | V316: No | W316: 2016 - I
A317: =R[-1]C+1 -> 317 | B317: PIZARRO | C317: PUENTE | D317: ARTURO LEONEL | E317: PERÚ | F317: 21086869 | G317: 2013-03-18T00:00:00.000 | H317: Sí | I317: BACHILLER | J317: CIENCIAS CONTABLES Y FINANCIERAS | K317: UNIVERSIDAD NACIONAL AGRARIA DE LA SELVA | L317: PERÚ | M317: Sí | N317: No | O317: No | P317: Contratado | Q317: Tiempo Parcial | R317: 22 | S317: 0 | T317: 22 | U317: No | V317: No | W317: 2016 - I
A318: =R[-1]C+1 -> 318 | B318: POLO | C318: PUELLES | D318: JOSE MARTIN | E318: PERÚ | F318: 09435661 | G318: 2013-09-02T00:00:00.000 | H318: Sí | I318: BACHILLER | J318: CIENCIAS METEOROLOGIA | K318: UNIVERSIDAD NACIONAL AGRARIA LA MOLINA | L318: PERÚ | M318: Sí | N318: No | O318: No | P318: Contratado | Q318: Tiempo Parcial | R318: 8 | S318: 0 | T318: 8 | U318: No | V318: No | W318: 2016 - I
A319: =R[-1]C+1 -> 319 | B319: PONCE | C319: VEGA | D319: LUIS ALBERTO | E319: PERÚ | F319: 08268827 | G319: 2014-03-11T00:00:00.000 | H319: Sí | I319: MAESTRO | J319: MASTER OF ARTS IN ECONOMICS | K319: BOSTON UNIVERSITY | L319: ESTADOS UNIDOS | M319: Sí | N319: No | O319: No | P319: Contratado | Q319: Tiempo Parcial | R319: 14 | S319: 0 | T319: 14 | U319: No | V319: No | W319: 2016 - I
A320: =R[-1]C+1 -> 320 | B320: POQUIOMA | C320: RODRIGUEZ | D320: ANGEL | E320: PERÚ | F320: 05295151 | G320: 2014-04-01T00:00:00.000 | H320: Sí | I320: BACHILLER | J320: CIENCIAS CONTABLES | K320: UNIVERSIDAD NACIONAL DE LA AMAZONIA PERUANA | L320: PERÚ | M320: Sí | N320: No | O320: No | P320: Contratado | Q320: Tiempo Parcial | R320: 8 | S320: 0 | T320: 8 | U320: No | V320: No | W320: 2016 - I
A321: =R[-1]C+1 -> 321 | B321: PORRAS | C321: CARDENAS | D321: OSCAR DANIEL | E321: PERÚ | F321: 44081022 | G321: 2013-03-01T00:00:00.000 | H321: Sí | I321: BACHILLER | J321: CIENCIAS ZOOTECNIA | K321: UNIVERSIDAD NACIONAL AGRARIA LA MOLINA | L321: PERÚ | M321: Sí | N321: No | O321: No | P321: Contratado | Q321: Tiempo Completo | R321: 18 | S321: 22 | T321: 40 | U321: No | V321: Sí | W321: 2016 - I
A322: =R[-1]C+1 -> 322 | B322: POZO | C322: CCASANI | D322: ZOSIMO REGULO | E322: PERÚ | F322: 25478348 | G322: 2016-03-04T00:00:00.000 | H322: No | I322: MAESTRO | J322: MAESTRO EN CIENCIAS CON MENCION EN FISICA | K322: UNIVERSIDAD NACIONAL DE INGENIERIA | L322: PERÚ | M322: Sí | N322: No | O322: No | P322: Contratado | Q322: Tiempo Parcial | R322: 6 | S322: 0 | T322: 6 | U322: No | V322: No | W322: 2016 - I
A323: =R[-1]C+1 -> 323 | B323: PRIVAT | C323: MARAVI | D323: LUZ MERCEDES | E323: PERÚ | F323: 08460860 | G323: 2000-09-15T00:00:00.000 | H323: Sí | I323: BACHILLER | J323: EDUCACION | K323: UNIVERSIDAD NACIONAL MAYOR DE SAN MARCOS | L323: PERÚ | M323: Sí | N323: No | O323: No | P323: Ordinario Auxiliar | Q323: Tiempo Completo | R323: 12 | S323: 28 | T323: 40 | U323: No | V323: No | W323: 2016 - I
A324: =R[-1]C+1 -> 324 | B324: PUERTAS | C324: PORRAS | D324: MARIA ELIZABETH | E324: PERÚ | F324: 09451560 | G324: 2000-09-15T00:00:00.000 | H324: Sí | I324: BACHILLER | J324: CIENCIAS SOCIALES ESPECIALIDAD HISTORIA | K324: UNIVERSIDAD NACIONAL MAYOR DE SAN MARCOS | L324: PERÚ | M324: Sí | N324: No | O324: No | P324: Contratado | Q324: Tiempo Parcial | R324: 20 | S324: 0 | T324: 20 | U324: No | V324: No | W324: 2016 - I
A325: =R[-1]C+1 -> 325 | B325: QUEVEDO | C325: DIOSES | D325: VICTOR ENRIQUE | E325: PERÚ | F325: 08070278 | G325: 2011-04-01T00:00:00.000 | H325: Sí | I325: BACHILLER | J325: CIENCIAS CON MENCION EN INGENIERIA ELECTRONICA | K325: UNIVERSIDAD NACIONAL DE INGENIERIA | L325: PERÚ | M325: Sí | N325: No | O325: No | P325: Contratado | Q325: Tiempo Parcial | R325: 6 | S325: 0 | T325: 6 | U325: No | V325: Sí | W325: 2016 - I
A326: =R[-1]C+1 -> 326 | B326: QUEZADA | C326: MURGA | D326: DANIEL | E326: PERÚ | F326: 10342134 | G326: 2002-04-08T00:00:00.000 | H326: Sí | I326: MAESTRO | J326: MAGISTER EN ADMINISTRACION DE NEGOCIOS Y FINANZAS INTERNACIONALES MBA INTERNACIONAL | K326: UNIVERSIDAD CATOLICA SEDES SAPIENTIAE | L326: PERÚ | M326: Sí | N326: Sí | O326: No | P326: Ordinario Auxiliar | Q326: Tiempo Completo | R326: 18 | S326: 22 | T326: 40 | U326: No | V326: Sí | W326: 2016 - I
A327: =R[-1]C+1 -> 327 | B327: QUINTEROS | C327: CAMACHO | D327: NORMA LUZ | E327: PERÚ | F327: 06650975 | G327: 2012-11-03T00:00:00.000 | H327: Sí | I327: BACHILLER | J327: CIENCIAS DE LA EDUCACION | K327: UNIVERSIDAD NACIONAL DE EDUCACION ENRIQUE GUZMAN Y VALLE | L327: PERÚ | M327: Sí | N327: No | O327: No | P327: Contratado | Q327: Tiempo Completo | R327: 24 | S327: 16 | T327: 40 | U327: No | V327: No | W327: 2016 - I
A328: =R[-1]C+1 -> 328 | B328: QUIÑONES | C328: CORDOVA | D328: BIDELMINA MARUJA | E328: PERÚ | F328: 33240483 | G328: 2010-09-06T00:00:00.000 | H328: Sí | I328: MAESTRO | J328: ENFERMERIA | K328: UNIVERSIDAD PERUANA CAYETANO HEREDIA | L328: PERÚ | M328: Sí | N328: No | O328: No | P328: Contratado | Q328: Tiempo Parcial | R328: 14 | S328: 0 | T328: 14 | U328: No | V328: No | W328: 2016 - I
A329: =R[-1]C+1 -> 329 | B329: QUIROZ | C329: AVILES | D329: LUIS NAPOLEON | E329: PERÚ | F329: 08703120 | G329: 2009-08-07T00:00:00.000 | H329: Sí | I329: BACHILLER | J329: MEDICINA | K329: UNIVERSIDAD NACIONAL MAYOR DE SAN MARCOS | L329: PERÚ | M329: Sí | N329: No | O329: No | P329: Ordinario Auxiliar | Q329: Tiempo Completo | R329: 8 | S329: 32 | T329: 40 | U329: No | V329: No | W329: 2016 - I
A330: =R[-1]C+1 -> 330 | B330: RAMIREZ | C330: ARELLANO | D330: MIGUEL ANGEL | E330: PERÚ | F330: 10183687 | G330: 2015-09-07T00:00:00.000 | H330: No | I330: DOCTOR | J330: DOCTOR EN ADMINISTRACION | K330: UNIVERSIDAD NACIONAL DEL CENTRO DEL PERU | L330: PERÚ | M330: Sí | N330: No | O330: No | P330: Contratado | Q330: Tiempo Completo | R330: 30 | S330: 10 | T330: 40 | U330: Sí | V330: Sí | W330: 2016 - I
A331: =R[-1]C+1 -> 331 | B331: RAMOS | C331: NIÑO NEIRA | D331: ANA MARIA | E331: PERÚ | F331: 40053375 | G331: 2013-03-16T00:00:00.000 | H331: Sí | I331: BACHILLER | J331: TECNOLOGIA MEDICA | K331: UNIVERSIDAD NACIONAL MAYOR DE SAN MARCOS | L331: PERÚ | M331: Sí | N331: No | O331: No | P331: Contratado | Q331: Tiempo Parcial | R331: 4 | S331: 0 | T331: 4 | U331: No | V331: No | W331: 2016 - I
A332: =R[-1]C+1 -> 332 | B332: RAMOS | C332: PEREZ | D332: ERICK WILLIAMS | E332: PERÚ | F332: 44380747 | G332: 2011-05-02T00:00:00.000 | H332: Sí | I332: BACHILLER | J332: EDUCACION | K332: UNIVERSIDAD CATOLICA SEDES SAPIENTIAE | L332: PERÚ | M332: Sí | N332: No | O332: No | P332: Contratado | Q332: Tiempo Completo | R332: 10 | S332: 30 | T332: 40 | U332: No | V332: No | W332: 2016 - I
A333: =R[-1]C+1 -> 333 | B333: RAMOS | C333: ROMERO | D333: MIGUEL FERNANDO | E333: PERÚ | F333: 43437043 | G333: 2012-11-20T00:00:00.000 | H333: Sí | I333: BACHILLER | J333: CIENCIAS CONTABLES Y FINANCIERAS | K333: UNIVERSIDAD NACIONAL JOSE FAUSTINO SANCHEZ CARRION | L333: PERÚ | M333: Sí | N333: No | O333: No | P333: Contratado | Q333: Tiempo Parcial | R333: 8 | S333: 0 | T333: 8 | U333: No | V333: No | W333: 2016 - I
A334: =R[-1]C+1 -> 334 | B334: RAMOS | C334: TORREJON | D334: REYNA TEODOSIA | E334: PERÚ | F334: 09739932 | G334: 2010-04-05T00:00:00.000 | H334: Sí | I334: BACHILLER | J334: ENFERMERIA | K334: UNIVERSIDAD DE SAN MARTIN DE PORRES | L334: PERÚ | M334: Sí | N334: No | O334: No | P334: Ordinario Auxiliar | Q334: Tiempo Parcial | R334: 14 | S334: 6 | T334: 20 | U334: No | V334: No | W334: 2016 - I
A335: =R[-1]C+1 -> 335 | B335: RESPICIO | C335: LOPEZ | D335: LUIS ALBERTO | E335: PERÚ | F335: 15678673 | G335: 2008-09-08T00:00:00.000 | H335: Sí | I335: BACHILLER | J335: CIENCIAS CON MENCION EN INGENIERIA DE SISTEMAS | K335: UNIVERSIDAD NACIONAL DE INGENIERIA | L335: PERÚ | M335: Sí | N335: No | O335: No | P335: Contratado | Q335: Tiempo Completo | R335: 22 | S335: 18 | T335: 40 | U335: No | V335: Sí | W335: 2016 - I
A336: =R[-1]C+1 -> 336 | B336: RIOS | C336: CUELLAR | D336: HUMBERTO MOISES | E336: PERÚ | F336: 08528049 | G336: 2007-04-02T00:00:00.000 | H336: Sí | I336: MAESTRO | J336: MAGISTER EN ADMINISTRACION DE NEGOCIOS Y FINANZAS INTERNACIONALES MBA INTERNACIONAL | K336: UNIVERSIDAD CATOLICA SEDES SAPIENTIAE | L336: PERÚ | M336: Sí | N336: Sí | O336: No | P336: Contratado | Q336: Tiempo Parcial | R336: 8 | S336: 0 | T336: 8 | U336: No | V336: Sí | W336: 2016 - I
A337: =R[-1]C+1 -> 337 | B337: RIOS | C337: MANRIQUE | D337: ELVIS ROLDAN | E337: PERÚ | F337: 09799606 | G337: 2013-09-14T00:00:00.000 | H337: Sí | I337: BACHILLER | J337: EDUCACION FISICA | K337: UNIVERSIDAD NACIONAL MAYOR DE SAN MARCOS | L337: PERÚ | M337: Sí | N337: No | O337: No | P337: Contratado | Q337: Tiempo Parcial | R337: 4 | S337: 0 | T337: 4 | U337: No | V337: No | W337: 2016 - I
A338: =R[-1]C+1 -> 338 | B338: RIOS | C338: VARGAS | D338: JORGE MARCELL | E338: PERÚ | F338: 09994223 | G338: 2009-11-03T00:00:00.000 | H338: Sí | I338: BACHILLER | J338: ECONOMIA | K338: UNIVERSIDAD RICARDO PALMA | L338: PERÚ | M338: Sí | N338: No | O338: No | P338: Ordinario Auxiliar | Q338: Tiempo Completo | R338: 0 | S338: 40 | T338: 40 | U338: No | V338: No | W338: 2016 - I
A339: =R[-1]C+1 -> 339 | B339: RIVERA | C339: CALLE | D339: HUMBERTO | E339: PERÚ | F339: 17896043 | G339: 2016-03-01T00:00:00.000 | H339: No | I339: MAESTRO | J339: MAGISTER EN CIENCIAS CON MENCION EN CIENCIAS DEL MAR | K339: UNIVERSIDAD DE PIURA | L339: PERÚ | M339: Sí | N339: No | O339: No | P339: Contratado | Q339: Tiempo Parcial | R339: 23 | S339: 0 | T339: 23 | U339: No | V339: Sí | W339: 2016 - I
A340: =R[-1]C+1 -> 340 | B340: RIVERA | C340: ROMERO | D340: DAVID SOSIMO | E340: PERÚ | F340: 06613176 | G340: 2002-04-08T00:00:00.000 | H340: Sí | I340: BACHILLER | J340: CONTABILIDAD | K340: UNIVERSIDAD NACIONAL FEDERICO VILLAREAL | L340: PERÚ | M340: Sí | N340: No | O340: No | P340: Ordinario Asociado | Q340: Tiempo Completo | R340: 14 | S340: 26 | T340: 40 | U340: No | V340: Sí | W340: 2016 - I
A341: =R[-1]C+1 -> 341 | B341: RODAS | C341: MARTINEZ | D341: RICARDO SALOMON | E341: PERÚ | F341: 41729686 | G341: 2013-03-11T00:00:00.000 | H341: Sí | I341: BACHILLER | J341: TECNOLOGIA MEDICA | K341: UNIVERSIDAD NACIONAL MAYOR DE SAN MARCOS | L341: PERÚ | M341: Sí | N341: No | O341: No | P341: Contratado | Q341: Tiempo Parcial | R341: 4 | S341: 0 | T341: 4 | U341: No | V341: No | W341: 2016 - I
A342: =R[-1]C+1 -> 342 | B342: RODRIGUEZ | C342: ALVITES | D342: ALINA PATRICIA | E342: PERÚ | F342: 10236949 | G342: 2011-03-07T00:00:00.000 | H342: Sí | I342: BACHILLER | J342: PSICOLOGIA | K342: UNIVERSIDAD NACIONAL FEDERICO VILLAREAL | L342: PERÚ | M342: Sí | N342: No | O342: No | P342: Ordinario Auxiliar | Q342: Tiempo Parcial | R342: 12 | S342: 8 | T342: 20 | U342: No | V342: No | W342: 2016 - I
A343: =R[-1]C+1 -> 343 | B343: RODRIGUEZ | C343: CASTILLO | D343: EDITH | E343: PERÚ | F343: 10551660 | G343: 2012-05-15T00:00:00.000 | H343: Sí | I343: BACHILLER | J343: TECNOLOGIA MEDICA | K343: UNIVERSIDAD NACIONAL MAYOR DE SAN MARCOS | L343: PERÚ | M343: Sí | N343: No | O343: No | P343: Contratado | Q343: Tiempo Parcial | R343: 8 | S343: 0 | T343: 8 | U343: No | V343: No | W343: 2016 - I
A344: =R[-1]C+1 -> 344 | B344: RODRIGUEZ | C344: ENCALADA | D344: JOSE ALEJANDRO | E344: PERÚ | F344: 06801095 | G344: 2011-09-05T00:00:00.000 | H344: Sí | I344: BACHILLER | J344: PSICOLOGIA | K344: UNIVERSIDAD INCA GARCILASO DE LA VEGA | L344: PERÚ | M344: Sí | N344: No | O344: No | P344: Ordinario Auxiliar | Q344: Tiempo Parcial | R344: 8 | S344: 12 | T344: 20 | U344: No | V344: Sí | W344: 2016 - I
A345: =R[-1]C+1 -> 345 | B345: RODRIGUEZ | C345: ESPINOZA | D345: RONALD FERNANDO | E345: PERÚ | F345: 18222946 | G345: 2015-09-01T00:00:00.000 | H345: No | I345: MAESTRO | J345: MAESTRO EN INGENIERIA AMBIENTAL | K345: UNIVERSIDAD NACIONAL DE TRUJILLO | L345: PERÚ | M345: Sí | N345: No | O345: No | P345: Contratado | Q345: Tiempo Parcial | R345: 6 | S345: 0 | T345: 6 | U345: No | V345: Sí | W345: 2016 - I
A346: =R[-1]C+1 -> 346 | B346: RODRIGUEZ | C346: ITURRI | D346: ROGER RAFAEL ESTANISLAO | E346: PERÚ | F346: 07821253 | G346: 2001-06-01T00:00:00.000 | H346: Sí | I346: DOCTOR | J346: DERECHO | K346: PONTIFICIA UNIVERSIDAD CATOLICA DEL PERU | L346: PERÚ | M346: Sí | N346: No | O346: No | P346: Contratado | Q346: Tiempo Completo | R346: 0 | S346: 40 | T346: 40 | U346: No | V346: No | W346: 2016 - I | X346: VICE CANCILLER
A347: =R[-1]C+1 -> 347 | B347: RODRIGUEZ | C347: NUÑEZ | D347: JOSE LUIS | E347: PERÚ | F347: 15739966 | G347: 2014-03-12T00:00:00.000 | H347: Sí | I347: DOCTOR | J347: MEDIO AMBIENTE Y DESARROLLO SOSTENIBLE | K347: UNIVERSIDAD NACIONAL FEDERICO VILLAREAL | L347: PERÚ | M347: Sí | N347: No | O347: No | P347: Contratado | Q347: Tiempo Parcial | R347: 6 | S347: 0 | T347: 6 | U347: No | V347: No | W347: 2016 - I
A348: =R[-1]C+1 -> 348 | B348: RODRIGUEZ | C348: PEREZ | D348: LUIS EDUARDO | E348: PERÚ | F348: 31652355 | G348: 2016-03-01T00:00:00.000 | H348: No | I348: MAESTRO | J348: MAESTRO EN CIENCIAS BIOLOGICAS MENCION EN BIOTECNOLOGIA AGROINDUSTRIAL Y AMBIENTAL | K348: UNIVERSIDAD NACIONAL DE TRUJILLO | L348: PERÚ | M348: Sí | N348: No | O348: No | P348: Contratado | Q348: Tiempo Parcial | R348: 9 | S348: 0 | T348: 9 | U348: No | V348: Sí | W348: 2016 - I
A349: =R[-1]C+1 -> 349 | B349: RODRIGUEZ | C349: SANDOVAL | D349: JOSE MARTIN | E349: PERÚ | F349: 02808952 | G349: 2013-08-19T00:00:00.000 | H349: Sí | I349: BACHILLER | J349: AGRONOMIA | K349: UNIVERSIDAD NACIONAL DE PIURA | L349: PERÚ | M349: Sí | N349: No | O349: No | P349: Contratado | Q349: Tiempo Parcial | R349: 11 | S349: 0 | T349: 11 | U349: No | V349: No | W349: 2016 - I
A350: =R[-1]C+1 -> 350 | B350: ROJAS | C350: ARAMBURU | D350: MAGALLY | E350: PERÚ | F350: 10725778 | G350: 2014-03-01T00:00:00.000 | H350: Sí | I350: BACHILLER | J350: CIENCIAS DE LA COMUNICACION | K350: UNIVERSIDAD DE SAN MARTIN DE PORRES | L350: PERÚ | M350: Sí | N350: No | O350: No | P350: Contratado | Q350: Tiempo Completo | R350: 0 | S350: 40 | T350: 40 | U350: No | V350: No | W350: 2016 - I | X350: ASISTENTE BIBLIOTECA
A351: =R[-1]C+1 -> 351 | B351: ROJAS | C351: YGLESIAS | D351: EDUARDO | E351: PERÚ | F351: 00821693 | G351: 2012-08-15T00:00:00.000 | H351: Sí | I351: BACHILLER | J351: CIENCIAS CONTABLES Y FINANCIERAS | K351: UNIVERSIDAD LOS ANGELES DE CHIMBOTE | L351: PERÚ | M351: Sí | N351: No | O351: No | P351: Contratado | Q351: Tiempo Parcial | R351: 18 | S351: 0 | T351: 18 | U351: No | V351: No | W351: 2016 - I
A352: =R[-1]C+1 -> 352 | B352: ROMERO | C352: LEYTON | D352: CLAUDIA LISSETH | E352: PERÚ | F352: 40949739 | G352: 2011-03-07T00:00:00.000 | H352: Sí | I352: MAESTRO | J352: ADMINISTRACION DE LA EDUCACION | K352: UNIVERSIDAD CESAR VALLEJO | L352: PERÚ | M352: Sí | N352: No | O352: No | P352: Contratado | Q352: Tiempo Parcial | R352: 18 | S352: 0 | T352: 18 | U352: No | V352: No | W352: 2016 - I
A353: =R[-1]C+1 -> 353 | B353: ROSALES | C353: PACHECO | D353: ALDO HORACIO | E353: PERÚ | F353: 07522448 | G353: 2007-09-15T00:00:00.000 | H353: Sí | I353: BACHILLER | J353: CIENCIAS DE LA EDUCACION | K353: UNIVERSIDAD NACIONAL DE EDUCACION ENRIQUE GUZMAN Y VALLE | L353: PERÚ | M353: Sí | N353: No | O353: No | P353: Contratado | Q353: Tiempo Parcial | R353: 12 | S353: 0 | T353: 12 | U353: No | V353: No | W353: 2016 - I
A354: =R[-1]C+1 -> 354 | B354: RUBIO | C354: APONTE | D354: JULIO CESAR | E354: PERÚ | F354: 25655141 | G354: 2002-09-09T00:00:00.000 | H354: Sí | I354: BACHILLER | J354: CIENCIAS ADMINISTRATIVAS | K354: PONTIFICIA UNIVERSIDAD CATOLICA DEL PERU | L354: PERÚ | M354: Sí | N354: No | O354: No | P354: Contratado | Q354: Tiempo Parcial | R354: 16 | S354: 0 | T354: 16 | U354: No | V354: Sí | W354: 2016 - I
A355: =R[-1]C+1 -> 355 | B355: RUIDIAS | C355: JUAREZ | D355: MARINA | E355: PERÚ | F355: 03367079 | G355: 2013-03-04T00:00:00.000 | H355: Sí | I355: BACHILLER | J355: CIENCIAS DE LA EDUCACION | K355: UNIVERSIDAD DE PIURA | L355: PERÚ | M355: Sí | N355: No | O355: No | P355: Contratado | Q355: Tiempo Parcial | R355: 10 | S355: 0 | T355: 10 | U355: No | V355: No | W355: 2016 - I
A356: =R[-1]C+1 -> 356 | B356: RUIZ | C356: CCANCCE | D356: JOSE VICTOR | E356: PERÚ | F356: 10150044 | G356: 2011-03-12T00:00:00.000 | H356: Sí | I356: MAESTRO | J356: MAGISTER SCIENTIAE ESPECIALIDAD EN NUTRICION | K356: UNIVERSIDAD NACIONAL AGRARIA LA MOLINA | L356: PERÚ | M356: Sí | N356: No | O356: No | P356: Contratado | Q356: Tiempo Completo | R356: 22 | S356: 18 | T356: 40 | U356: No | V356: Sí | W356: 2016 - I
A357: =R[-1]C+1 -> 357 | B357: RUIZ | C357: ESPINOZA | D357: DORIS VIOLETA | E357: PERÚ | F357: 03376948 | G357: 2012-03-15T00:00:00.000 | H357: Sí | I357: BACHILLER | J357: EDUCACION | K357: UNIVERSIDAD NACIONAL DE PIURA | L357: PERÚ | M357: Sí | N357: No | O357: No | P357: Contratado | Q357: Tiempo Parcial | R357: 4 | S357: 0 | T357: 4 | U357: No | V357: No | W357: 2016 - I
A358: =R[-1]C+1 -> 358 | B358: RUIZ | C358: JANGE | D358: BERTHA MARCELINA | E358: PERÚ | F358: 09729256 | G358: 2011-03-09T00:00:00.000 | H358: Sí | I358: MAESTRO | J358: MAGISTER SCIENTIAE ESPECIALIDAD EN NUTRICION | K358: UNIVERSIDAD NACIONAL AGRARIA LA MOLINA | L358: PERÚ | M358: Sí | N358: No | O358: No | P358: Ordinario Auxiliar | Q358: Tiempo Completo | R358: 12 | S358: 28 | T358: 40 | U358: No | V358: No | W358: 2016 - I
A359: =R[-1]C+1 -> 359 | B359: RUIZ | C359: JANJE | D359: ALEJANDRO | E359: PERÚ | F359: 06960251 | G359: 2013-03-13T00:00:00.000 | H359: Sí | I359: BACHILLER | J359: CIENCIAS AGRARIAS | K359: UNIVERSIDAD NACIONAL AGRARIA DE LA SELVA | L359: PERÚ | M359: Sí | N359: No | O359: No | P359: Contratado | Q359: Tiempo Completo | R359: 40 | S359: 0 | T359: 40 | U359: No | V359: No | W359: 2016 - I
A360: =R[-1]C+1 -> 360 | B360: RUIZ | C360: RAFAEL | D360: JORGE LUIS | E360: PERÚ | F360: 40661636 | G360: 2012-09-03T00:00:00.000 | H360: Sí | I360: BACHILLER | J360: TECNOLOGIA MEDICA | K360: UNIVERSIDAD NACIONAL FEDERICO VILLAREAL | L360: PERÚ | M360: Sí | N360: No | O360: No | P360: Contratado | Q360: Tiempo Parcial | R360: 18 | S360: 0 | T360: 18 | U360: No | V360: No | W360: 2016 - I
A361: =R[-1]C+1 -> 361 | B361: RUIZ | C361: RUIZ | D361: GUADALUPE | E361: PERÚ | F361: 25809384 | G361: 2009-03-11T00:00:00.000 | H361: Sí | I361: BACHILLER | J361: CIENCIAS DE LA COMUNICACION | K361: UNIVERSIDAD DE SAN MARTIN DE PORRES | L361: PERÚ | M361: Sí | N361: No | O361: No | P361: Contratado | Q361: Tiempo Parcial | R361: 8 | S361: 0 | T361: 8 | U361: No | V361: No | W361: 2016 - I
A362: =R[-1]C+1 -> 362 | B362: RUIZ | C362: VALLES | D362: RUBEN | E362: PERÚ | F362: 00818283 | G362: 2013-09-16T00:00:00.000 | H362: Sí | I362: BACHILLER | J362: CIENCIAS FORESTALES | K362: UNIVERSIDAD NACIONAL DE LA AMAZONIA PERUANA | L362: PERÚ | M362: Sí | N362: No | O362: No | P362: Contratado | Q362: Tiempo Parcial | R362: 14 | S362: 0 | T362: 14 | U362: No | V362: Sí | W362: 2016 - I
A363: =R[-1]C+1 -> 363 | B363: SAAVEDRA | C363: CHIU | D363: ROXANA MARGARITA | E363: PERÚ | F363: 08363244 | G363: 2013-03-11T00:00:00.000 | H363: Sí | I363: MAESTRO | J363: MAGISTER EN ADMINISTRACION DE NEGOCIOS Y FINANZAS INTERNACIONALES MBA INTERNACIONAL | K363: UNIVERSIDAD CATOLICA SEDES SAPIENTIAE | L363: PERÚ | M363: Sí | N363: No | O363: No | P363: Contratado | Q363: Tiempo Parcial | R363: 16 | S363: 0 | T363: 16 | U363: No | V363: No | W363: 2016 - I
A364: =R[-1]C+1 -> 364 | B364: SAAVEDRA | C364: MUÑOZ | D364: NESTOR | E364: PERÚ | F364: 42915862 | G364: 2010-03-08T00:00:00.000 | H364: Sí | I364: BACHILLER | J364: LITERATURA | K364: UNIVERSIDAD NACIONAL MAYOR DE SAN MARCOS | L364: PERÚ | M364: Sí | N364: No | O364: No | P364: Contratado | Q364: Tiempo Parcial | R364: 12 | S364: 0 | T364: 12 | U364: No | V364: No | W364: 2016 - I
A365: =R[-1]C+1 -> 365 | B365: SALAS | C365: RAMIREZ | D365: CARLOS MANUEL | E365: PERÚ | F365: 15609778 | G365: 2013-09-12T00:00:00.000 | H365: Sí | I365: BACHILLER | J365: CIENCIAS CONTABLES Y FINANCIERAS | K365: UNIVERSIDAD DE SAN MARTIN DE PORRES | L365: PERÚ | M365: Sí | N365: No | O365: No | P365: Contratado | Q365: Tiempo Completo | R365: 26 | S365: 14 | T365: 40 | U365: No | V365: No | W365: 2016 - I
A366: =R[-1]C+1 -> 366 | B366: SALAZAR | C366: RIOS | D366: ROBERTO | E366: PERÚ | F366: 08195765 | G366: 2012-08-27T00:00:00.000 | H366: Sí | I366: BACHILLER | J366: INDUSTRIAS ALIMENTARIAS | K366: UNIVERSIDAD NACIONAL AGRARIA | L366: PERÚ | M366: Sí | N366: No | O366: No | P366: Contratado | Q366: Tiempo Parcial | R366: 8 | S366: 0 | T366: 8 | U366: No | V366: No | W366: 2016 - I
A367: =R[-1]C+1 -> 367 | B367: SANCHEZ | C367: ACOSTA | D367: JUAN SANTIAGO | E367: PERÚ | F367: 26952199 | G367: 2014-08-18T00:00:00.000 | H367: No | I367: MAESTRO | J367: MAESTRO EN FARMACIA Y BIOQUIMICA MENCION EN FARMACIA CLINICA | K367: UNIVERSIDAD NACIONAL DE TRUJILLO | L367: PERÚ | M367: Sí | N367: No | O367: No | P367: Contratado | Q367: Tiempo Parcial | R367: 9 | S367: 0 | T367: 9 | U367: Sí | V367: Sí | W367: 2016 - I
A368: =R[-1]C+1 -> 368 | B368: SANCHEZ | C368: ARAUJO | D368: JUAN BAUTISTA | E368: PERÚ | F368: 08203119 | G368: 2008-04-07T00:00:00.000 | H368: Sí | I368: BACHILLER | J368: CIENCIAS ADMINISTRATIVAS | K368: UNIVERSIDAD INCA GARCILASO DE LA VEGA | L368: PERÚ | M368: Sí | N368: No | O368: No | P368: Contratado | Q368: Tiempo Parcial | R368: 6 | S368: 0 | T368: 6 | U368: No | V368: No | W368: 2016 - I
A369: =R[-1]C+1 -> 369 | B369: SANCHEZ | C369: DIAZ | D369: JHON | E369: PERÚ | F369: 42135945 | G369: 2015-11-05T00:00:00.000 | H369: No | I369: MAESTRO | J369: MAGISTER EN DERECHO PENAL Y PROCESAL PENAL | K369: UNIVERSIDAD CESAR VALLEJO | L369: PERÚ | M369: Sí | N369: No | O369: No | P369: Contratado | Q369: Tiempo Parcial | R369: 4 | S369: 0 | T369: 4 | U369: No | V369: No | W369: 2016 - I
A370: =R[-1]C+1 -> 370 | B370: SANCHEZ | C370: SEGOVIA | D370: KARLA ROCCIO | E370: PERÚ | F370: 10352458 | G370: 2013-03-11T00:00:00.000 | H370: Sí | I370: BACHILLER | J370: CONTABILIDAD | K370: UNIVERSIDAD INCA GARCILASO DE LA VEGA | L370: PERÚ | M370: Sí | N370: No | O370: No | P370: Contratado | Q370: Tiempo Completo | R370: 24 | S370: 16 | T370: 40 | U370: No | V370: No | W370: 2016 - I
A371: =R[-1]C+1 -> 371 | B371: SANCHEZ | C371: TORRES | D371: HEIDI ISABEL | E371: PERÚ | F371: 40484791 | G371: 2012-09-04T00:00:00.000 | H371: Sí | I371: MAESTRO | J371: MAGISTER EN BIOTECNOLOGIA | K371: UNIVERSIDAD CESAR VALLEJO | L371: PERÚ | M371: Sí | N371: No | O371: No | P371: Contratado | Q371: Tiempo Parcial | R371: 18 | S371: 0 | T371: 18 | U371: Sí | V371: Sí | W371: 2016 - I
A372: =R[-1]C+1 -> 372 | B372: SANCHEZ | C372: VILCARINO | D372: JORGE DEMETRIO | E372: PERÚ | F372: 09273004 | G372: 2001-04-16T00:00:00.000 | H372: Sí | I372: BACHILLER | J372: COMPUTACION | K372: UNIVERSIDAD NACIONAL MAYOR DE SAN MARCOS | L372: PERÚ | M372: Sí | N372: No | O372: No | P372: Contratado | Q372: Tiempo Completo | R372: 24 | S372: 16 | T372: 40 | U372: No | V372: No | W372: 2016 - I
A373: =R[-1]C+1 -> 373 | B373: SANDOVAL | C373: LOZANO | D373: GIOVANI | E373: PERÚ | F373: 08181918 | G373: 2007-06-01T00:00:00.000 | H373: Sí | I373: BACHILLER | J373: LICENCIADO EN EDUCACION SECUNDARIA CON ESPECIALIDAD EN FILOSOFIA Y RELIGION | K373: UNIVERSIDAD CATOLICA SEDES SAPIENTIAE | L373: PERÚ | M373: Sí | N373: No | O373: No | P373: Ordinario Auxiliar | Q373: Tiempo Completo | R373: 0 | S373: 40 | T373: 40 | U373: No | V373: No | W373: 2016 - I | X373: LSGH - DOCENTE NOMBRADO
A374: =R[-1]C+1 -> 374 | B374: SANDOVAL | C374: LOZANO | D374: SERGIO ALBERTO | E374: PERÚ | F374: 08180998 | G374: 2011-03-17T00:00:00.000 | H374: Sí | I374: BACHILLER | J374: INGENIERIA QUIMICA | K374: UNIVERSIDAD NACIONAL MAYOR DE SAN MARCOS | L374: PERÚ | M374: Sí | N374: No | O374: No | P374: Contratado | Q374: Tiempo Completo | R374: 22 | S374: 18 | T374: 40 | U374: No | V374: Sí | W374: 2016 - I
A375: =R[-1]C+1 -> 375 | B375: SEMINARIO | C375: OLORTIGUE | D375: PABLO HUGO | E375: PERÚ | F375: 08031444 | G375: 2002-09-09T00:00:00.000 | H375: Sí | I375: BACHILLER | J375: CIENCIAS ECONOMIA | K375: UNIVERSIDAD PARTICULAR SAN MARTIN DE PORRES | L375: PERÚ | M375: Sí | N375: No | O375: No | P375: Ordinario Auxiliar | Q375: Tiempo Completo | R375: 22 | S375: 18 | T375: 40 | U375: No | V375: No | W375: 2016 - I
A376: =R[-1]C+1 -> 376 | B376: SEMINARIO | C376: OLORTIGUE | D376: RAUL MARTIN | E376: PERÚ | F376: 08017508 | G376: 2012-09-07T00:00:00.000 | H376: Sí | I376: BACHILLER | J376: CIENCIAS CON MENCION EN INGENIERIA ECONOMICA | K376: UNIVERSIDAD NACIONAL DE INGENIERIA | L376: PERÚ | M376: Sí | N376: No | O376: No | P376: Contratado | Q376: Tiempo Parcial | R376: 8 | S376: 0 | T376: 8 | U376: No | V376: No | W376: 2016 - I
A377: =R[-1]C+1 -> 377 | B377: SFREGOLA | C377: . | D377: CARMELA | E377: ITALIA | F377: 001242418 | G377: 2015-06-01T00:00:00.000 | H377: No | I377: MAESTRO | J377: LAUREE MAGISTRALI IN SCIENZE ECONOMICO AZIENDALI | K377: UNIVERSITA DEGLI STUDI DI BARI ALDO MORO | L377: ITALIA | M377: Sí | N377: No | O377: No | P377: Contratado | Q377: Tiempo Completo | R377: 24 | S377: 16 | T377: 40 | U377: Sí | V377: Sí | W377: 2016 - I
A378: =R[-1]C+1 -> 378 | B378: SICCHA | C378: VALDERRAMA | D378: TERESA MILAGROS | E378: PERÚ | F378: 42258333 | G378: 2013-10-02T00:00:00.000 | H378: Sí | I378: BACHILLER | J378: ARQUITECTA | K378: UNIVERSIDAD PRIVADA ANTENOR ORREGO DE TRUJILLO | L378: PERÚ | M378: Sí | N378: No | O378: No | P378: Contratado | Q378: Tiempo Completo | R378: 28 | S378: 12 | T378: 40 | U378: No | V378: No | W378: 2016 - I
A379: =R[-1]C+1 -> 379 | B379: SIDIA | C379: CARRASCO | D379: MIGUEL JOSE | E379: PERÚ | F379: 07936807 | G379: 2014-03-13T00:00:00.000 | H379: Sí | I379: BACHILLER | J379: INGENIERIA CIVIL | K379: UNIVERSIDAD NACIONAL FEDERICO VILLAREAL | L379: PERÚ | M379: Sí | N379: No | O379: No | P379: Contratado | Q379: Tiempo Parcial | R379: 8 | S379: 8 | T379: 16 | U379: No | V379: No | W379: 2016 - I
A380: =R[-1]C+1 -> 380 | B380: SOLARI | C380: DE LA FUENTE | D380: LUIS MARIA SANTIAGO EDUAR | E380: PERÚ | F380: 08229291 | G380: 2007-11-01T00:00:00.000 | H380: Sí | I380: BACHILLER | J380: MEDICINA | K380: UNIVERSIDAD NACIONAL MAYOR DE SAN MARCOS | L380: PERÚ | M380: Sí | N380: No | O380: No | P380: Ordinario Principal | Q380: Dedicacion Exclusiva | R380: 0 | S380: 40 | T380: 40 | U380: No | V380: No | W380: 2016 - I | X380: DECANO FACULTAD DE CIENCIAS DE LA SALUD
A381: =R[-1]C+1 -> 381 | B381: SOLIS | C381: CESPEDES | D381: PEDRO ANIBAL | E381: PERÚ | F381: 26601922 | G381: 2016-04-11T00:00:00.000 | H381: No | I381: DOCTOR | J381: SALUD PUBLICA | K381: UNIVERSIDAD NACIONAL JOSE FAUSTINO SANCHEZ CARRION | L381: PERÚ | M381: Sí | N381: No | O381: No | P381: Contratado | Q381: Tiempo Parcial | R381: 12 | S381: 0 | T381: 12 | U381: No | V381: Sí | W381: 2016 - I
A382: =R[-1]C+1 -> 382 | B382: SOTO | C382: CANALES | D382: PEDRO PASCUAL | E382: PERÚ | F382: 09452164 | G382: 2000-09-01T00:00:00.000 | H382: Sí | I382: BACHILLER | J382: EDUCACION | K382: UNIVERSIDAD MARCELINO CHAMPAGNAT | L382: PERÚ | M382: Sí | N382: No | O382: No | P382: Ordinario Asociado | Q382: Tiempo Completo | R382: 16 | S382: 24 | T382: 40 | U382: No | V382: Sí | W382: 2016 - I
A383: =R[-1]C+1 -> 383 | B383: SOTO | C383: CCOICCA | D383: KAROL | E383: PERÚ | F383: 40536407 | G383: 2004-04-01T00:00:00.000 | H383: Sí | I383: BACHILLER | J383: INGENIERIA DE SISTEMAS Y COMPUTO | K383: UNIVERSIDAD INCA GARCILASO DE LA VEGA | L383: PERÚ | M383: Sí | N383: No | O383: No | P383: Contratado | Q383: Tiempo Parcial | R383: 16 | S383: 0 | T383: 16 | U383: No | V383: No | W383: 2016 - I
A384: =R[-1]C+1 -> 384 | B384: SOTO | C384: COCHON | D384: CARLINA ROXANA | E384: PERÚ | F384: 29538510 | G384: 2013-09-11T00:00:00.000 | H384: Sí | I384: BACHILLER | J384: NUTRICION Y DIETETICA | K384: UNIVERSIDAD NACIONAL SAN AGUSTIN | L384: PERÚ | M384: Sí | N384: No | O384: No | P384: Contratado | Q384: Tiempo Parcial | R384: 12 | S384: 0 | T384: 12 | U384: No | V384: No | W384: 2016 - I
A385: =R[-1]C+1 -> 385 | B385: SOTO | C385: PORRAS | D385: JESUS GERARDO | E385: PERÚ | F385: 21076557 | G385: 2011-03-14T00:00:00.000 | H385: Sí | I385: BACHILLER | J385: CIENCIAS CON MENCION EN INGENIERIA ELECTRICA | K385: UNIVERSIDAD NACIONAL DE INGENIERIA | L385: PERÚ | M385: Sí | N385: No | O385: No | P385: Contratado | Q385: Tiempo Parcial | R385: 16 | S385: 0 | T385: 16 | U385: No | V385: No | W385: 2016 - I
A386: =R[-1]C+1 -> 386 | B386: SUELDO | C386: VEGA | D386: GREMY | E386: PERÚ | F386: 09886713 | G386: 2007-10-01T00:00:00.000 | H386: Sí | I386: BACHILLER | J386: EDUCACION PRIMARIA | K386: UNIVERSIDAD CATOLICA SEDES SAPIENTIAE | L386: PERÚ | M386: Sí | N386: No | O386: No | P386: Contratado | Q386: Tiempo Completo | R386: 0 | S386: 40 | T386: 40 | U386: No | V386: No | W386: 2016 - I | X386: TUTOR VIRTUAL
A387: =R[-1]C+1 -> 387 | B387: TACUNAN | C387: BONIFACIO | D387: SANTIAGO | E387: PERÚ | F387: 09978369 | G387: 2007-04-09T00:00:00.000 | H387: Sí | I387: BACHILLER | J387: CIENCIAS SOCIALES ESPECIALIDAD HISTORIA | K387: UNIVERSIDAD NACIONAL MAYOR DE SAN MARCOS | L387: PERÚ | M387: Sí | N387: No | O387: No | P387: Contratado | Q387: Tiempo Completo | R387: 12 | S387: 28 | T387: 40 | U387: No | V387: No | W387: 2016 - I
A388: =R[-1]C+1 -> 388 | B388: TAIPE | C388: AYLAS | D388: MARIA DEL CARMEN | E388: PERÚ | F388: 09732261 | G388: 2011-09-05T00:00:00.000 | H388: Sí | I388: BACHILLER | J388: NUTRICION | K388: UNIVERSIDAD NACIONAL FEDERICO VILLAREAL | L388: PERÚ | M388: Sí | N388: No | O388: No | P388: Ordinario Auxiliar | Q388: Tiempo Parcial | R388: 20 | S388: 0 | T388: 20 | U388: Sí | V388: Sí | W388: 2016 - I
A389: =R[-1]C+1 -> 389 | B389: TAPIA | C389: NUÑEZ | D389: LOURDES CECILIA | E389: PERÚ | F389: 09363458 | G389: 2011-09-05T00:00:00.000 | H389: Sí | I389: BACHILLER | J389: INGENIERIA INDUSTRIAL | K389: UNIVERSIDAD NACIONAL FEDERICO VILLAREAL | L389: PERÚ | M389: Sí | N389: No | O389: No | P389: Contratado | Q389: Tiempo Parcial | R389: 8 | S389: 0 | T389: 8 | U389: No | V389: Sí | W389: 2016 - I
A390: =R[-1]C+1 -> 390 | B390: TARRILLO | C390: VILLEGAS | D390: ANA MARIA | E390: PERÚ | F390: 45829609 | G390: 2013-04-02T00:00:00.000 | H390: Sí | I390: BACHILLER | J390: PSICOLOGIA | K390: UNIVERSIDAD PERUANA UNION | L390: PERÚ | M390: Sí | N390: No | O390: No | P390: Contratado | Q390: Tiempo Parcial | R390: 16 | S390: 0 | T390: 16 | U390: No | V390: No | W390: 2016 - I
A391: =R[-1]C+1 -> 391 | B391: TEJADA | C391: FARFAN | D391: ANDREA GIULIANA | E391: PERÚ | F391: 43252024 | G391: 2012-05-02T00:00:00.000 | H391: Sí | I391: BACHILLER | J391: EDUCACION | K391: UNIVERSIDAD CATOLICA SEDES SAPIENTIAE | L391: PERÚ | M391: Sí | N391: No | O391: No | P391: Contratado | Q391: Tiempo Parcial | R391: 20 | S391: 0 | T391: 20 | U391: No | V391: No | W391: 2016 - I
A392: =R[-1]C+1 -> 392 | B392: TEJADA | C392: RIVAS | D392: ROBERTO ANTONIO | E392: PERÚ | F392: 07757302 | G392: 2002-04-08T00:00:00.000 | H392: Sí | I392: BACHILLER | J392: EDUCACION | K392: UNIVERSIDAD PERUANA CAYETANO HEREDIA | L392: PERÚ | M392: Sí | N392: No | O392: No | P392: Ordinario Auxiliar | Q392: Tiempo Completo | R392: 0 | S392: 40 | T392: 40 | U392: No | V392: No | W392: 2016 - I | X392: LSGH - DOCENTE NOMBRADO
A393: =R[-1]C+1 -> 393 | B393: TELLO | C393: BENITES | D393: JESSICA VICTORIA | E393: PERÚ | F393: 10177764 | G393: 2013-03-18T00:00:00.000 | H393: Sí | I393: BACHILLER | J393: EDUCACION | K393: UNIVERSIDAD CATOLICA SEDES SAPIENTIAE | L393: PERÚ | M393: Sí | N393: No | O393: No | P393: Contratado | Q393: Tiempo Completo | R393: 16 | S393: 24 | T393: 40 | U393: No | V393: No | W393: 2016 - I
A394: =R[-1]C+1 -> 394 | B394: TELLO | C394: MARZOL | D394: JACQUELINE ANGELICA | E394: PERÚ | F394: 06282789 | G394: 2008-04-03T00:00:00.000 | H394: Sí | I394: BACHILLER | J394: HUMANIDADES CON MENCION EN PSICOLOGIA | K394: PONTIFICIA UNIVERSIDAD CATOLICA DEL PERU | L394: PERÚ | M394: Sí | N394: No | O394: No | P394: Contratado | Q394: Tiempo Parcial | R394: 8 | S394: 0 | T394: 8 | U394: No | V394: No | W394: 2016 - I
A395: =R[-1]C+1 -> 395 | B395: TELLO | C395: PANDAL | D395: NILO | E395: PERÚ | F395: 15605059 | G395: 2011-03-07T00:00:00.000 | H395: Sí | I395: BACHILLER | J395: CIENCIAS DE LA EDUCACION | K395: UNIVERSIDAD NACIONAL DE EDUCACION ENRIQUE GUZMAN Y VALLE | L395: PERÚ | M395: Sí | N395: No | O395: No | P395: Contratado | Q395: Tiempo Parcial | R395: 10 | S395: 0 | T395: 10 | U395: No | V395: Sí | W395: 2016 - I
A396: =R[-1]C+1 -> 396 | B396: TENORIO | C396: MENDEZ | D396: WALTER ORLANDO | E396: PERÚ | F396: 07585542 | G396: 2002-09-09T00:00:00.000 | H396: Sí | I396: BACHILLER | J396: ECONOMIA | K396: UNIVERSIDAD NACIONAL MAYOR DE SAN MARCOS | L396: PERÚ | M396: Sí | N396: No | O396: No | P396: Ordinario Asociado | Q396: Tiempo Completo | R396: 18 | S396: 22 | T396: 40 | U396: No | V396: No | W396: 2016 - I
A397: =R[-1]C+1 -> 397 | B397: TIRADO | C397: PUCUHUAYLA | D397: JUAN ANTONIO | E397: PERÚ | F397: 21082550 | G397: 2011-03-14T00:00:00.000 | H397: Sí | I397: BACHILLER | J397: CIENCIAS INGENIERIA GEOLOGICA | K397: UNIVERSIDAD NACIONAL DANIEL ALCIDES CARRION | L397: PERÚ | M397: Sí | N397: No | O397: No | P397: Contratado | Q397: Tiempo Completo | R397: 30 | S397: 10 | T397: 40 | U397: No | V397: No | W397: 2016 - I
A398: =R[-1]C+1 -> 398 | B398: TOLENTINO | C398: ZAPATA | D398: JUAN MANUEL | E398: PERÚ | F398: 09639466 | G398: 2013-05-16T00:00:00.000 | H398: Sí | I398: MAESTRO | J398: MAESTRO EN DOCENCIA UNIVERSITARIA | K398: UNIVERSIDAD NACIONAL FEDERICO VILLAREAL | L398: PERÚ | M398: Sí | N398: No | O398: No | P398: Contratado | Q398: Tiempo Completo | R398: 20 | S398: 20 | T398: 40 | U398: No | V398: No | W398: 2016 - I
A399: =R[-1]C+1 -> 399 | B399: TORO | C399: DEXTRE | D399: ELISEO | E399: PERÚ | F399: 07786573 | G399: 2011-09-05T00:00:00.000 | H399: Sí | I399: MAESTRO | J399: CIENCIAS DE LA EDUCACION CON MENCION EN DOCENCIA Y GESTION UNIVERSITARIA | K399: UNIVERSIDAD NACIONAL PEDRO RUIZ GALLO | L399: PERÚ | M399: Sí | N399: No | O399: No | P399: Contratado | Q399: Tiempo Parcial | R399: 10 | S399: 0 | T399: 10 | U399: No | V399: Sí | W399: 2016 - I
A400: =R[-1]C+1 -> 400 | B400: TREJO | C400: SARE | D400: JENNY EVELYN | E400: PERÚ | F400: 42824306 | G400: 2014-03-13T00:00:00.000 | H400: Sí | I400: BACHILLER | J400: EDUCACION | K400: UNIVERSIDAD NACIONAL MAYOR DE SAN MARCOS | L400: PERÚ | M400: Sí | N400: No | O400: No | P400: Contratado | Q400: Tiempo Parcial | R400: 20 | S400: 0 | T400: 20 | U400: No | V400: No | W400: 2016 - I
A401: =R[-1]C+1 -> 401 | B401: TRUJILLO | C401: CHAVEZ | D401: DELSY MARIELA | E401: PERÚ | F401: 10140056 | G401: 2015-08-17T00:00:00.000 | H401: No | I401: MAESTRO | J401: MASTER IN EVOLUTION ECOLOGY AND SYSTEMATICS | K401: LUDWIG MAXIMILIANS UNIVERSITAT MUNCHEN | L401: ALEMANIA | M401: Sí | N401: No | O401: No | P401: Contratado | Q401: Tiempo Parcial | R401: 10 | S401: 0 | T401: 10 | U401: Sí | V401: Sí | W401: 2016 - I
A402: =R[-1]C+1 -> 402 | B402: TUME | C402: CHINCHAY | D402: LUIS FELIPE | E402: PERÚ | F402: 03568079 | G402: 2013-03-04T00:00:00.000 | H402: Sí | I402: BACHILLER | J402: CIENCIAS AGRARIAS | K402: UNIVERSIDAD NACIONAL TECNICA DE PIURA | L402: PERÚ | M402: Sí | N402: No | O402: No | P402: Contratado | Q402: Tiempo Parcial | R402: 9 | S402: 0 | T402: 9 | U402: No | V402: No | W402: 2016 - I
A403: =R[-1]C+1 -> 403 | B403: TUME | C403: RUIZ | D403: JUAN MANUEL | E403: PERÚ | F403: 03494013 | G403: 2016-03-07T00:00:00.000 | H403: No | I403: MAESTRO | J403: MAGISTER EN BIOCIENCIAS CON MENCION EN CIENCIAS DEL MAR | K403: UNIVERSIDAD NACIONAL DE PIURA | L403: PERÚ | M403: Sí | N403: No | O403: No | P403: Contratado | Q403: Tiempo Parcial | R403: 9 | S403: 0 | T403: 9 | U403: No | V403: Sí | W403: 2016 - I
A404: =R[-1]C+1 -> 404 | B404: UBILLUS | C404: SILVA | D404: RUBEN | E404: PERÚ | F404: 02860918 | G404: 2013-08-19T00:00:00.000 | H404: Sí | I404: BACHILLER | J404: CIENCIAS CONTABLES | K404: UNIVERSIDAD CESAR VALLEJO | L404: PERÚ | M404: Sí | N404: No | O404: No | P404: Contratado | Q404: Tiempo Parcial | R404: 16 | S404: 0 | T404: 16 | U404: No | V404: No | W404: 2016 - I
A405: =R[-1]C+1 -> 405 | B405: UCAÑAN | C405: LEYTON | D405: ROGER EUGENIO | E405: PERÚ | F405: 17970143 | G405: 2001-09-17T00:00:00.000 | H405: Sí | I405: BACHILLER | J405: INGENIERIA INDUSTRIAL | K405: UNIVERSIDAD NACIONAL DE TRUJILLO | L405: PERÚ | M405: Sí | N405: No | O405: No | P405: Ordinario Auxiliar | Q405: Tiempo Completo | R405: 16 | S405: 24 | T405: 40 | U405: Sí | V405: Sí | W405: 2016 - I
A406: =R[-1]C+1 -> 406 | B406: URBANO | C406: CHAVEZ | D406: ANGELICA EULALIA | E406: PERÚ | F406: 08600005 | G406: 2002-09-09T00:00:00.000 | H406: Sí | I406: BACHILLER | J406: CIENCIAS ADMINISTRATIVAS | K406: PONTIFICIA UNIVERSIDAD CATOLICA DEL PERU | L406: PERÚ | M406: Sí | N406: No | O406: No | P406: Contratado | Q406: Tiempo Parcial | R406: 8 | S406: 0 | T406: 8 | U406: No | V406: No | W406: 2016 - I
A407: =R[-1]C+1 -> 407 | B407: URIBE | C407: PORRAS | D407: CARLOS ALBERTO | E407: PERÚ | F407: 10272670 | G407: 2012-09-06T00:00:00.000 | H407: Sí | I407: BACHILLER | J407: DERECHO Y CIENCIAS POLITICAS | K407: UNIVERSIDAD DE SAN MARTIN DE PORRES | L407: PERÚ | M407: Sí | N407: No | O407: No | P407: Contratado | Q407: Tiempo Parcial | R407: 8 | S407: 0 | T407: 8 | U407: No | V407: No | W407: 2016 - I
A408: =R[-1]C+1 -> 408 | B408: VALDIVIA | C408: ARENAS | D408: CARMEN ROSA | E408: PERÚ | F408: 21796501 | G408: 2007-04-02T00:00:00.000 | H408: Sí | I408: BACHILLER | J408: CIENCIAS DE LA EDUCACION | K408: UNIVERSIDAD NACIONAL DE EDUCACION ENRIQUE GUZMAN Y VALLE | L408: PERÚ | M408: Sí | N408: Sí | O408: No | P408: Contratado | Q408: Tiempo Completo | R408: 16 | S408: 24 | T408: 40 | U408: Sí | V408: Sí | W408: 2016 - I
A409: =R[-1]C+1 -> 409 | B409: VALDIVIA | C409: TORRES | D409: AUGUSTO GILTTER | E409: PERÚ | F409: 07424538 | G409: 2012-03-06T00:00:00.000 | H409: Sí | I409: BACHILLER | J409: CONTABILIDAD | K409: UNIVERSIDAD NACIONAL MAYOR DE SAN MARCOS | L409: PERÚ | M409: Sí | N409: No | O409: No | P409: Contratado | Q409: Tiempo Parcial | R409: 18 | S409: 2 | T409: 20 | U409: No | V409: No | W409: 2016 - I
A410: =R[-1]C+1 -> 410 | B410: VALDIVIA | C410: ZUÑIGA | D410: MARIBEL EMILIA | E410: PERÚ | F410: 09223783 | G410: 2014-03-15T00:00:00.000 | H410: Sí | I410: BACHILLER | J410: CIENCIAS DE LA EDUCACION | K410: UNIVERSIDAD NACIONAL DE EDUCACION ENRIQUE GUZMAN Y VALLE | L410: PERÚ | M410: Sí | N410: No | O410: No | P410: Contratado | Q410: Tiempo Completo | R410: 12 | S410: 28 | T410: 40 | U410: No | V410: No | W410: 2016 - I
A411: =R[-1]C+1 -> 411 | B411: VARGAS | C411: ROJAS | D411: JUAN ORLANDO | E411: PERÚ | F411: 01046752 | G411: 2012-03-12T00:00:00.000 | H411: Sí | I411: BACHILLER | J411: EDUCACION | K411: UNIVERSIDAD NACIONAL MAYOR DE SAN MARCOS | L411: PERÚ | M411: Sí | N411: No | O411: No | P411: Contratado | Q411: Tiempo Parcial | R411: 20 | S411: 0 | T411: 20 | U411: No | V411: No | W411: 2016 - I
A412: =R[-1]C+1 -> 412 | B412: VASQUEZ | C412: BALAREZO | D412: JOVITA | E412: PERÚ | F412: 00129361 | G412: 2013-02-01T00:00:00.000 | H412: Sí | I412: BACHILLER | J412: EDUCACION | K412: UNIVERSIDAD CATOLICA SEDES SAPIENTIAE | L412: PERÚ | M412: Sí | N412: No | O412: No | P412: Contratado | Q412: Tiempo Completo | R412: 18 | S412: 22 | T412: 40 | U412: No | V412: No | W412: 2016 - I
A413: =R[-1]C+1 -> 413 | B413: VASQUEZ | C413: CASTAÑEDA | D413: MARIA LUISA | E413: PERÚ | F413: 40348999 | G413: 2002-10-01T00:00:00.000 | H413: Sí | I413: BACHILLER | J413: EDUCACION | K413: UNIVERSIDAD MARCELINO CHAMPAGNAT | L413: PERÚ | M413: Sí | N413: No | O413: No | P413: Ordinario Auxiliar | Q413: Tiempo Completo | R413: 16 | S413: 24 | T413: 40 | U413: No | V413: No | W413: 2016 - I
A414: =R[-1]C+1 -> 414 | B414: VASQUEZ | C414: MEDINA | D414: PEDRO JAMES | E414: PERÚ | F414: 16562688 | G414: 2016-04-11T00:00:00.000 | H414: No | I414: MAESTRO | J414: MAESTRO EN ECOLOGIA Y GESTION AMBIENTAL | K414: UNIVERSIDAD NACIONAL JOSE FAUSTINO SANCHEZ CARRION | L414: PERÚ | M414: Sí | N414: No | O414: No | P414: Contratado | Q414: Tiempo Parcial | R414: 8 | S414: 0 | T414: 8 | U414: No | V414: Sí | W414: 2016 - I
A415: =R[-1]C+1 -> 415 | B415: VASSALLO | C415: FERNANDEZ | D415: LUIGI EDGARDO | E415: PERÚ | F415: 09442181 | G415: 2011-03-21T00:00:00.000 | H415: Sí | I415: BACHILLER | J415: CIENCIAS ECONOMICAS | K415: UNIVERSIDAD NACIONAL FEDERICO VILLAREAL | L415: PERÚ | M415: Sí | N415: No | O415: No | P415: Ordinario Auxiliar | Q415: Tiempo Completo | R415: 20 | S415: 20 | T415: 40 | U415: No | V415: No | W415: 2016 - I
A416: =R[-1]C+1 -> 416 | B416: VEGA | C416: BALDEON | D416: AGUSTIN HEBERT | E416: PERÚ | F416: 08607374 | G416: 2011-07-06T00:00:00.000 | H416: Sí | I416: MAESTRO | J416: MAGISTER EN GESTION PUBLICA | K416: UNIVERSIDAD CESAR VALLEJO | L416: PERÚ | M416: Sí | N416: No | O416: No | P416: Contratado | Q416: Tiempo Parcial | R416: 4 | S416: 0 | T416: 4 | U416: No | V416: No | W416: 2016 - I
A417: =R[-1]C+1 -> 417 | B417: VEJARANO | C417: INGAR | D417: MANUEL JESUS | E417: PERÚ | F417: 10684755 | G417: 2007-04-02T00:00:00.000 | H417: Sí | I417: BACHILLER | J417: EDUCACION | K417: UNIVERSIDAD MARCELINO CHAMPAGNAT | L417: PERÚ | M417: Sí | N417: No | O417: No | P417: Ordinario Auxiliar | Q417: Tiempo Completo | R417: 18 | S417: 22 | T417: 40 | U417: No | V417: No | W417: 2016 - I
A418: =R[-1]C+1 -> 418 | B418: VELARDE | C418: FLORES | D418: RUBEN ANTONIO | E418: PERÚ | F418: 07238797 | G418: 2002-09-09T00:00:00.000 | H418: Sí | I418: MAESTRO | J418: MASTER UNIVERSITARIO DE I LIVELLO IN GESTIONE STRATEGICA FINANZA E INTERNAZIONALIZZAZIONE DELLE IMPR | K418: UNIVERSITA DEGLI STUDI DI GENOVA | L418: ITALIA | M418: Sí | N418: Sí | O418: No | P418: Ordinario Auxiliar | Q418: Tiempo Completo | R418: 12 | S418: 28 | T418: 40 | U418: No | V418: No | W418: 2016 - I
A419: =R[-1]C+1 -> 419 | B419: VELASQUEZ | C419: ESPINOZA | D419: MONICA | E419: PERÚ | F419: 42071960 | G419: 2014-09-12T00:00:00.000 | H419: No | I419: MAESTRO | J419: MAGISTER SCIENTIAE ECOLOGIA APLICADA | K419: UNIVERSIDAD NACIONAL AGRARIA LA MOLINA | L419: PERÚ | M419: Sí | N419: No | O419: No | P419: Contratado | Q419: Tiempo Parcial | R419: 14 | S419: 2 | T419: 16 | U419: Sí | V419: Sí | W419: 2016 - I
A420: =R[-1]C+1 -> 420 | B420: VELASQUEZ | C420: RODRIGUEZ | D420: NORMA CONSTANZA | E420: PERÚ | F420: 08172294 | G420: 2006-04-01T00:00:00.000 | H420: Sí | I420: DOCTOR | J420: ECONOMIA | K420: UNIVERSIDAD NACIONAL FEDERICO VILLAREAL | L420: PERÚ | M420: Sí | N420: No | O420: No | P420: Ordinario Asociado | Q420: Tiempo Completo | R420: 8 | S420: 32 | T420: 40 | U420: Sí | V420: Sí | W420: 2016 - I
A421: =R[-1]C+1 -> 421 | B421: VELASQUEZ | C421: ROSAS DE CUTIMBO | D421: JULIA GLADYS | E421: PERÚ | F421: 10400322 | G421: 2009-09-08T00:00:00.000 | H421: Sí | I421: BACHILLER | J421: ENFERMERIA | K421: UNIVERSIDAD NACIONAL SAN AGUSTIN DE AREQUIPA | L421: PERÚ | M421: Sí | N421: No | O421: No | P421: Ordinario Auxiliar | Q421: Tiempo Completo | R421: 13 | S421: 27 | T421: 40 | U421: No | V421: No | W421: 2016 - I
A422: =R[-1]C+1 -> 422 | B422: VELIZ | C422: PAREDES | D422: GUILLERMO RENZO | E422: PERÚ | F422: 40715884 | G422: 2011-04-01T00:00:00.000 | H422: Sí | I422: BACHILLER | J422: TECNOLOGIA MEDICA | K422: UNIVERSIDAD NACIONAL MAYOR DE SAN MARCOS | L422: PERÚ | M422: Sí | N422: No | O422: No | P422: Ordinario Auxiliar | Q422: Tiempo Completo | R422: 24 | S422: 16 | T422: 40 | U422: No | V422: No | W422: 2016 - I
A423: =R[-1]C+1 -> 423 | B423: VENEGAS | C423: CAMPOS | D423: MIRIAM ISABEL | E423: PERÚ | F423: 41283752 | G423: 2013-09-10T00:00:00.000 | H423: Sí | I423: BACHILLER | J423: TECNOLOGIA MEDICA | K423: UNIVERSIDAD NACIONAL MAYOR DE SAN MARCOS | L423: PERÚ | M423: Sí | N423: No | O423: No | P423: Contratado | Q423: Tiempo Parcial | R423: 6 | S423: 0 | T423: 6 | U423: No | V423: No | W423: 2016 - I
A424: =R[-1]C+1 -> 424 | B424: VERGARA | C424: PALACIOS | D424: GLADYS ELIDA | E424: PERÚ | F424: 08725896 | G424: 2008-09-09T00:00:00.000 | H424: Sí | I424: BACHILLER | J424: ENFERMERIA | K424: UNIVERSIDAD NACIONAL FEDERICO VILLAREAL | L424: PERÚ | M424: Sí | N424: No | O424: No | P424: Ordinario Auxiliar | Q424: Tiempo Parcial | R424: 12 | S424: 8 | T424: 20 | U424: No | V424: No | W424: 2016 - I
A425: =R[-1]C+1 -> 425 | B425: VERGARA | C425: TRUJILLO | D425: JULIO DOUGLAS | E425: PERÚ | F425: 10777769 | G425: 2001-09-17T00:00:00.000 | H425: Sí | I425: MAESTRO | J425: MASTER UNIVERSITARIO DE I LIVELLO IN GESTIONE STRATEGICA FINANZA E INTERNAZIONALIZZAZIONE DELLE IMPR | K425: UNIVERSITA DEGLI STUDI DI GENOVA | L425: ITALIA | M425: Sí | N425: No | O425: No | P425: Ordinario Auxiliar | Q425: Tiempo Completo | R425: 22 | S425: 18 | T425: 40 | U425: No | V425: Sí | W425: 2016 - I
A426: =R[-1]C+1 -> 426 | B426: VICUÑA | C426: ORIHUELA | D426: CARMELA EMPERATRIZ | E426: PERÚ | F426: 07503079 | G426: 2014-03-10T00:00:00.000 | H426: Sí | I426: MAESTRO | J426: MAGISTER EN GESTION EDUCATIVA Y DIDACTICA | K426: UNIVERSIDAD NACIONAL DEL CENTRO DEL PERU | L426: PERÚ | M426: Sí | N426: No | O426: No | P426: Contratado | Q426: Tiempo Parcial | R426: 20 | S426: 0 | T426: 20 | U426: No | V426: Sí | W426: 2016 - I
A427: =R[-1]C+1 -> 427 | B427: VIDAL | C427: ROJAS | D427: MARIANELLA IVY | E427: PERÚ | F427: 06240042 | G427: 2007-04-02T00:00:00.000 | H427: Sí | I427: BACHILLER | J427: EDUCACION | K427: UNIVERSIDAD PERUANA CAYETANO HEREDIA | L427: PERÚ | M427: Sí | N427: No | O427: No | P427: Contratado | Q427: Tiempo Parcial | R427: 4 | S427: 8 | T427: 12 | U427: No | V427: No | W427: 2016 - I
A428: =R[-1]C+1 -> 428 | B428: VILCA | C428: DELGADO | D428: WILLIAMS SHANE | E428: PERÚ | F428: 06663188 | G428: 2013-09-10T00:00:00.000 | H428: Sí | I428: BACHILLER | J428: EDUCACION | K428: UNIVERSIDAD MARCELINO CHAMPAGNAT | L428: PERÚ | M428: Sí | N428: No | O428: No | P428: Contratado | Q428: Tiempo Completo | R428: 16 | S428: 24 | T428: 40 | U428: No | V428: No | W428: 2016 - I
A429: =R[-1]C+1 -> 429 | B429: VILCAPUMA | C429: VINCES | D429: PATRICIA BERNARDA | E429: PERÚ | F429: 10796076 | G429: 2006-04-01T00:00:00.000 | H429: Sí | I429: BACHILLER | J429: CIENCIAS DE LA COMUNICACION | K429: UNIVERSIDAD DE SAN MARTIN DE PORRES | L429: PERÚ | M429: Sí | N429: No | O429: No | P429: Contratado | Q429: Tiempo Completo | R429: 4 | S429: 36 | T429: 40 | U429: No | V429: Sí | W429: 2016 - I
A430: =R[-1]C+1 -> 430 | B430: VILCHERREZ | C430: VILELA | D430: DARWIN | E430: PERÚ | F430: 03383213 | G430: 2014-08-18T00:00:00.000 | H430: No | I430: MAESTRO | J430: MAGISTER EN MATEMATICA APLICADA | K430: UNIVERSIDAD NACIONAL DE PIURA | L430: PERÚ | M430: Sí | N430: No | O430: No | P430: Contratado | Q430: Tiempo Parcial | R430: 15 | S430: 0 | T430: 15 | U430: No | V430: Sí | W430: 2016 - I
A431: =R[-1]C+1 -> 431 | B431: VILLA | C431: MOROCHO | D431: CESAR AUGUSTO | E431: PERÚ | F431: 08459715 | G431: 2006-04-01T00:00:00.000 | H431: Sí | I431: MAESTRO | J431: MAGISTER EN ADMINISTRACION DE NEGOCIOS Y FINANZAS INTERNACIONALES MBA INTERNACIONAL | K431: UNIVERSIDAD CATOLICA SEDES SAPIENTIAE | L431: PERÚ | M431: Sí | N431: No | O431: No | P431: Ordinario Asociado | Q431: Tiempo Completo | R431: 10 | S431: 30 | T431: 40 | U431: Sí | V431: Sí | W431: 2016 - I
A432: =R[-1]C+1 -> 432 | B432: VILLACORTA | C432: BERTOLOTTO | D432: LUIS FERNANDO | E432: PERÚ | F432: 07942626 | G432: 2007-04-02T00:00:00.000 | H432: Sí | I432: BACHILLER | J432: CIENCIAS ADMINISTRATIVAS | K432: UNIVERSIDAD NACIONAL MAYOR DE SAN MARCOS | L432: PERÚ | M432: Sí | N432: No | O432: No | P432: Contratado | Q432: Tiempo Parcial | R432: 14 | S432: 0 | T432: 14 | U432: No | V432: No | W432: 2016 - I
A433: =R[-1]C+1 -> 433 | B433: VILLACORTA | C433: SANTAMATO | D433: LUIS ANDRES | E433: PERÚ | F433: 25609588 | G433: 2009-04-16T00:00:00.000 | H433: Sí | I433: BACHILLER | J433: CIENCIAS CON MENCION EN ARQUITECTURA | K433: UNIVERSIDAD NACIONAL DE INGENIERIA | L433: PERÚ | M433: Sí | N433: No | O433: No | P433: Contratado | Q433: Tiempo Completo | R433: 0 | S433: 40 | T433: 40 | U433: No | V433: No | W433: 2016 - I | X433: COORDINADOR PROYECTO GETTY
A434: =R[-1]C+1 -> 434 | B434: VILLALOBOS | C434: VILLEGAS | D434: WILTON | E434: PERÚ | F434: 80543304 | G434: 2013-03-18T00:00:00.000 | H434: Sí | I434: BACHILLER | J434: MATEMATICAS | K434: UNIVERSIDAD NACIONAL PEDRO RUIZ GALLO | L434: PERÚ | M434: Sí | N434: No | O434: No | P434: Contratado | Q434: Tiempo Parcial | R434: 10 | S434: 0 | T434: 10 | U434: No | V434: No | W434: 2016 - I
A435: =R[-1]C+1 -> 435 | B435: VILLANUEVA | C435: HUAMAN | D435: FRANCISCO MIGUEL | E435: PERÚ | F435: 46606605 | G435: 2014-03-01T00:00:00.000 | H435: Sí | I435: BACHILLER | J435: EDUCACION | K435: UNIVERSIDAD CATOLICA SEDES SAPIENTIAE | L435: PERÚ | M435: Sí | N435: No | O435: No | P435: Contratado | Q435: Tiempo Completo | R435: 20 | S435: 20 | T435: 40 | U435: No | V435: No | W435: 2016 - I
A436: =R[-1]C+1 -> 436 | B436: VILLEGAS | C436: FERNANDEZ | D436: YURY JOSELINA | E436: PERÚ | F436: 40971221 | G436: 2014-03-14T00:00:00.000 | H436: Sí | I436: BACHILLER | J436: INDUSTRIAS ALIMENTARIAS | K436: UNIVERSIDAD NACIONAL AGRARIA LA MOLINA | L436: PERÚ | M436: Sí | N436: No | O436: No | P436: Contratado | Q436: Tiempo Completo | R436: 6 | S436: 34 | T436: 40 | U436: No | V436: Sí | W436: 2016 - I
A437: =R[-1]C+1 -> 437 | B437: VOTO | C437: . | D437: CARMINE | E437: ITALIA | F437: 000923632 | G437: 2013-03-20T00:00:00.000 | H437: Sí | I437: MAESTRO | J437: RELACIONES INTERNACIONALES | K437: UNIVERSITA DEGLI STUDI DI BARI | L437: ITALIA | M437: Sí | N437: No | O437: No | P437: Contratado | Q437: Tiempo Completo | R437: 0 | S437: 40 | T437: 40 | U437: No | V437: No | W437: 2016 - I | X437: COORDINADOR DE OFICINA DE REALACIONES INTERNACIONALES
A438: =R[-1]C+1 -> 438 | B438: YAFAC | C438: CASTILLO | D438: CARLA VALERIE | E438: PERÚ | F438: 41707058 | G438: 2013-08-07T00:00:00.000 | H438: Sí | I438: MAESTRO | J438: ECONOMIA Y GESTION DEL PROCESO DE GLOBALIZACION REFERIDO AL SECTOR DEL SERVICIO | K438: UNIVERSITA DEGLI STUDI DI GENOVA | L438: ITALIA | M438: Sí | N438: No | O438: No | P438: Contratado | Q438: Tiempo Completo | R438: 0 | S438: 40 | T438: 40 | U438: No | V438: No | W438: 2016 - I | X438: JEFE DE LIMPIEZA
A439: =R[-1]C+1 -> 439 | B439: YARLEQUE | C439: VILCHEZ | D439: LUIS ENRIQUE | E439: PERÚ | F439: 09962770 | G439: 2012-03-15T00:00:00.000 | H439: Sí | I439: BACHILLER | J439: EDUCACION | K439: UNIVERSIDAD SAN PEDRO DE CHIMBOTE | L439: PERÚ | M439: Sí | N439: No | O439: No | P439: Contratado | Q439: Tiempo Parcial | R439: 12 | S439: 0 | T439: 12 | U439: No | V439: No | W439: 2016 - I
A440: =R[-1]C+1 -> 440 | B440: YARLEQUE | C440: VILCHEZ | D440: NORMA MARIBEL | E440: PERÚ | F440: 09971583 | G440: 2012-08-27T00:00:00.000 | H440: Sí | I440: BACHILLER | J440: NUTRICION | K440: UNIVERSIDAD NACIONAL MAYOR DE SAN MARCOS | L440: PERÚ | M440: Sí | N440: No | O440: No | P440: Contratado | Q440: Tiempo Parcial | R440: 10 | S440: 0 | T440: 10 | U440: No | V440: No | W440: 2016 - I
A441: =R[-1]C+1 -> 441 | B441: YASUDA | C441: GOICOCHEA | D441: WALTER EDWIN | E441: PERÚ | F441: 06058263 | G441: 2016-03-02T00:00:00.000 | H441: No | I441: MAESTRO | J441: FINANZAS | K441: UNIVERSIDAD NACIONAL FEDERICO VILLAREAL | L441: PERÚ | M441: Sí | N441: No | O441: No | P441: Contratado | Q441: Tiempo Parcial | R441: 8 | S441: 0 | T441: 8 | U441: No | V441: Sí | W441: 2016 - I
A442: =R[-1]C+1 -> 442 | B442: YSEKI | C442: SALAZAR | D442: SANDRA PATRICIA | E442: PERÚ | F442: 06148522 | G442: 2012-04-02T00:00:00.000 | H442: Sí | I442: MAESTRO | J442: GERENCIA EN SALUD | K442: UNIVERSIDAD NACIONAL DEL CALLAO | L442: PERÚ | M442: Sí | N442: No | O442: No | P442: Contratado | Q442: Tiempo Parcial | R442: 4 | S442: 0 | T442: 4 | U442: No | V442: No | W442: 2016 - I
A443: =R[-1]C+1 -> 443 | B443: ZAMBRANO | C443: ANGULO | D443: VICTOR HUGO | E443: PERÚ | F443: 10265508 | G443: 2013-03-11T00:00:00.000 | H443: Sí | I443: MAESTRO | J443: MAGISTER SCIENTIAE ESPECIALIDAD MEJORAMIENTO GENETICO DE PLANTAS | K443: UNIVERSIDAD NACIONAL AGRARIA LA MOLINA | L443: PERÚ | M443: Sí | N443: No | O443: No | P443: Contratado | Q443: Tiempo Parcial | R443: 15 | S443: 0 | T443: 15 | U443: Sí | V443: Sí | W443: 2016 - I
A444: =R[-1]C+1 -> 444 | B444: ZAMBRANO | C444: GOICOCHEA | D444: JUAN ANTONIO | E444: PERÚ | F444: 06164675 | G444: 2016-03-05T00:00:00.000 | H444: No | I444: MAESTRO | J444: MAGISTER EN ADMNISTRACION DE LA EDUCACION | K444: UNIVERSIDAD CESAR VALLEJO | L444: PERÚ | M444: Sí | N444: No | O444: No | P444: Contratado | Q444: Tiempo Parcial | R444: 4 | S444: 0 | T444: 4 | U444: No | V444: No | W444: 2016 - I
A445: =R[-1]C+1 -> 445 | B445: ZANETTI | C445: GRANDEZ | D445: NICOLAS ALBERTO MARTIN | E445: PERÚ | F445: 40051853 | G445: 2014-03-15T00:00:00.000 | H445: Sí | I445: BACHILLER | J445: TECNOLOGIA MEDICA | K445: UNIVERSIDAD PERUANA CAYETANO HEREDIA | L445: PERÚ | M445: Sí | N445: No | O445: No | P445: Contratado | Q445: Tiempo Parcial | R445: 4 | S445: 0 | T445: 4 | U445: No | V445: No | W445: 2016 - I
A446: =R[-1]C+1 -> 446 | B446: ZAPATA | C446: CORRALES | D446: FELIX ALBERTO | E446: PERÚ | F446: 16727294 | G446: 2014-03-03T00:00:00.000 | H446: Sí | I446: BACHILLER | J446: CIENCIAS INGENIERIA AGRICOLA | K446: UNIVERSIDAD NACIONAL PEDRO RUIZ GALLO | L446: PERÚ | M446: Sí | N446: No | O446: No | P446: Contratado | Q446: Tiempo Parcial | R446: 15 | S446: 0 | T446: 15 | U446: No | V446: No | W446: 2016 - I
A447: =R[-1]C+1 -> 447 | B447: ZAPATA | C447: ROQUE | D447: JOSE CARLOS | E447: PERÚ | F447: 32102213 | G447: 2013-10-01T00:00:00.000 | H447: Sí | I447: BACHILLER | J447: INGENIERIA INDUSTRIAL | K447: UNIVERSIDAD NACIONAL DE TRUJILLO | L447: PERÚ | M447: Sí | N447: No | O447: No | P447: Contratado | Q447: Tiempo Completo | R447: 18 | S447: 22 | T447: 40 | U447: No | V447: Sí | W447: 2016 - I
A448: =R[-1]C+1 -> 448 | B448: ZARATE | C448: AGUILAR | D448: KARIN BELINDA | E448: PERÚ | F448: 41301023 | G448: 2010-09-01T00:00:00.000 | H448: Sí | I448: MAESTRO | J448: ECONOMIA | K448: UNIVERSITA DEGLI STUDI DI GENOVA | L448: ITALIA | M448: Sí | N448: No | O448: No | P448: Contratado | Q448: Tiempo Completo | R448: 12 | S448: 28 | T448: 40 | U448: No | V448: No | W448: 2016 - I
A449: =R[-1]C+1 -> 449 | B449: ZARATE | C449: HERMOZA | D449: JESUS ROBERTO | E449: PERÚ | F449: 08098554 | G449: 2008-09-10T00:00:00.000 | H449: Sí | I449: MAESTRO | J449: ADMINISTRACION DE NEGOCIOS MBA | K449: UNIVERSIDAD SAN INGNACIO DE LOYOLA | L449: PERÚ | M449: Sí | N449: Sí | O449: No | P449: Contratado | Q449: Tiempo Parcial | R449: 16 | S449: 0 | T449: 16 | U449: No | V449: No | W449: 2016 - I
A450: =R[-1]C+1 -> 450 | B450: ZARATE | C450: ROMAN | D450: MARISA CONSUELO | E450: PERÚ | F450: 09533788 | G450: 2001-09-17T00:00:00.000 | H450: Sí | I450: BACHILLER | J450: EDUCACION | K450: UNIVERSIDAD NACIONAL MAYOR DE SAN MARCOS | L450: PERÚ | M450: Sí | N450: No | O450: No | P450: Ordinario Asociado | Q450: Tiempo Completo | R450: 0 | S450: 40 | T450: 40 | U450: No | V450: No | W450: 2016 - I | X450: LSGH - DOCENTE NOMBRADO
A451: =R[-1]C+1 -> 451 | B451: ZAVALETA | C451: ARTEAGA | D451: MAGALI KATTY | E451: PERÚ | F451: 10650280 | G451: 2015-03-17T00:00:00.000 | H451: No | I451: MAESTRO | J451: MAGISTER EN EDUCACION CON MENCION EN DOCENCIA Y GESTION EDUCATIVA | K451: UNIVERSIDAD CESAR VALLEJO DE TRUJILLO | L451: PERÚ | M451: Sí | N451: No | O451: No | P451: Contratado | Q451: Tiempo Completo | R451: 14 | S451: 26 | T451: 40 | U451: No | V451: No | W451: 2016 - I
A452: =R[-1]C+1 -> 452 | B452: ZEVALLOS | C452: DE LAS CASAS | D452: LUISA INES | E452: PERÚ | F452: 06118755 | G452: 2000-05-02T00:00:00.000 | H452: Sí | I452: BACHILLER | J452: EDUCACION | K452: UNIVERSIDAD NACIONAL MAYOR DE SAN MARCOS | L452: PERÚ | M452: Sí | N452: No | O452: No | P452: Ordinario Auxiliar | Q452: Tiempo Completo | R452: 4 | S452: 36 | T452: 40 | U452: No | V452: No | W452: 2016 - I
A453: =R[-1]C+1 -> 453 | B453: ZUÑIGA | C453: ALVARADO DE LA ROSA | D453: NELIZA KELI | E453: PERÚ | F453: 41340477 | G453: 2008-02-01T00:00:00.000 | H453: Sí | I453: BACHILLER | J453: NUTRICION | K453: UNIVERSIDAD NACIONAL FEDERICO VILLAREAL | L453: PERÚ | M453: Sí | N453: No | O453: No | P453: Ordinario Auxiliar | Q453: Tiempo Parcial | R453: 14 | S453: 6 | T453: 20 | U453: No | V453: No | W453: 2016 - I
A454: =R[-1]C+1 -> 454 | B454: ZUÑIGA | C454: EURIBE | D454: ARTURO PAUL | E454: PERÚ | F454: 05343430 | G454: 2013-09-09T00:00:00.000 | H454: Sí | I454: BACHILLER | J454: CONTABILIDAD | K454: UNIVERSIDAD NACIONAL FEDERICO VILLAREAL | L454: PERÚ | M454: Sí | N454: No | O454: No | P454: Contratado | Q454: Tiempo Parcial | R454: 20 | S454: 0 | T454: 20 | U454: No | V454: No | W454: 2016 - I
A455: Nota: (1) La LU entró en vigencia el 10/07/2014. Seleccione “Sí”, si el docente se encontraba ejerciendo la docencia universitaria, a la entrada en vigencia de la Ley 30220; o también:. Seleccione “Sí”, si el docente se encontraba ejerciendo la docencia universitaria, en el periodo académico inmediatamente anterior a la entrada en vigencia de la Ley. En caso contrario a los casos anteriores, colocar “No”. (2) Colocar el mayor grado académico obtenido por el docente: Bachiller, Maestro, Doctor o sin grado academico. (3) Colocar el título de la mención que se otorga en el diploma del mayor grado académico obtenido. Se debe mantener el idioma en que se encuentra redactado (No traducir). (4) Según su categoría, los docentes pueden ser: ordinario principal, ordinario asociado, ordinario auxiliar, extraordinario o contratado. (5) Según su regimen de dedicación los docentes pueden ser: A tiempo completo, a tiempo parcial o a dedicación exclusiva. (6) Seleccionar “Sí”, si el docente es designado docente investigador por la universidad, de lo contrario seleccionar “No”. (7) Seleccionar “Sí”, si el docente está registrado en el Directorio Nacional de Investigadores e Innovadores DINA, de lo contrario seleccionar “No”. (8) Debe corresponder al ultimo periodo vigente.
A457: NOMBRE REPRESENTANTE LEGAL
A458: DECLARO BAJO JURAMENTO, LA VERACIDAD DE LA INFORMACIÓN Y DOCUMENTACIÓN PRESENTADA, PARA LA REVISIÓN DOCUMENTARIA EN EL PROCEDIMIENTO DE LICENCIAMIENTO DE ESTA UNIVERSIDAD; CASO CONTRARIO, ASUMO LA RESPONSABILIDAD ADMINISTRATIVA O PENAL QUE CORRESPONDA.